assignment_id,candidate_id,input_sha256,snapshot_sha256,batch_id,phase,title,authors,year,venue,doi,url,source_type
A-C0007-04,C0007,653a075d4d03fcce47d0dcef690e09bcf89ab6e2620be89eda3e7dfc01b0baae,c0977ed07d0c0bb25ea3a6be52e377f86d10bf3fff91d6bdccd389395e842c07,screening-04,main,ASAM OpenDRIVE,ASAM e.V.,2026,ASAM,NR,https://www.asam.net/standards/detail/opendrive/,standard
A-C0012-04,C0012,f2d916679807edb81c1cf1f7b5cf9822595a3e8926454f15a380bf4d074db277,c0977ed07d0c0bb25ea3a6be52e377f86d10bf3fff91d6bdccd389395e842c07,screening-04,main,Comparative Analysis of Metaheuristic Algorithms for Procedural Race Track Generation in Games,Sana Alyaseri; Andy Conner,2024,International Journal of Applied Metaheuristic Computing,10.4018/ijamc.350330,https://doi.org/10.4018/ijamc.350330,journal article
A-C0013-04,C0013,94548e2a00a0b0f023696203e8a62dd7ccb446a768f218af5918008b5facb7e1,c0977ed07d0c0bb25ea3a6be52e377f86d10bf3fff91d6bdccd389395e842c07,screening-04,main,Procedural Generation of Isometric Racetracks Using Chain Code for Racing Games,Erik Jhones F. do Nascimento; Tassiana M. Castro; Ana Carolina S. Abreu; Filipe A. Lira; Amauri H. Souza,2021,2021 20th Brazilian Symposium on Computer Games and Digital Entertainment (SBGames),10.1109/sbgames54170.2021.00025,https://doi.org/10.1109/sbgames54170.2021.00025,conference paper
A-C0014-04,C0014,55f4950e8708f51fdeda194464214025f1fa3249ead2b0c3598ca89158312a9c,c0977ed07d0c0bb25ea3a6be52e377f86d10bf3fff91d6bdccd389395e842c07,screening-04,main,Automatic Generation of Challenging Road Networks for ALKS Testing based on Bezier Curves and Search,Florian Klück;Lorenz Klampfl;Franz Wotawa,2021,arXiv,10.48550/arxiv.2103.01288,https://arxiv.org/abs/2103.01288,preprint
A-C0018-04,C0018,ef5a21936d1f3b2634a8a3611c1c9de32eb7c9cde1ff314c5fce8cd3373de535,c0977ed07d0c0bb25ea3a6be52e377f86d10bf3fff91d6bdccd389395e842c07,screening-04,main,CLUTR: Curriculum Learning via Unsupervised Task Representation Learning,Abdus Salam Azad; Izzeddin Gur; Jasper Emhoff; Nathaniel Alexis; Aleksandra Faust; Pieter Abbeel; Ion Stoica,2023,Proceedings of the 40th International Conference on Machine Learning,NR,https://proceedings.mlr.press/v202/azad23a.html,conference paper
A-C0020-04,C0020,aadd7562fb19f969deefbec656615fd7ddaa18dea14160b34214c082626fd2c6,c0977ed07d0c0bb25ea3a6be52e377f86d10bf3fff91d6bdccd389395e842c07,screening-04,main,Emergent Complexity and Zero-shot Transfer via Unsupervised Environment Design,Michael Dennis; Natasha Jaques; Eugene Vinitsky; Alexandre Bayen; Stuart J. Russell; Andrew Critch; Sergey Levine,2020,Advances in Neural Information Processing Systems 33,NR,https://proceedings.neurips.cc/paper_files/paper/2020/hash/985e9a46e10005356bbaf194249f6856-Abstract.html,conference paper
A-C0024-04,C0024,6fcb1d3f49e349a3554b24dd860f77be689e5425f187328398d9e0cbfc526131,c0977ed07d0c0bb25ea3a6be52e377f86d10bf3fff91d6bdccd389395e842c07,screening-04,main,Diversity-guided Search Exploration for Self-driving Cars Test Generation through Frenet Space Encoding,Timo Blattner;Christian Birchler;Timo Kehrer;Sebastiano Panichella,2024,Proceedings of the 17th ACM/IEEE International Workshop on Search-Based and Fuzz Testing,10.1145/3643659.3643926,https://doi.org/10.1145/3643659.3643926,conference paper
A-C0027-04,C0027,4794216b3ad9e41b6d6bdc2e452b71d3c122e5b8c5839ba4af9d34f4a43d975e,c0977ed07d0c0bb25ea3a6be52e377f86d10bf3fff91d6bdccd389395e842c07,screening-04,main,Learning Generalizable Policy for Obstacle-Aware Autonomous Drone Racing,Yueqian Liu,2024,arXiv,10.48550/arxiv.2411.04246,https://arxiv.org/abs/2411.04246,preprint
A-C0029-04,C0029,04a7d999e2d3de9802d683ca45611a74e737899ab3484d46b783d2c929777c58,c0977ed07d0c0bb25ea3a6be52e377f86d10bf3fff91d6bdccd389395e842c07,screening-04,main,Outracing champion Gran Turismo drivers with deep reinforcement learning,Peter R. Wurman; Samuel Barrett; Kenta Kawamoto; James MacGlashan; Kaushik Subramanian; Thomas J. Walsh; Roberto Capobianco; Alisa Devlic; Franziska Eckert; Florian Fuchs; Leilani Gilpin; Piyush Khandelwal; Varun Kompella; HaoChih Lin; Patrick MacAlpine; Declan Oller; Takuma Seno; Craig Sherstan; Michael D. Thomure; Houmehr Aghabozorgi; Leon Barrett; Rory Douglas; Dion Whitehead; Peter Dürr; Peter Stone; Michael Spranger; Hiroaki Kitano,2022,Nature,10.1038/s41586-021-04357-7,https://www.nature.com/articles/s41586-021-04357-7,journal article
A-C0036-04,C0036,ab75449d53b5d05e4ebf1d13eae130d1439a5a70b57e1e23740db7d62a9b5e4c,c0977ed07d0c0bb25ea3a6be52e377f86d10bf3fff91d6bdccd389395e842c07,screening-04,main,Generating a Racing Line for an Autonomous Racecar Using Professional Driving Techniques,Paul A. Theodosis; J. Christian Gerdes,2011,"ASME 2011 Dynamic Systems and Control Conference and Bath/ASME Symposium on Fluid Power and Motion Control, Volume 2",10.1115/dscc2011-6097,https://doi.org/10.1115/DSCC2011-6097,conference paper
A-C0038-04,C0038,323b38ef6efa3ca395f319ee5672f29db32c448d1a20d48175eff51d99e48f00,c0977ed07d0c0bb25ea3a6be52e377f86d10bf3fff91d6bdccd389395e842c07,screening-04,main,Minimum curvature trajectory planning and control for an autonomous race car,Alexander Heilmeier; Alexander Wischnewski; Leonhard Hermansdorfer; Johannes Betz; Markus Lienkamp; Boris Lohmann,2020,Vehicle System Dynamics,10.1080/00423114.2019.1631455,https://doi.org/10.1080/00423114.2019.1631455,journal article
A-C0039-04,C0039,c35f5e7233b83bdbdbc684fb9bea98ad46262af2a0411f759f7b5c2ef2bc44e6,c0977ed07d0c0bb25ea3a6be52e377f86d10bf3fff91d6bdccd389395e842c07,screening-04,main,Optimization of the Driving Line on a Race Track,Martin Mühlmeier; Norbert Müller,2002,Motorsports Engineering Conference & Exhibition,10.4271/2002-01-3339,https://doi.org/10.4271/2002-01-3339,conference technical paper
A-C0047-04,C0047,b65a48696192905ad251a8cfc7cd5b6f8024a73c111b145e8bf51b77560858ab,c0977ed07d0c0bb25ea3a6be52e377f86d10bf3fff91d6bdccd389395e842c07,screening-04,main,ChickenKorma/Track-Generator,ChickenKorma,2022,GitHub repository,NR,https://github.com/ChickenKorma/Track-Generator,software repository
A-C0052-04,C0052,162274daa192dc64149cfeceb10f2f100ec92df244a8c659d7e95c8a3126998f,c0977ed07d0c0bb25ea3a6be52e377f86d10bf3fff91d6bdccd389395e842c07,screening-04,main,Procedural modeling of cities,Yoav I. H. Parish; Pascal Müller,2001,Proceedings of the 28th annual conference on Computer graphics and interactive techniques,10.1145/383259.383292,https://doi.org/10.1145/383259.383292,conference paper
A-C0056-04,C0056,f158305a6e3f7515ca6e060f23e5d221862f78b6f7f9bd98995359382924e619,c0977ed07d0c0bb25ea3a6be52e377f86d10bf3fff91d6bdccd389395e842c07,screening-04,main,On the minimum ropelength of knots and links,Jason Cantarella; Robert B. Kusner; John M. Sullivan,2002,Inventiones mathematicae,10.1007/s00222-002-0234-y,https://link.springer.com/article/10.1007/s00222-002-0234-y,journal article
A-C0058-04,C0058,c6152a74e070cd716162a4660a39b6ac8bf5b5fe05df6d9383a15104697e4ecc,c0977ed07d0c0bb25ea3a6be52e377f86d10bf3fff91d6bdccd389395e842c07,screening-04,main,From Generation to Gameplay: Authoring Race Tracks With Repulsive Curves,Lasse Henrich;Falko Kötter,2025,IEEE Transactions on Games,10.1109/tg.2025.3561107,https://doi.org/10.1109/tg.2025.3561107,journal article
A-C0060-04,C0060,a19d8413d12ad77aaa924c7abe50b2a915f5009ac8979fb1fdc84bacd795edac,c0977ed07d0c0bb25ea3a6be52e377f86d10bf3fff91d6bdccd389395e842c07,screening-04,main,Position Based Dynamics,Matthias Müller; Bruno Heidelberger; Marcus Hennix; John Ratcliff,2007,Journal of Visual Communication and Image Representation,10.1016/j.jvcir.2007.01.005,https://doi.org/10.1016/j.jvcir.2007.01.005,journal article
A-C0067-04,C0067,21aa645980f3f67d1af56d1b01840dea5cc01ae483a2a3792d8daa58db6dde59,c0977ed07d0c0bb25ea3a6be52e377f86d10bf3fff91d6bdccd389395e842c07,screening-04,main,Towards automatic personalised content creation for racing games,Julian Togelius; Renzo De Nardi; Simon M. Lucas,2007,2007 IEEE Symposium on Computational Intelligence and Games,10.1109/cig.2007.368106,https://doi.org/10.1109/cig.2007.368106,conference paper
A-C0069-04,C0069,4e5318db205969039473bbf5a79db13ac973686173ab4ff18ce150d1ae536586,c0977ed07d0c0bb25ea3a6be52e377f86d10bf3fff91d6bdccd389395e842c07,screening-04,main,Experience-Driven Procedural Content Generation,Georgios N. Yannakakis; Julian Togelius,2011,IEEE Transactions on Affective Computing,10.1109/t-affc.2011.6,https://doi.org/10.1109/T-AFFC.2011.6,journal article
A-C0073-04,C0073,a39c55a6670c95ae63c5e4e3c6e2f7b71e88bebde12e3c9fade3fb0c3e8e8714,c0977ed07d0c0bb25ea3a6be52e377f86d10bf3fff91d6bdccd389395e842c07,screening-04,main,Deep Drone Racing: Learning Agile Flight in Dynamic Environments,Elia Kaufmann; Antonio Loquercio; Rene Ranftl; Alexey Dosovitskiy; Vladlen Koltun; Davide Scaramuzza,2018,Proceedings of The 2nd Conference on Robot Learning,NR,https://proceedings.mlr.press/v87/kaufmann18a.html,conference paper
A-C0085-04,C0085,fd4536fe56093f4509ed2b942f54447d3d212f4a5855c19297ead07d379dddfd,c0977ed07d0c0bb25ea3a6be52e377f86d10bf3fff91d6bdccd389395e842c07,screening-04,main,Optimization-based autonomous racing of 1:43 scale RC cars,Alexander Liniger;Alexander Domahidi;Manfred Morari,2015,Optimal Control Applications and Methods,10.1002/oca.2123,https://doi.org/10.1002/oca.2123,journal article
A-C0087-04,C0087,435d4a88445f91e391b451cb92fb1b21c311e6436f26a544c5e28a7c0a6e0904,c0977ed07d0c0bb25ea3a6be52e377f86d10bf3fff91d6bdccd389395e842c07,screening-04,main,Indy Autonomous Challenge - Autonomous Race Cars at the Handling Limits,Alexander Wischnewski; Maximilian Geisslinger; Johannes Betz; Tobias Betz; Felix Fent; Alexander Heilmeier; Leonhard Hermansdorfer; Thomas Herrmann; Sebastian Huch; Phillip Karle; Felix Nobis; Levent Ögretmen; Matthias Rowold; Florian Sauerbeck; Tim Stahl; Rainer Trauth; Markus Lienkamp; Boris Lohmann,2022,12th International Munich Chassis Symposium 2021,10.1007/978-3-662-64550-5_10,https://doi.org/10.1007/978-3-662-64550-5_10,book chapter; conference paper
A-C0091-04,C0091,da87b4861aac8f4a7787d280e9ca5165a9d59265c4f32db3ab6acf7a10747f98,c0977ed07d0c0bb25ea3a6be52e377f86d10bf3fff91d6bdccd389395e842c07,screening-04,main,AI Racing Tech,AI Racing Tech,2020,Official team website,NR,https://www.airacingtech.com/about-us,competition system; official website
A-C0092-04,C0092,d0d4e1d3ceb080ca4dd67f12216d69813e9eebc304ba87cfa812e5dc7b89dec5,c0977ed07d0c0bb25ea3a6be52e377f86d10bf3fff91d6bdccd389395e842c07,screening-04,main,Learning Model Predictive Control with Error Dynamics Regression for Autonomous Racing,Haoru Xue;Edward L. Zhu;John M. Dolan;Francesco Borrelli,2024,2024 IEEE International Conference on Robotics and Automation (ICRA),10.1109/icra57147.2024.10611628,https://doi.org/10.1109/icra57147.2024.10611628,conference paper
A-C0093-04,C0093,9382c493b51a4e7e0b40f65f7c9eed60d8863587ea15502315d3d64d2fb582c5,c0977ed07d0c0bb25ea3a6be52e377f86d10bf3fff91d6bdccd389395e842c07,screening-04,main,Towards Safety Assured End-to-End Vision-Based Control for Autonomous Racing,Dvij Kalaria; Qin Lin; John M. Dolan,2023,arXiv,10.48550/arxiv.2303.02267,https://arxiv.org/abs/2303.02267,preprint
A-C0096-04,C0096,71580b3ca6fb23cbd19c06bcd563cbf13673fa58b701ba69bde36b6f71441647,c0977ed07d0c0bb25ea3a6be52e377f86d10bf3fff91d6bdccd389395e842c07,screening-04,main,Autonomous Vehicles on the Edge: A Survey on Autonomous Vehicle Racing,Johannes Betz; Hongrui Zheng; Alexander Liniger; Ugo Rosolia; Phillip Karle; Madhur Behl; Venkat Krovi; Rahul Mangharam,2022,IEEE Open Journal of Intelligent Transportation Systems,10.1109/ojits.2022.3181510,https://doi.org/10.1109/ojits.2022.3181510,journal article
A-C0098-04,C0098,e3f0657df14bf1555b173f7982ef6a4ff60618c4e335f2d56f5db0ac9cfeb19d,c0977ed07d0c0bb25ea3a6be52e377f86d10bf3fff91d6bdccd389395e842c07,screening-04,main,OpenStreetMap,OpenStreetMap contributors,NR,OpenStreetMap project,NR,https://www.openstreetmap.org/,geospatial dataset and platform
A-C0101-04,C0101,b70d933eead435e9c5c5c2cce51e890f3500749a3866e7c1d1601b4fe84fc51a,c0977ed07d0c0bb25ea3a6be52e377f86d10bf3fff91d6bdccd389395e842c07,screening-04,main,Using Genetic Algorithms for Automating Automated Lane-Keeping System Testing,Lorenz Klampfl; Florian Klück; Franz Wotawa,2022,Journal of Software: Evolution and Process,10.1002/smr.2520,https://doi.org/10.1002/smr.2520,journal article
A-C0103-04,C0103,249407af9385a25fd91226a5576efca519f18a071cc89e6e92798265d1c430ab,c0977ed07d0c0bb25ea3a6be52e377f86d10bf3fff91d6bdccd389395e842c07,screening-04,main,Machine learning-based test selection for simulation-based testing of self-driving cars software,Christian Birchler;Sajad Khatiri;Bill Bosshard;Alessio Gambi;Sebastiano Panichella,2023,Empirical Software Engineering,10.1007/s10664-023-10286-y,https://doi.org/10.1007/s10664-023-10286-y,journal article
A-C0104-04,C0104,9044f371e3a462514df11fbdd7223e5911ec1bfae4adbf97c06d56b07695327f,c0977ed07d0c0bb25ea3a6be52e377f86d10bf3fff91d6bdccd389395e842c07,screening-04,main,Air Learning: a deep reinforcement learning gym for autonomous aerial robot visual navigation,Srivatsan Krishnan; Behzad Boroujerdian; William Fu; Aleksandra Faust; Vijay Janapa Reddi,2021,Machine Learning,10.1007/s10994-021-06006-6,https://link.springer.com/article/10.1007/s10994-021-06006-6,journal article
A-C0111-04,C0111,30b2c8362ac751e4efbc873968b98ddf089563b83933d17a3ffb6ef0afcf0b6f,c0977ed07d0c0bb25ea3a6be52e377f86d10bf3fff91d6bdccd389395e842c07,screening-04,main,Learning vision-based agile flight via differentiable physics,Yuang Zhang; Yu Hu; Yunlong Song; Danping Zou; Weiyao Lin,2025,Nature Machine Intelligence,10.1038/s42256-025-01048-0,https://www.nature.com/articles/s42256-025-01048-0,journal article
A-C0113-04,C0113,3126896692d1e0fa80a7fe1008500a5984a2762cabee06921434353b0e48a774,c0977ed07d0c0bb25ea3a6be52e377f86d10bf3fff91d6bdccd389395e842c07,screening-04,main,Evolving A Diverse Collection of Robot Path Planning Problems,D. A. Ashlock; T. W. Manikas; K. Ashenayi,2006,2006 IEEE International Conference on Evolutionary Computation,10.1109/cec.2006.1688530,https://doi.org/10.1109/cec.2006.1688530,conference paper
A-C0115-04,C0115,8c1eae977ae799ce173bafcf2431daf97a1ca0661ee1d4cdc9042cac13031539,c0977ed07d0c0bb25ea3a6be52e377f86d10bf3fff91d6bdccd389395e842c07,screening-04,main,Personalised track design in car racing games,Theodosis Georgiou; Yiannis Demiris,2016,2016 IEEE Conference on Computational Intelligence and Games (CIG),10.1109/cig.2016.7860435,https://doi.org/10.1109/cig.2016.7860435,conference paper
A-C0123-04,C0123,4eee3f1a88002798ebb1c783296dcc87563b5fda9d1fa76debadfe6d1d2dc43f,c0977ed07d0c0bb25ea3a6be52e377f86d10bf3fff91d6bdccd389395e842c07,screening-04,main,Quality Metrics and Oracles for Autonomous Vehicles Testing,Gunel Jahangirova; Andrea Stocco; Paolo Tonella,2021,"2021 14th IEEE Conference on Software Testing, Verification and Validation (ICST)",10.1109/icst49551.2021.00030,https://doi.org/10.1109/ICST49551.2021.00030,conference paper
A-C0129-04,C0129,ba6d36662a157a6e409b9f15a838c1604cc71318f15e9d8d35e6b790c1d34991,c0977ed07d0c0bb25ea3a6be52e377f86d10bf3fff91d6bdccd389395e842c07,screening-04,main,OmniDrones: An Efficient and Flexible Platform for Reinforcement Learning in Drone Control,Botian Xu; Feng Gao; Chao Yu; Ruize Zhang; Yi Wu; Yu Wang,2024,IEEE Robotics and Automation Letters,10.1109/lra.2024.3356168,https://arxiv.org/abs/2309.12825,journal article
A-C0137-04,C0137,ff6fdc70a319a411be0b94f0bf28237176c6816a5affa66e4fc3ca36df611078,c0977ed07d0c0bb25ea3a6be52e377f86d10bf3fff91d6bdccd389395e842c07,screening-04,main,Preliminary Evaluation of Path-aware Crossover Operators for Search-Based Test Data Generation for Autonomous Driving,Seunghee Han; Jaeuk Kim; Geon Kim; Jaemin Cho; Jiin Kim; Shin Yoo,2021,2021 IEEE/ACM 14th International Workshop on Search-Based Software Testing (SBST),10.1109/sbst52555.2021.00020,https://doi.org/10.1109/SBST52555.2021.00020,workshop paper
A-C0138-04,C0138,87fcc5c4cf644dc09830ed22ec7e2dc6d8fa7b0947d4362c91f2d0e1b161da96,c0977ed07d0c0bb25ea3a6be52e377f86d10bf3fff91d6bdccd389395e842c07,screening-04,main,Autonomous Port Navigation With Ranging Sensors Using Model-Based Reinforcement Learning,Siemen Herremans;Ali Anwar;Arne Troch;Ian Ravijts;Maarten Vangeneugden;Siegfried Mercelis;Peter Hellinckx,2023,"ASME 2023 42nd International Conference on Ocean, Offshore and Arctic Engineering",10.1115/omae2023-104455,https://doi.org/10.1115/omae2023-104455,conference paper
A-C0148-04,C0148,2912f6f26f9e374aca3e18b3457d16ff695e79f4eb3b74a0c99115d370944ab1,c0977ed07d0c0bb25ea3a6be52e377f86d10bf3fff91d6bdccd389395e842c07,screening-04,main,Complexity controllable road network generation for virtual testing of autonomous driving,Yu Zhu; Jiaxin Wang; Shaoxin Yuan; Zhigang Xu; Xiaobo Qu,2026,Communications in Transportation Research,10.26599/commtr.2026.9640024,https://doi.org/10.26599/commtr.2026.9640024,journal article
A-C0149-04,C0149,8fc2a263a9e2f6c15e3112f2e3b0c91d946bebfd9bfeebba129737bac2ae13e0,c0977ed07d0c0bb25ea3a6be52e377f86d10bf3fff91d6bdccd389395e842c07,screening-04,main,Deep Reinforcement Learning Controller for 3D Path Following and Collision Avoidance by Autonomous Underwater Vehicles,Simen Theie Havenstrøm; Adil Rasheed; Omer San,2021,Frontiers in Robotics and AI,10.3389/frobt.2020.566037,https://www.frontiersin.org/journals/robotics-and-ai/articles/10.3389/frobt.2020.566037/full,journal article
A-C0150-04,C0150,34a1638a24052f13c4d7f8b0fed5f2ee0c37353d108114174e928672ed9c72b5,c0977ed07d0c0bb25ea3a6be52e377f86d10bf3fff91d6bdccd389395e842c07,screening-04,main,Navigation Scenario Permutation Model for Training of Maritime Autonomous Surface Ship Remote Operators,Taemin Hwang; Ik-Hyun Youn,2022,Applied Sciences,10.3390/app12031651,https://www.mdpi.com/2076-3417/12/3/1651,journal article
A-C0155-04,C0155,53fb16f805f44b8d105fa0afd0f5cb8b6e287dd567f99237458001893c1615d6,c0977ed07d0c0bb25ea3a6be52e377f86d10bf3fff91d6bdccd389395e842c07,screening-04,main,Open-Ended Learning Strategies for Learning Complex Locomotion Skills,Fangqin Zhou; Joaquin Vanschoren,2022,arXiv,10.48550/arxiv.2206.06796,https://arxiv.org/abs/2206.06796,preprint
A-C0156-04,C0156,1702ddb8989daae69071bbe63669db612707c119a62d8a57c46400b0e2173b53,c0977ed07d0c0bb25ea3a6be52e377f86d10bf3fff91d6bdccd389395e842c07,screening-04,main,FLYOVER: A Model-Driven Method to Generate Diverse Highway Interchanges for Autonomous Vehicle Testing,Yuan Zhou; Gengjie Lin; Yun Tang; Kairui Yang; Wei Jing; Ping Zhang; Junbo Chen; Liang Gong; Yang Liu,2023,arXiv,10.48550/arxiv.2301.12738,https://arxiv.org/abs/2301.12738,preprint
A-C0163-04,C0163,8b563ba1f43d97259f8066842019926dd6ce55bd3e92da7789683db56e26c788,c0977ed07d0c0bb25ea3a6be52e377f86d10bf3fff91d6bdccd389395e842c07,screening-04,main,RoadGen: Generating Road Scenarios for Autonomous Vehicle Testing,Fan Yang; You Lu; Bihuan Chen; Peng Qin; Xin Peng,2024,arXiv,10.48550/arxiv.2411.19577,https://arxiv.org/abs/2411.19577,preprint
A-C0178-04,C0178,9fd6da8d8bef90cb84758affb3d4bf22783420af98abe0db0dd3bd0b8f12d37d,c0977ed07d0c0bb25ea3a6be52e377f86d10bf3fff91d6bdccd389395e842c07,screening-04,main,EUFS maps,Edinburgh University Formula Student,2023,Official GitLab repository,NR,https://gitlab.com/eufs/public/eufs_maps,track dataset repository
A-C0184-04,C0184,ae4622473c59f30c53b60051463d86c181a05e81164b2cf2b49626ed46896a6a,c0977ed07d0c0bb25ea3a6be52e377f86d10bf3fff91d6bdccd389395e842c07,screening-04,main,Formula Student Driverless Simulator 2.2.0,FS-Driverless,2023,GitHub release and official documentation,NR,https://github.com/FS-Driverless/Formula-Student-Driverless-Simulator/releases/tag/v2.2.0,software release; official documentation
A-C0189-04,C0189,1e59aea3a8f04a96a76f979e28954bfad2105b12747b0b33448aa067a5bc3577,c0977ed07d0c0bb25ea3a6be52e377f86d10bf3fff91d6bdccd389395e842c07,screening-04,main,TUMFTM/laptime-simulation,TUM - Institute of Automotive Technology,2020,GitHub repository,NR,https://github.com/TUMFTM/laptime-simulation,software repository
A-C0190-04,C0190,dc9e85e74c706929780de166f7b420051f784ac44f928d4931795897749bf121,c0977ed07d0c0bb25ea3a6be52e377f86d10bf3fff91d6bdccd389395e842c07,screening-04,main,Learning to Walk in Minutes Using Massively Parallel Deep Reinforcement Learning,Nikita Rudin; David Hoeller; Philipp Reist; Marco Hutter,2022,Proceedings of the 5th Conference on Robot Learning,NR,https://proceedings.mlr.press/v164/rudin22a.html,conference paper
A-C0192-04,C0192,29b2f6d0d43e0506e6b6cd75d02d37a6dc7a54bb2824a753be997f3755ec4ab4,c0977ed07d0c0bb25ea3a6be52e377f86d10bf3fff91d6bdccd389395e842c07,screening-04,main,OpenDRIVE standalone mode,CARLA Team,2021,CARLA 0.9.12 documentation,NR,https://carla.readthedocs.io/en/0.9.12/adv_opendrive/,software documentation
A-C0195-04,C0195,04d19c07cb52cfdcb7518a398052d821440ff5c70cf9bce820dda08cfafcb27d,c0977ed07d0c0bb25ea3a6be52e377f86d10bf3fff91d6bdccd389395e842c07,screening-04,main,Race Track Database,TUMFTM contributors,2020,GitHub repository,NR,https://github.com/TUMFTM/racetrack-database,dataset; official repository
A-C0200-04,C0200,928d59c23a4b57f634f5df96ef1acb422b7d7b7f40cdcb093ab6aae542fce809,c0977ed07d0c0bb25ea3a6be52e377f86d10bf3fff91d6bdccd389395e842c07,screening-04,main,RobotX 2026 | Team Handbook,"RoboNation, Inc.; U.S. Office of Naval Research",2026,Maritime RobotX Challenge,NR,https://robonation.org/app/uploads/sites/2/2026/06/RobotX-2026_Team-Handbook-20260625.pdf,competition specification
A-C0202-04,C0202,2b82ac56280f2ee99add75d371c1c4f7ad2063112267ea479a638ed8faed2c39,c0977ed07d0c0bb25ea3a6be52e377f86d10bf3fff91d6bdccd389395e842c07,screening-04,main,Scenario Dreamer: Vectorized Latent Diffusion for Generating Driving Simulation Environments,Luke Rowe; Roger Girgis; Anthony Gosselin; Liam Paull; Christopher Pal; Felix Heide,2025,Proceedings of the IEEE/CVF Conference on Computer Vision and Pattern Recognition,10.1109/cvpr52734.2025.01604,https://openaccess.thecvf.com/content/CVPR2025/html/Rowe_Scenario_Dreamer_Vectorized_Latent_Diffusion_for_Generating_Driving_Simulation_Environments_CVPR_2025_paper.html,conference paper
A-C0203-04,C0203,5ea86ffb191b9180dcebab390b2880aadf9b83e1dabbcf40cc53220384831d18,c0977ed07d0c0bb25ea3a6be52e377f86d10bf3fff91d6bdccd389395e842c07,screening-04,main,SDF worlds,Open Robotics,NR,Gazebo Harmonic Documentation,NR,https://gazebosim.org/docs/harmonic/sdf_worlds/,official documentation
A-C0204-04,C0204,1913a494b08bf1889d6c8a1f86c81d8f602b920ed1de977b7b57ac4c135a1236,c0977ed07d0c0bb25ea3a6be52e377f86d10bf3fff91d6bdccd389395e842c07,screening-04,main,Pose Frame Semantics Tutorial,Open Source Robotics Foundation,2020,SDFormat 1.7 official documentation,NR,https://sdformat.org/tutorials/specification/pose_frame_semantics/1.7/,official standard documentation
A-C0206-04,C0206,5ea269dcd44aa22b771eb6e0a595f9e804e6b0fd17cdd2da8cdc15e3e0fd7b3c,c0977ed07d0c0bb25ea3a6be52e377f86d10bf3fff91d6bdccd389395e842c07,screening-04,main,Team Handbook Njord 2026,Njord - The Autonomous Ship Challenge,2026,Official competition handbook,NR,https://njord.gitbook.io/2026/,official competition specification
A-C0209-04,C0209,c36aa7113d79012a4fa6acf92bbb1ec9478002e8eb33a0eccf092cc536dc0f69,c0977ed07d0c0bb25ea3a6be52e377f86d10bf3fff91d6bdccd389395e842c07,screening-04,main,VRX 2023 Task Descriptions,RoboNation,2023,Virtual RobotX 2023 Competition,NR,https://robonation.org/app/uploads/sites/2/2023/07/VRX2023_Task-Descriptions_v1.2.pdf,competition specification
A-C0210-04,C0210,b085a47dfae1d65c0b3f13c29af1055fe2c604f6e7187c3bc51d543d97680958,c0977ed07d0c0bb25ea3a6be52e377f86d10bf3fff91d6bdccd389395e842c07,screening-04,main,VRX Automated Evaluation,Open Robotics,NR,GitHub,NR,https://github.com/osrf/vrx-docker,competition evaluation repository
