assignment_id,phase,candidate_id,input_sha256,snapshot_sha256,batch_id,coder_id,screened_on,screening_status,criterion,access_status,source_urls,evidence_version,evidence_retrieved_on,evidence_archive_url,evidence_sha256,screening_locator,exclusion_reason,notes
A-C0017-02,calibration,C0017,2733b7bb769f30f0681c279b136b38b5a50397a3e06f151cf369f4d8ed92339e,d91b44f278376601725a8290d24c75326d02808513f3e6c40f77b89493d6f14f,screening-02,screening-02,2026-07-02,included,include-relevant,official_documentation,https://gymnasium.farama.org/environments/box2d/car_racing/,unversioned@2026-07-02,2026-07-02,NR,55c93c5b473988bd3c860d2c26cc64d4263e58d447a17f81216235d87e44fef3,#description;#rewards,NR,NR
A-C0090-02,calibration,C0090,dae56f6a8f05d62e85e65bf595ddac57b522178d7c085e006c298d720d1a3a8a,d91b44f278376601725a8290d24c75326d02808513f3e6c40f77b89493d6f14f,screening-02,screening-02,2026-07-02,excluded,exclude-out-of-scope,full_text,https://www.ri.cmu.edu/robotics-groups/driverless-intelligent-vehicles-lab/,unversioned@2026-07-02,2026-07-02,NR,1dadb909338c2dd0a5997b144cb44272be84c8e0101ace27256083cdccded4aa,"main content, paragraph beginning 'The DRIVE Lab performs research on behaviors, planning, control, and perception'","The official lab page describes lab-wide autonomous-vehicle research and racing emphases, but no course geometry, course representation, generator, generated-course metric, or transferable fixed-course artifact.",NR
A-C0110-02,calibration,C0110,6ba821e89c9ef39a58f6b77a4084c3c0e13fb8e5196ed444cac363b6edc432f4,d91b44f278376601725a8290d24c75326d02808513f3e6c40f77b89493d6f14f,screening-02,screening-02,2026-07-02,excluded,exclude-insufficient-detail,abstract_only,https://dblp.org/rec/journals/scp/ArcainiC24.html;https://doi.org/10.1016/j.scico.2024.103171;https://www.sciencedirect.com/science/article/abs/pii/S0167642324000947,doi:10.1016/j.scico.2024.103171,2026-07-02,NR,ac74ee51b70529b8558d541384b0a02bd562f18c16c312e7a579465a55470d8c,"DBLP record, 'access: closed' metadata","The publisher record is closed and no full report, repository, or author copy was accessible; the available bibliographic material contains no inspectable methods or results sufficient to support a course-generation claim.","Exhaustive retrieval attempted DOI and publisher records; exact title-and-author searches via Crossref, OpenAlex, Semantic Scholar, DBLP, and GitHub found no accessible full text or authoritative companion artifact."
A-C0131-02,calibration,C0131,118c1b98dd96fc07c875cc48164eda3193cb942d3f1972e4f277c369da4a9d3b,d91b44f278376601725a8290d24c75326d02808513f3e6c40f77b89493d6f14f,screening-02,screening-02,2026-07-02,excluded,exclude-out-of-scope,official_documentation,https://raw.githubusercontent.com/ntnu-arl/aerial_gym_simulator/v2.0.0/docs/4_simulation_components.md,v2.0.0,2026-07-02,https://raw.githubusercontent.com/ntnu-arl/aerial_gym_simulator/v2.0.0/docs/4_simulation_components.md,af05e2c0e11366a6b85cabfb94e398979f03ae16a5365d5b3195a68c24f5b267,docs/4_simulation_components.md:121-123;docs/4_simulation_components.md:381-386,"The version-pinned documentation specifies random obstacle placement in bounded simulation environments and user-selected navigation tasks, not an ordered course, route, gate sequence, or reusable course representation.",NR
A-C0172-02,calibration,C0172,6b956ca92ac20af85bd908a9d10f88823428230357fac2b78c8a89ae37660e78,d91b44f278376601725a8290d24c75326d02808513f3e6c40f77b89493d6f14f,screening-02,screening-02,2026-07-02,included,include-relevant,official_documentation,https://publications.pages.asam.net/standards/ASAM_OpenSCENARIO/ASAM_OpenSCENARIO_XML/v1.3.0/06_general_concepts/06_08_routes.html,v1.3.0,2026-07-02,https://publications.pages.asam.net/standards/ASAM_OpenSCENARIO/ASAM_OpenSCENARIO_XML/v1.3.0/06_general_concepts/06_08_routes.html,d8e9d8da0b1951bffb2ab521e129e0220ee99b6ac66161477a42e545684cde0c,Section 6.8.2 'Explicitly assigned route',NR,Adjacent-domain mapping: the standard's ordered road-network waypoints and route strategies map directly to an ordered robot-course route representation.
A-C0177-02,calibration,C0177,99c6a1aad8bb74d06e4c377c0775626cd6fab4f8a936213fd4c011acf0c5fe98,d91b44f278376601725a8290d24c75326d02808513f3e6c40f77b89493d6f14f,screening-02,screening-02,2026-07-02,included,include-relevant,full_text,https://proceedings.mlr.press/v119/wang20l/wang20l.pdf,PMLR-v119,2026-07-02,https://proceedings.mlr.press/v119/wang20l/wang20l.pdf,6a01e35d2d0a6ee93015824d3fd2789997057fd604f9389089d5fe04d28c10ab,"p. 3, Section 3.1; pp. 4-5, Section 4 'More Expressive Environment Encoding'",NR,"Adjacent-domain mapping: the CPPN environmental encoding generates obstacle-course geometry from coordinates and parameters, which maps to parameterized robot-course geometry."
A-C0180-02,calibration,C0180,7de2841538f3416ceb4ac5d4df3c929db07ecda8774210d214694aa5b1dde6e2,d91b44f278376601725a8290d24c75326d02808513f3e6c40f77b89493d6f14f,screening-02,screening-02,2026-07-02,boundary,boundary,full_text,https://proceedings.mlr.press/v123/o-kelly20a/o-kelly20a.pdf,PMLR-v123,2026-07-02,https://proceedings.mlr.press/v123/o-kelly20a/o-kelly20a.pdf,45e171299565b5c99026c1e589b0c74dd73bebc69c72449ef86009446d77699d,"p. 77, Section 1; p. 82, Section 5 'Benchmark 1: Static Kinodynamic Planning'",NR,Boundary transfer: fixed-track evaluation specifies lap time and collision-free traversal as citable course-performance requirements.
A-C0187-02,calibration,C0187,08262d5229c960fbe17821dcec3d2104667c72a7556ef19faef7a2a859b281a4,d91b44f278376601725a8290d24c75326d02808513f3e6c40f77b89493d6f14f,screening-02,screening-02,2026-07-02,excluded,exclude-out-of-scope,official_documentation,https://byu-holoocean.github.io/holoocean-docs/v1.0.0/usage/scenarios.html,v1.0.0,2026-07-02,https://byu-holoocean.github.io/holoocean-docs/v1.0.0/usage/scenarios.html,d1c51cac66c5dd9ebb83402605a2815dae24eeb5642eea950e598ac356284961,#what-is-a-scenario;#scenario-file-format;#location-randomization,"The documentation loads an unchanged world and configures agents, sensors, and randomized agent poses; it defines no course geometry, route, gate sequence, course generator, or generated-course measure.",NR
A-C0198-02,calibration,C0198,45152e4af64d65df763015f4b264a0e196b2d2da7653273f63322822d567f412,d91b44f278376601725a8290d24c75326d02808513f3e6c40f77b89493d6f14f,screening-02,screening-02,2026-07-02,boundary,boundary,full_text,https://robonation.org/app/uploads/sites/3/2025/10/RoboBoat-2026-Team-Handbook_111125.pdf,2026-Team-Handbook-2025-11-11,2026-07-02,https://robonation.org/app/uploads/sites/3/2025/10/RoboBoat-2026-Team-Handbook_111125.pdf,ee93f4b9775a646657cde91b442f4ed2daedc6f68e3db54e04316bea8e3b2d69,"pp. 45-48, Sections 3.2.1-3.2.2",NR,"Boundary transfer: the fixed competition course requires autonomous gate and channel traversal, obstacle avoidance, and reporting of completion time and position."
