assignment_id,phase,candidate_id,input_sha256,snapshot_sha256,batch_id,coder_id,screened_on,screening_status,criterion,access_status,source_urls,evidence_version,evidence_retrieved_on,evidence_archive_url,evidence_sha256,screening_locator,exclusion_reason,notes
A-C0011-03,calibration,C0011,dc791af7b6c6c44278f888815e40255f691ad29979e39d4d6d86190a67a2824e,d91b44f278376601725a8290d24c75326d02808513f3e6c40f77b89493d6f14f,screening-03,screening-03,2026-07-02,included,include-relevant,full_text,http://ijeei.org/docs-1804133866588e9f62ade3b.pdf,IJEEI 8(4) (2016),2026-07-02,http://ijeei.org/docs-1804133866588e9f62ade3b.pdf,653c84ca93cecdadc6614e817765da0422340cf249b5fb7824c6c83fbb5a632a,p. 775 abstract; Sec. 3 pp. 776-778; Secs. 4-5 pp. 779-780,NR,Transferable adjacent domain: the video-game track segment sequence maps directly to a robot-course centerline/corridor and its closure and nonintersection constraints map to valid robot traversal geometry.
A-C0025-03,calibration,C0025,408943733d19488289a738355c6a7be9a52883d16958081049d40dd8e7083d50,d91b44f278376601725a8290d24c75326d02808513f3e6c40f77b89493d6f14f,screening-03,screening-03,2026-07-02,included,include-relevant,full_text,https://proceedings.mlr.press/v123/madaan20a/madaan20a.pdf,PMLR 123 (2020),2026-07-02,https://proceedings.mlr.press/v123/madaan20a/madaan20a.pdf,ed3a9384cec193068e9c1631b7076a8eae1f8eaed2cbe704cdda7bac50e8ab7c,p. 177 abstract; Sec. 3 pp. 179-181; Sec. 4 pp. 181-184 and Table 1,NR,NR
A-C0046-03,calibration,C0046,1a9fc79a0f390bc8ca4daee3d1468749439026c664cd7a6c863ccf4fc756b740,d91b44f278376601725a8290d24c75326d02808513f3e6c40f77b89493d6f14f,screening-03,screening-03,2026-07-02,included,include-relevant,full_text,https://arxiv.org/pdf/2109.12674v3,arXiv:2109.12674v3,2026-07-02,https://arxiv.org/pdf/2109.12674v3,ae04f7e4a3976f977ccff136a218d0daca5a84224f68ded684a6a734f8a87e2e,p. 1 abstract and Fig. 1B; Sec. 3.2 pp. 5-6; Algorithm 1 p. 6,NR,Transferable adjacent domain: procedural road-network blocks map to robot-course centerlines/corridors through their lane geometry and connected road topology.
A-C0063-03,calibration,C0063,72a846d4530e204efb788f12170e5366d2f5237bae6a1db0733bb1b4b0cc8393,d91b44f278376601725a8290d24c75326d02808513f3e6c40f77b89493d6f14f,screening-03,screening-03,2026-07-02,included,include-relevant,official_documentation,https://raw.githubusercontent.com/AntoineRichard/TrackGen/cf9e9433eafa30c8311476cf75a356dd42c541cd/docs/index.rst,cf9e9433eafa30c8311476cf75a356dd42c541cd,2026-07-02,https://raw.githubusercontent.com/AntoineRichard/TrackGen/cf9e9433eafa30c8311476cf75a356dd42c541cd/docs/index.rst,bc51749a09b6e4d2efa09b265cdc0d36ba58c0e8326d31f3afd6e937906dd4af,docs/index.rst lines 4-6; 43-45; 72-80,NR,NR
A-C0134-03,calibration,C0134,a7889caaedcbe9a66104beb24e7072fac202bad4a2bfe2c4dd6c5c789a2059af,d91b44f278376601725a8290d24c75326d02808513f3e6c40f77b89493d6f14f,screening-03,screening-03,2026-07-02,excluded,exclude-insufficient-detail,abstract_only,https://api.semanticscholar.org/graph/v1/paper/DOI:10.1109/SBFT59156.2023.00006?fields=title%2Cabstract%2CopenAccessPdf%2CexternalIds%2Curl%2CpublicationDate;https://doi.org/10.1109/sbft59156.2023.00006,unversioned@2026-07-02,2026-07-02,NR,6995d9e12713e84df8f168231bf317db197b905e8b6db800c325fe3e7a7b21bb,Semantic Scholar Graph record DOI:10.1109/SBFT59156.2023.00006 abstract and openAccessPdf.status field,Accessible abstract states that RoadSign generates failure-revealing roads but no complete report or authoritative implementation was retrievable to verify its road representation constraints or outputs.,DOI resolved to an IEEE WAF challenge; Semantic Scholar reports openAccessPdf.status=CLOSED; OpenAlex reports no PDF or repository full text; a GitHub repository-name search found no authoritative RoadSign artifact.
A-C0147-03,calibration,C0147,1683b69342398cf9c8c75e8f4cde2954193e305fb17770dc1e7df9fc980bec36,d91b44f278376601725a8290d24c75326d02808513f3e6c40f77b89493d6f14f,screening-03,screening-03,2026-07-02,boundary,boundary,official_documentation,https://doi.org/10.23919/oceans40490.2019.8962724;https://raw.githubusercontent.com/osrf/vrx/3a0aa0194c7b5d5902f55d2f056d450bfdcb9ec4/vrx_gazebo/models/navigation_course/model.sdf,3a0aa0194c7b5d5902f55d2f056d450bfdcb9ec4,2026-07-02,https://raw.githubusercontent.com/osrf/vrx/3a0aa0194c7b5d5902f55d2f056d450bfdcb9ec4/vrx_gazebo/models/navigation_course/model.sdf,256d90498087a28c4fe4aad66d817b2dc086cdd408fb20b25cb3db1dc6489c84,vrx_gazebo/models/navigation_course/model.sdf lines 2-89,NR,Boundary transfer: static maritime navigation course encoded as paired red and green buoy coordinates in SDF; it supplies a reusable gate-course serialization practice but no source-native course generator.
A-C0175-03,calibration,C0175,a40f8096547c0cb64eaf0787a6e41c5a41331631c274c0216d035814f970598f,d91b44f278376601725a8290d24c75326d02808513f3e6c40f77b89493d6f14f,screening-03,screening-03,2026-07-02,boundary,boundary,official_documentation,https://raw.githubusercontent.com/carla-simulator/leaderboard/a87a3419e9d2e0d36deb25f1f26c17edee2d1420/data/routes_validation.xml,leaderboard-2.0@a87a3419e9d2e0d36deb25f1f26c17edee2d1420,2026-07-02,https://raw.githubusercontent.com/carla-simulator/leaderboard/a87a3419e9d2e0d36deb25f1f26c17edee2d1420/data/routes_validation.xml,6122cffc1be24f1055a24c9744fa54f41fef152eb66a347d0d6393b124760017,data/routes_validation.xml lines 2-32,NR,Boundary transfer: fixed benchmark routes serialize ordered waypoint coordinates with route-conditioned weather and scenario parameters; this is a reusable course-specification reporting practice rather than source-native course generation.
