candidate_id,input_sha256,agent_id,verified_on,metadata_status,title,authors,year,venue,doi,url,source_type,title_evidence,authors_evidence,year_evidence,venue_evidence,doi_evidence,url_evidence,source_type_evidence,bib_entry_type,bib_venue_field,bib_url,key_author,author_kinds,notes
C0150,049adb661a149f8d3282aca01c63ab6eeef103f0b1a2a649e5fe9c5c53b8d9d5,metadata-03,2026-06-30,verified,Navigation Scenario Permutation Model for Training of Maritime Autonomous Surface Ship Remote Operators,Taemin Hwang; Ik-Hyun Youn,2022,Applied Sciences,10.3390/app12031651,https://www.mdpi.com/2076-3417/12/3/1651,journal article,publisher::https://www.mdpi.com/2076-3417/12/3/1651,publisher::https://www.mdpi.com/2076-3417/12/3/1651,publisher::https://www.mdpi.com/2076-3417/12/3/1651,publisher::https://www.mdpi.com/2076-3417/12/3/1651,doi::https://doi.org/10.3390/app12031651;publisher::https://www.mdpi.com/2076-3417/12/3/1651,publisher::https://www.mdpi.com/2076-3417/12/3/1651,publisher::https://www.mdpi.com/2076-3417/12/3/1651,article,journal,https://www.mdpi.com/2076-3417/12/3/1651,Hwang,personal;personal,Verified against the MDPI article record and official article PDF.
C0156,feb8293d2c4802769de9e776b88fadba27c9791447bff0a03c350c6c19f8591b,metadata-03,2026-06-30,verified,FLYOVER: A Model-Driven Method to Generate Diverse Highway Interchanges for Autonomous Vehicle Testing,Yuan Zhou; Gengjie Lin; Yun Tang; Kairui Yang; Wei Jing; Ping Zhang; Junbo Chen; Liang Gong; Yang Liu,2023,arXiv,10.48550/arxiv.2301.12738,https://arxiv.org/abs/2301.12738,preprint,preprint_repository::https://arxiv.org/abs/2301.12738,preprint_repository::https://arxiv.org/abs/2301.12738,preprint_repository::https://arxiv.org/abs/2301.12738,preprint_repository::https://arxiv.org/abs/2301.12738,preprint_repository::https://arxiv.org/abs/2301.12738,preprint_repository::https://arxiv.org/abs/2301.12738,preprint_repository::https://arxiv.org/abs/2301.12738,misc,howpublished,https://arxiv.org/abs/2301.12738,Zhou,personal;personal;personal;personal;personal;personal;personal;personal;personal,The official arXiv record reports no journal reference; this is treated as preprint-only.
C0158,38e84e77616a7aa136924b0fc3e4f85d7789e80747874ca3a43526dc21f4b38a,metadata-03,2026-06-30,verified,DriveSceneGen: Generating Diverse and Realistic Driving Scenarios from Scratch,Shuo Sun; Zekai Gu; Tianchen Sun; Jiawei Sun; Chengran Yuan; Yuhang Han; Dongen Li; Marcelo H. Ang Jr.,2024,IEEE Robotics and Automation Letters,10.1109/lra.2024.3416792,https://arxiv.org/abs/2309.14685,journal article,publisher::https://ieeexplore.ieee.org/document/10565975/,publisher::https://ieeexplore.ieee.org/document/10565975/,publisher::https://ieeexplore.ieee.org/document/10565975/,publisher::https://ieeexplore.ieee.org/document/10565975/,doi::https://doi.org/10.1109/lra.2024.3416792;publisher::https://ieeexplore.ieee.org/document/10565975/,preprint_repository::https://arxiv.org/abs/2309.14685,publisher::https://ieeexplore.ieee.org/document/10565975/,article,journal,https://arxiv.org/abs/2309.14685,Sun,personal;personal;personal;personal;personal;personal;personal;personal,The record was upgraded from preprint-only metadata to the 2024 IEEE journal version while retaining the accessible arXiv URL.
C0163,485eac696ec198a2517b2547483fc2f43f2d187f50eb2ae98779733fda5b3ce2,metadata-03,2026-06-30,verified,RoadGen: Generating Road Scenarios for Autonomous Vehicle Testing,Fan Yang; You Lu; Bihuan Chen; Peng Qin; Xin Peng,2024,arXiv,10.48550/arxiv.2411.19577,https://arxiv.org/abs/2411.19577,preprint,preprint_repository::https://arxiv.org/abs/2411.19577,preprint_repository::https://arxiv.org/abs/2411.19577,preprint_repository::https://arxiv.org/abs/2411.19577,preprint_repository::https://arxiv.org/abs/2411.19577,preprint_repository::https://arxiv.org/abs/2411.19577,preprint_repository::https://arxiv.org/abs/2411.19577,preprint_repository::https://arxiv.org/abs/2411.19577,misc,howpublished,https://arxiv.org/abs/2411.19577,Yang,personal;personal;personal;personal;personal,The official arXiv record reports no journal reference; this is treated as preprint-only.
C0164,99ba55c889243d2c4d9cd7c7de1a67a9c024d17e3b436cbaf18134f06fd6f1c1,metadata-03,2026-06-30,verified,GenTe: Generative Real-world Terrains for General Legged Robot Locomotion Control,Hanwen Wan; Mengkang Li; Donghao Wu; Yebin Zhong; Yixuan Deng; Zhenglong Sun; Xiaoqiang Ji,2025,arXiv,10.48550/arxiv.2504.09997,https://arxiv.org/abs/2504.09997,preprint,preprint_repository::https://arxiv.org/abs/2504.09997,preprint_repository::https://arxiv.org/abs/2504.09997,preprint_repository::https://arxiv.org/abs/2504.09997,preprint_repository::https://arxiv.org/abs/2504.09997,preprint_repository::https://arxiv.org/abs/2504.09997,preprint_repository::https://arxiv.org/abs/2504.09997,preprint_repository::https://arxiv.org/abs/2504.09997,misc,howpublished,https://arxiv.org/abs/2504.09997,Wan,personal;personal;personal;personal;personal;personal;personal,The official arXiv record reports no journal reference; this is treated as preprint-only.
C0177,c221e3de9680347a93d4b2f696a02adeceefba737202122b3cd4314edd0889e1,metadata-03,2026-06-30,verified,Enhanced POET: Open-ended Reinforcement Learning through Unbounded Invention of Learning Challenges and their Solutions,Rui Wang; Joel Lehman; Aditya Rawal; Jiale Zhi; Yulun Li; Jeffrey Clune; Kenneth Stanley,2020,Proceedings of the 37th International Conference on Machine Learning,NR,https://proceedings.mlr.press/v119/wang20l.html,conference paper,proceedings::https://proceedings.mlr.press/v119/wang20l.html,proceedings::https://proceedings.mlr.press/v119/wang20l.html,proceedings::https://proceedings.mlr.press/v119/wang20l.html,proceedings::https://proceedings.mlr.press/v119/wang20l.html,NR,proceedings::https://proceedings.mlr.press/v119/wang20l.html,proceedings::https://proceedings.mlr.press/v119/wang20l.html,inproceedings,booktitle,https://proceedings.mlr.press/v119/wang20l.html,Wang,personal;personal;personal;personal;personal;personal;personal,The official PMLR proceedings record supplies a stable URL but no DOI.
C0194,f8af34055cb9e0a73ff005941c27df00a2cb76b37d2d31c1b8d1f05882004378,metadata-03,2026-06-30,verified,PyFlyt -- UAV Simulation Environments for Reinforcement Learning Research,Jun Jet Tai; Jim Wong; Mauro Innocente; Nadjim Horri; James Brusey; Swee King Phang,2023,arXiv,10.48550/arxiv.2304.01305,https://arxiv.org/abs/2304.01305,preprint,preprint_repository::https://arxiv.org/abs/2304.01305,preprint_repository::https://arxiv.org/abs/2304.01305,preprint_repository::https://arxiv.org/abs/2304.01305,preprint_repository::https://arxiv.org/abs/2304.01305,preprint_repository::https://arxiv.org/abs/2304.01305,preprint_repository::https://arxiv.org/abs/2304.01305,preprint_repository::https://arxiv.org/abs/2304.01305,misc,howpublished,https://arxiv.org/abs/2304.01305,Tai,personal;personal;personal;personal;personal;personal,The official arXiv record reports no journal reference; this is treated as preprint-only rather than citing the living repository.
C0196,55b2745c44568582ceccec5a08a1313cd1dac4208b6f714fd9cac15f39b935ef,metadata-03,2026-06-30,verified,Random Track Generator,Formula Student Team Delft,2026,Python Package Index,NR,https://pypi.org/project/random-track-generator/,software package; official repository,official_repository::https://github.com/mvanlobensels/random-track-generator,official_repository::https://github.com/mvanlobensels/random-track-generator,official_release::https://pypi.org/project/random-track-generator/1.1.0/,official_release::https://pypi.org/project/random-track-generator/1.1.0/,NR,official_release::https://pypi.org/project/random-track-generator/,official_repository::https://github.com/mvanlobensels/random-track-generator;official_release::https://pypi.org/project/random-track-generator/1.1.0/,misc,howpublished,https://pypi.org/project/random-track-generator/,FormulaStudentTeamDelft,corporate,The official README credits Formula Student Team Delft and PyPI dates release 1.1.0 to 2026; no DOI is assigned.
C0202,5ff24bdfeb7f87ff0f2b3c63d94c92de71ca8967cbc954308c2377b95742e812,metadata-03,2026-06-30,verified,Scenario Dreamer: Vectorized Latent Diffusion for Generating Driving Simulation Environments,Luke Rowe; Roger Girgis; Anthony Gosselin; Liam Paull; Christopher Pal; Felix Heide,2025,Proceedings of the IEEE/CVF Conference on Computer Vision and Pattern Recognition,10.1109/cvpr52734.2025.01604,https://openaccess.thecvf.com/content/CVPR2025/html/Rowe_Scenario_Dreamer_Vectorized_Latent_Diffusion_for_Generating_Driving_Simulation_Environments_CVPR_2025_paper.html,conference paper,proceedings::https://openaccess.thecvf.com/content/CVPR2025/html/Rowe_Scenario_Dreamer_Vectorized_Latent_Diffusion_for_Generating_Driving_Simulation_Environments_CVPR_2025_paper.html,proceedings::https://openaccess.thecvf.com/content/CVPR2025/html/Rowe_Scenario_Dreamer_Vectorized_Latent_Diffusion_for_Generating_Driving_Simulation_Environments_CVPR_2025_paper.html,proceedings::https://openaccess.thecvf.com/content/CVPR2025/html/Rowe_Scenario_Dreamer_Vectorized_Latent_Diffusion_for_Generating_Driving_Simulation_Environments_CVPR_2025_paper.html,proceedings::https://openaccess.thecvf.com/content/CVPR2025/html/Rowe_Scenario_Dreamer_Vectorized_Latent_Diffusion_for_Generating_Driving_Simulation_Environments_CVPR_2025_paper.html,doi::https://doi.org/10.1109/cvpr52734.2025.01604;publisher::https://ieeexplore.ieee.org/document/11094735/,proceedings::https://openaccess.thecvf.com/content/CVPR2025/html/Rowe_Scenario_Dreamer_Vectorized_Latent_Diffusion_for_Generating_Driving_Simulation_Environments_CVPR_2025_paper.html,proceedings::https://openaccess.thecvf.com/content/CVPR2025/html/Rowe_Scenario_Dreamer_Vectorized_Latent_Diffusion_for_Generating_Driving_Simulation_Environments_CVPR_2025_paper.html,inproceedings,booktitle,https://openaccess.thecvf.com/content/CVPR2025/html/Rowe_Scenario_Dreamer_Vectorized_Latent_Diffusion_for_Generating_Driving_Simulation_Environments_CVPR_2025_paper.html,Rowe,personal;personal;personal;personal;personal;personal,The official CVF proceedings page provides the accessible record; the IEEE version of record supplies the DOI.
C0210,9957f34188adbfe80154439d9d4129344fefcec9b991bd13185867f15b366b34,metadata-03,2026-06-30,verified,VRX Automated Evaluation,Open Robotics,NR,GitHub,NR,https://github.com/osrf/vrx-docker,competition evaluation repository,official_repository::https://github.com/osrf/vrx-docker,official_repository::https://github.com/osrf/vrx-docker,NR,official_repository::https://github.com/osrf/vrx-docker,NR,official_repository::https://github.com/osrf/vrx-docker,official_repository::https://github.com/osrf/vrx-docker,misc,howpublished,https://github.com/osrf/vrx-docker,OpenRobotics,corporate,The official repository documents VRX automated evaluation but does not state a canonical release year or assign a DOI.
