candidate_id,input_sha256,agent_id,verified_on,metadata_status,title,authors,year,venue,doi,url,source_type,title_evidence,authors_evidence,year_evidence,venue_evidence,doi_evidence,url_evidence,source_type_evidence,bib_entry_type,bib_venue_field,bib_url,key_author,author_kinds,notes
C0017,f7d3ae110d165d18ae1eeee29874e2e9d077ff7f922f18e643b12a5f3792469f,metadata-03,2026-06-30,verified,Car Racing,Oleg Klimov,NR,Gymnasium Documentation,NR,https://gymnasium.farama.org/environments/box2d/car_racing/,benchmark environment; official documentation,official_documentation::https://gymnasium.farama.org/environments/box2d/car_racing/,official_documentation::https://gymnasium.farama.org/environments/box2d/car_racing/,NR,official_documentation::https://gymnasium.farama.org/environments/box2d/car_racing/,NR,official_documentation::https://gymnasium.farama.org/environments/box2d/car_racing/,official_documentation::https://gymnasium.farama.org/environments/box2d/car_racing/,misc,howpublished,https://gymnasium.farama.org/environments/box2d/car_racing/,Klimov,personal,The official documentation provides no canonical publication year or DOI and credits Oleg Klimov as creator.
C0022,d0e9b7c9d3113150f3b351a577029cfab9c50ca0f9aa23762d59c5b504f2e520,metadata-03,2026-06-30,verified,Automatically Testing Self-Driving Cars with Search-Based Procedural Content Generation,Alessio Gambi; Marc Mueller; Gordon Fraser,2019,Proceedings of the 28th ACM SIGSOFT International Symposium on Software Testing and Analysis,10.1145/3293882.3330566,https://doi.org/10.1145/3293882.3330566,conference paper,publisher::https://dl.acm.org/doi/10.1145/3293882.3330566,publisher::https://dl.acm.org/doi/10.1145/3293882.3330566,publisher::https://dl.acm.org/doi/10.1145/3293882.3330566,publisher::https://dl.acm.org/doi/10.1145/3293882.3330566,doi::https://doi.org/10.1145/3293882.3330566;publisher::https://dl.acm.org/doi/10.1145/3293882.3330566,doi::https://doi.org/10.1145/3293882.3330566;publisher::https://dl.acm.org/doi/10.1145/3293882.3330566,publisher::https://dl.acm.org/doi/10.1145/3293882.3330566,inproceedings,booktitle,https://doi.org/10.1145/3293882.3330566,Gambi,personal;personal;personal,The ASFault software name is not part of the ACM version-of-record title.
C0029,5838897a3d1c85f3bd278122e8eeda94f8685c1fea34bb8e8efe60106379fc55,metadata-03,2026-06-30,verified,Outracing champion Gran Turismo drivers with deep reinforcement learning,Peter R. Wurman; Samuel Barrett; Kenta Kawamoto; James MacGlashan; Kaushik Subramanian; Thomas J. Walsh; Roberto Capobianco; Alisa Devlic; Franziska Eckert; Florian Fuchs; Leilani Gilpin; Piyush Khandelwal; Varun Kompella; HaoChih Lin; Patrick MacAlpine; Declan Oller; Takuma Seno; Craig Sherstan; Michael D. Thomure; Houmehr Aghabozorgi; Leon Barrett; Rory Douglas; Dion Whitehead; Peter Dürr; Peter Stone; Michael Spranger; Hiroaki Kitano,2022,Nature,10.1038/s41586-021-04357-7,https://www.nature.com/articles/s41586-021-04357-7,journal article,publisher::https://www.nature.com/articles/s41586-021-04357-7,publisher::https://www.nature.com/articles/s41586-021-04357-7,publisher::https://www.nature.com/articles/s41586-021-04357-7,publisher::https://www.nature.com/articles/s41586-021-04357-7,publisher::https://www.nature.com/articles/s41586-021-04357-7,publisher::https://www.nature.com/articles/s41586-021-04357-7,publisher::https://www.nature.com/articles/s41586-021-04357-7,article,journal,https://www.nature.com/articles/s41586-021-04357-7,Wurman,personal;personal;personal;personal;personal;personal;personal;personal;personal;personal;personal;personal;personal;personal;personal;personal;personal;personal;personal;personal;personal;personal;personal;personal;personal;personal;personal,The provisional GT Sophy suffix and truncated author string were replaced by the Nature version-of-record metadata.
C0035,8b5afc31206e1ec022c2cb81abb9c0dd4b8e3704b687f267cac389ce2086690e,metadata-03,2026-06-30,verified,Gran Turismo 7,Polyphony Digital Inc.,2022,Sony Interactive Entertainment,NR,https://www.gran-turismo.com/us/products/gt7/,video game software,official_documentation::https://www.gran-turismo.com/us/products/gt7/,official_documentation::https://www.gran-turismo.com/us/products/gt7/,official_release::https://www.gran-turismo.com/us/products/gt7/,official_documentation::https://www.gran-turismo.com/us/products/gt7/,NR,official_release::https://www.gran-turismo.com/us/products/gt7/,official_documentation::https://www.gran-turismo.com/us/products/gt7/,misc,howpublished,https://www.gran-turismo.com/us/products/gt7/,PolyphonyDigital,corporate,The official product page reports a 4 March 2022 release and Polyphony Digital as developer; no DOI is assigned.
C0045,cd692948e8af438aa3159809119b2bed5b908a325ab04ea1dc67f9db0fa2798f,metadata-03,2026-06-30,verified,Box2D,Erin Catto,NR,GitHub,NR,https://github.com/erincatto/box2d,software repository,official_repository::https://github.com/erincatto/box2d,official_repository::https://github.com/erincatto/box2d,NR,official_repository::https://github.com/erincatto/box2d,NR,official_repository::https://github.com/erincatto/box2d,official_repository::https://github.com/erincatto/box2d,misc,howpublished,https://github.com/erincatto/box2d,Catto,personal,The official repository identifies Erin Catto as developer but does not define a canonical publication year or DOI for the living project.
C0049,c45428694aa8fcf8efc0f6c17c5e3954b62807d55a3c506268199d3c5e366b1d,metadata-03,2026-06-30,verified,Procedural Race Track Generator,Luke Gillard,NR,GitHub,NR,https://github.com/Drallig/ProceduralTrack,software repository,official_repository::https://github.com/Drallig/ProceduralTrack,official_repository::https://github.com/Drallig/ProceduralTrack;official_repository::https://api.github.com/users/Drallig,NR,official_repository::https://github.com/Drallig/ProceduralTrack,NR,official_repository::https://github.com/Drallig/ProceduralTrack,official_repository::https://github.com/Drallig/ProceduralTrack,misc,howpublished,https://github.com/Drallig/ProceduralTrack,Gillard,personal,"The repository description says the owner created it, and the official GitHub profile maps Drallig to Luke Gillard; the living repository has no canonical release year or DOI."
C0053,c670b115468c4d089276d06e56223b23487c826bce4b6e920e0ebf6ba97b81da,metadata-03,2026-06-30,verified,ArcGIS CityEngine,Esri,NR,Esri,NR,https://www.esri.com/en-us/arcgis/products/arcgis-cityengine/overview,software,official_documentation::https://www.esri.com/en-us/arcgis/products/arcgis-cityengine/overview,official_documentation::https://www.esri.com/en-us/arcgis/products/arcgis-cityengine/overview,NR,official_documentation::https://www.esri.com/en-us/arcgis/products/arcgis-cityengine/overview,NR,official_documentation::https://www.esri.com/en-us/arcgis/products/arcgis-cityengine/overview,official_documentation::https://www.esri.com/en-us/arcgis/products/arcgis-cityengine/overview,misc,howpublished,https://www.esri.com/en-us/arcgis/products/arcgis-cityengine/overview,Esri,corporate,Esri's living product page does not identify a canonical release year or DOI for ArcGIS CityEngine.
C0061,057aac86e7dc383c11f804d558b9aff30c02b7411b0a8afe8bf78dc1deb2ad2c,metadata-03,2026-06-30,verified,XPBD: Position-Based Simulation of Compliant Constrained Dynamics,Miles Macklin; Matthias Müller; Nuttapong Chentanez,2016,Proceedings of the 9th International Conference on Motion in Games,10.1145/2994258.2994272,https://doi.org/10.1145/2994258.2994272,conference paper,publisher::https://dl.acm.org/doi/10.1145/2994258.2994272,publisher::https://dl.acm.org/doi/10.1145/2994258.2994272,publisher::https://dl.acm.org/doi/10.1145/2994258.2994272,publisher::https://dl.acm.org/doi/10.1145/2994258.2994272,doi::https://doi.org/10.1145/2994258.2994272;publisher::https://dl.acm.org/doi/10.1145/2994258.2994272,doi::https://doi.org/10.1145/2994258.2994272;publisher::https://dl.acm.org/doi/10.1145/2994258.2994272,publisher::https://dl.acm.org/doi/10.1145/2994258.2994272,inproceedings,booktitle,https://doi.org/10.1145/2994258.2994272,Macklin,personal;personal;personal,Verified against the ACM version of record; the canonical URL is the DOI resolver.
C0094,1a6d5e692f39f35924362a7dd5ca18b0b399f5251d24771a24fb3dfb21690ac7,metadata-03,2026-06-30,verified,Adaptive Planning and Control with Time-Varying Tire Models for Autonomous Racing Using Extreme Learning Machine,Dvij Kalaria; Qin Lin; John M. Dolan,2023,arXiv,10.48550/arxiv.2303.08235,https://arxiv.org/abs/2303.08235,preprint,preprint_repository::https://arxiv.org/abs/2303.08235,preprint_repository::https://arxiv.org/abs/2303.08235,preprint_repository::https://arxiv.org/abs/2303.08235,preprint_repository::https://arxiv.org/abs/2303.08235,preprint_repository::https://arxiv.org/abs/2303.08235,preprint_repository::https://arxiv.org/abs/2303.08235,preprint_repository::https://arxiv.org/abs/2303.08235,misc,howpublished,https://arxiv.org/abs/2303.08235,Kalaria,personal;personal;personal,The official arXiv record reports no journal reference; this is treated as preprint-only.
C0095,46fdb3ba902bb3c9a1c70452b4fd950f80258afa00a52aacae653df54a387edd,metadata-03,2026-06-30,verified,LLA-MPC: Fast Adaptive Control for Autonomous Racing,Maitham F. AL-Sunni; Hassan Almubarak; Katherine Horng; John M. Dolan,2025,arXiv,10.48550/arxiv.2505.19512,https://arxiv.org/abs/2505.19512,preprint,preprint_repository::https://arxiv.org/abs/2505.19512,preprint_repository::https://arxiv.org/abs/2505.19512,preprint_repository::https://arxiv.org/abs/2505.19512,preprint_repository::https://arxiv.org/abs/2505.19512,preprint_repository::https://arxiv.org/abs/2505.19512,preprint_repository::https://arxiv.org/abs/2505.19512,preprint_repository::https://arxiv.org/abs/2505.19512,misc,howpublished,https://arxiv.org/abs/2505.19512,AL-Sunni,personal;personal;personal;personal,The official arXiv record reports no journal reference; this is treated as preprint-only.
C0099,dd1a2070ac65188fe71abf66f60a5c5da92da0e8fdcf87425ecd8b784fc75a99,metadata-03,2026-06-30,verified,Position-Based Multi-Agent Dynamics for Real-Time Crowd Simulation,Tomer Weiss; Alan Litteneker; Chenfanfu Jiang; Demetri Terzopoulos,2017,Proceedings of the Tenth International Conference on Motion in Games,10.1145/3136457.3136462,https://doi.org/10.1145/3136457.3136462,conference paper,publisher::https://dl.acm.org/doi/10.1145/3136457.3136462,publisher::https://dlnext.acm.org/doi/pdf/10.1145/3136457.3136462,publisher::https://dl.acm.org/doi/10.1145/3136457.3136462,publisher::https://dl.acm.org/doi/10.1145/3136457.3136462,doi::https://doi.org/10.1145/3136457.3136462;publisher::https://dl.acm.org/doi/10.1145/3136457.3136462,doi::https://doi.org/10.1145/3136457.3136462;publisher::https://dl.acm.org/doi/10.1145/3136457.3136462,publisher::https://dl.acm.org/doi/10.1145/3136457.3136462,inproceedings,booktitle,https://doi.org/10.1145/3136457.3136462,Weiss,personal;personal;personal;personal,The ACM version of record establishes 2017 publication; the arXiv posting followed in 2018.
C0100,5b4dc77a0ce5452b3bd94adb8afc4c60910aace08019ae61ffde1b1fb6b57161,metadata-03,2026-06-30,verified,uv,Charlie Marsh,2024,Astral,NR,https://docs.astral.sh/uv/,software,official_documentation::https://docs.astral.sh/uv/,official_release::https://astral.sh/blog/uv,official_release::https://astral.sh/blog/uv,official_documentation::https://docs.astral.sh/uv/,NR,official_documentation::https://docs.astral.sh/uv/,official_documentation::https://docs.astral.sh/uv/,misc,howpublished,https://docs.astral.sh/uv/,Marsh,personal,Astral's official announcement dates uv to 2024 and identifies Charlie Marsh; the software has no assigned DOI.
C0101,808317a3c53f4d518a364481e025fb17b6cfea441401840d815916e4f102d731,metadata-03,2026-06-30,verified,Using Genetic Algorithms for Automating Automated Lane-Keeping System Testing,Lorenz Klampfl; Florian Klück; Franz Wotawa,2022,Journal of Software: Evolution and Process,10.1002/smr.2520,https://doi.org/10.1002/smr.2520,journal article,publisher::https://onlinelibrary.wiley.com/doi/10.1002/smr.2520,publisher::https://onlinelibrary.wiley.com/doi/10.1002/smr.2520,publisher::https://onlinelibrary.wiley.com/doi/10.1002/smr.2520,publisher::https://onlinelibrary.wiley.com/doi/10.1002/smr.2520,doi::https://doi.org/10.1002/smr.2520;publisher::https://onlinelibrary.wiley.com/doi/10.1002/smr.2520,doi::https://doi.org/10.1002/smr.2520;publisher::https://onlinelibrary.wiley.com/doi/10.1002/smr.2520,publisher::https://onlinelibrary.wiley.com/doi/10.1002/smr.2520,article,journal,https://doi.org/10.1002/smr.2520,Klampfl,personal;personal;personal,The year is the Wiley online publication year; the later issue assignment does not replace it.
C0106,66c62b2dd2de364b6bc650759647a5723577fd560c3e963ff1aca0ed481c8eb5,metadata-03,2026-06-30,verified,A voyage planning framework for energy performance analysis of autonomous inland waterway vessels,Chengqian Zhang; Chi Zhang; Fabian Thies; Wengang Mao; Jonas W. Ringsberg,2025,Energy,10.1016/j.energy.2025.137906,https://www.sciencedirect.com/science/article/pii/S0360544225035480,journal article,publisher::https://www.sciencedirect.com/science/article/pii/S0360544225035480,publisher::https://www.sciencedirect.com/science/article/pii/S0360544225035480,publisher::https://www.sciencedirect.com/science/article/pii/S0360544225035480,publisher::https://www.sciencedirect.com/science/article/pii/S0360544225035480,doi::https://doi.org/10.1016/j.energy.2025.137906;publisher::https://www.sciencedirect.com/science/article/pii/S0360544225035480,publisher::https://www.sciencedirect.com/science/article/pii/S0360544225035480,publisher::https://www.sciencedirect.com/science/article/pii/S0360544225035480,article,journal,https://www.sciencedirect.com/science/article/pii/S0360544225035480,Zhang,personal;personal;personal;personal;personal,Verified against the Elsevier version-of-record landing page.
C0107,50d8b501badbab055a0ccaf5f1c8e1489b589d98218c9dd4fd0dbdb0e18c25b7,metadata-03,2026-06-30,verified,A Search-Based Framework for Automatic Generation of Testing Environments for Cyber-Physical Systems,Dmytro Humeniuk; Foutse Khomh; Giuliano Antoniol,2022,Information and Software Technology,10.1016/j.infsof.2022.106936,https://doi.org/10.1016/j.infsof.2022.106936,journal article,publisher::https://www.sciencedirect.com/science/article/pii/S0950584922000866,publisher::https://www.sciencedirect.com/science/article/pii/S0950584922000866,publisher::https://www.sciencedirect.com/science/article/pii/S0950584922000866,publisher::https://www.sciencedirect.com/science/article/pii/S0950584922000866,doi::https://doi.org/10.1016/j.infsof.2022.106936;publisher::https://www.sciencedirect.com/science/article/pii/S0950584922000866,doi::https://doi.org/10.1016/j.infsof.2022.106936;publisher::https://www.sciencedirect.com/science/article/pii/S0950584922000866,publisher::https://www.sciencedirect.com/science/article/pii/S0950584922000866,article,journal,https://doi.org/10.1016/j.infsof.2022.106936,Humeniuk,personal;personal;personal,The journal title excludes volume 149; the associated software repository is not part of the article's source type or canonical URL.
C0122,bcd870bc186bf012f657163e0e7db28f08ce63d47074634818d20ed6f4877595,metadata-03,2026-06-30,verified,Automatically Generating Content for Testing Autonomous Vehicles from User Descriptions,Benedikt Steininger; Chrysanthi Papamichail; David Stark; Dejan Nickovic; Alessio Gambi,2025,2025 IEEE/ACM 47th International Conference on Software Engineering: New Ideas and Emerging Results (ICSE-NIER),10.1109/icse-nier66352.2025.00021,https://ieeexplore.ieee.org/document/11023959/,conference paper,publisher::https://ieeexplore.ieee.org/document/11023959/,publisher::https://ieeexplore.ieee.org/document/11023959/,publisher::https://ieeexplore.ieee.org/document/11023959/,publisher::https://ieeexplore.ieee.org/document/11023959/,doi::https://doi.org/10.1109/icse-nier66352.2025.00021;publisher::https://ieeexplore.ieee.org/document/11023959/,publisher::https://ieeexplore.ieee.org/document/11023959/,publisher::https://ieeexplore.ieee.org/document/11023959/,inproceedings,booktitle,https://ieeexplore.ieee.org/document/11023959/,Steininger,personal;personal;personal;personal;personal,Verified against the IEEE Xplore version of record.
C0129,f0104c26f5bc53c61884e427e2566ff24ebbb324c6644884d48c1e04741db23f,metadata-03,2026-06-30,verified,OmniDrones: An Efficient and Flexible Platform for Reinforcement Learning in Drone Control,Botian Xu; Feng Gao; Chao Yu; Ruize Zhang; Yi Wu; Yu Wang,2024,IEEE Robotics and Automation Letters,10.1109/lra.2024.3356168,https://arxiv.org/abs/2309.12825,journal article,publisher::https://ieeexplore.ieee.org/document/10409589/,publisher::https://ieeexplore.ieee.org/document/10409589/,publisher::https://ieeexplore.ieee.org/document/10409589/,publisher::https://ieeexplore.ieee.org/document/10409589/,doi::https://doi.org/10.1109/lra.2024.3356168;publisher::https://ieeexplore.ieee.org/document/10409589/,preprint_repository::https://arxiv.org/abs/2309.12825,publisher::https://ieeexplore.ieee.org/document/10409589/,article,journal,https://arxiv.org/abs/2309.12825,Xu,personal;personal;personal;personal;personal;personal,The DOI identifies the IEEE version of record; the canonical URL retains the official accessible arXiv manuscript.
C0133,406e7618df5760d8815ad7d1f2e37bc683d29c72ade8cf674656bdf80f33e20b,metadata-03,2026-06-30,verified,Analysis of Road Representations in Search-Based Testing of Autonomous Driving Systems,Ezequiel Castellano; Ahmet Cetinkaya; Paolo Arcaini,2021,"2021 IEEE 21st International Conference on Software Quality, Reliability and Security (QRS)",10.1109/qrs54544.2021.00028,https://ieeexplore.ieee.org/document/9724804/,conference paper,publisher::https://ieeexplore.ieee.org/document/9724804/,publisher::https://ieeexplore.ieee.org/document/9724804/,publisher::https://ieeexplore.ieee.org/document/9724804/,publisher::https://ieeexplore.ieee.org/document/9724804/,doi::https://doi.org/10.1109/qrs54544.2021.00028;publisher::https://ieeexplore.ieee.org/document/9724804/,publisher::https://ieeexplore.ieee.org/document/9724804/,publisher::https://ieeexplore.ieee.org/document/9724804/,inproceedings,booktitle,https://ieeexplore.ieee.org/document/9724804/,Castellano,personal;personal;personal,Verified against the IEEE Xplore version of record.
C0135,7c99e6cc9bcccfe1a3feb8f6f72f20cff5195fb4b7312b77af37d441f1f6bc97,metadata-03,2026-06-30,verified,Spirale at the SBFT 2023 Tool Competiton - Cyber-Physical Systems Track,Domenico De Vivo; Anna Rita Fasolino,2023,2023 IEEE/ACM International Workshop on Search-Based and Fuzz Testing (SBFT),10.1109/sbft59156.2023.00007,https://ieeexplore.ieee.org/document/10190397/,conference paper,publisher::https://ieeexplore.ieee.org/document/10190397/,publisher::https://ieeexplore.ieee.org/document/10190397/,publisher::https://ieeexplore.ieee.org/document/10190397/,publisher::https://ieeexplore.ieee.org/document/10190397/,doi::https://doi.org/10.1109/sbft59156.2023.00007;publisher::https://ieeexplore.ieee.org/document/10190397/,publisher::https://ieeexplore.ieee.org/document/10190397/,publisher::https://ieeexplore.ieee.org/document/10190397/,inproceedings,booktitle,https://ieeexplore.ieee.org/document/10190397/,DeVivo,personal;personal,The publisher's title contains the spelling 'Competiton'; it is preserved verbatim.
C0136,e123d37de9bb0cb29a0e79e5d67bbd212e2f718b01c9c215e0e347b1285ee957,metadata-03,2026-06-30,verified,SBST Tool Competition 2021,Sebastiano Panichella; Alessio Gambi; Fiorella Zampetti; Vincenzo Riccio,2021,2021 IEEE/ACM 14th International Workshop on Search-Based Software Testing (SBST),10.1109/sbst52555.2021.00011,https://ieeexplore.ieee.org/document/9476243/,conference paper; competition report,publisher::https://ieeexplore.ieee.org/document/9476243/,publisher::https://ieeexplore.ieee.org/document/9476243/,publisher::https://ieeexplore.ieee.org/document/9476243/,publisher::https://ieeexplore.ieee.org/document/9476243/,doi::https://doi.org/10.1109/sbst52555.2021.00011;publisher::https://ieeexplore.ieee.org/document/9476243/,publisher::https://ieeexplore.ieee.org/document/9476243/,publisher::https://ieeexplore.ieee.org/document/9476243/,inproceedings,booktitle,https://ieeexplore.ieee.org/document/9476243/,Panichella,personal;personal;personal;personal,"The artifact is a published competition report, not the benchmark software itself."
C0141,38b6769b2969682c18284f567df53f038a39de663cb3562f18d8fa89e6ebff65,metadata-03,2026-06-30,verified,Interactive Evolution for the Procedural Generation of Tracks in a High-End Racing Game,Luigi Cardamone; Daniele Loiacono; Pier Luca Lanzi,2011,Proceedings of the 13th annual conference on Genetic and evolutionary computation,10.1145/2001576.2001631,https://doi.org/10.1145/2001576.2001631,conference paper,publisher::https://dl.acm.org/doi/10.1145/2001576.2001631,publisher::https://dl.acm.org/doi/10.1145/2001576.2001631,publisher::https://dl.acm.org/doi/10.1145/2001576.2001631,publisher::https://dl.acm.org/doi/10.1145/2001576.2001631,doi::https://doi.org/10.1145/2001576.2001631;publisher::https://dl.acm.org/doi/10.1145/2001576.2001631,doi::https://doi.org/10.1145/2001576.2001631;publisher::https://dl.acm.org/doi/10.1145/2001576.2001631,publisher::https://dl.acm.org/doi/10.1145/2001576.2001631,inproceedings,booktitle,https://doi.org/10.1145/2001576.2001631,Cardamone,personal;personal;personal,The full ACM proceedings title replaces the abbreviated provisional venue.
C0142,e3b7c1638a6bfaf6f9497803f05c64ba09f51540171749e415bb021d1a0f937b,metadata-03,2026-06-30,verified,DeepHyperion: Exploring the Feature Space of Deep Learning-Based Systems through Illumination Search,Tahereh Zohdinasab; Vincenzo Riccio; Alessio Gambi; Paolo Tonella,2021,Proceedings of the 30th ACM SIGSOFT International Symposium on Software Testing and Analysis,10.1145/3460319.3464811,https://doi.org/10.1145/3460319.3464811,conference paper,publisher::https://dl.acm.org/doi/10.1145/3460319.3464811,publisher::https://dl.acm.org/doi/10.1145/3460319.3464811,publisher::https://dl.acm.org/doi/10.1145/3460319.3464811,publisher::https://dl.acm.org/doi/10.1145/3460319.3464811,doi::https://doi.org/10.1145/3460319.3464811;publisher::https://dl.acm.org/doi/10.1145/3460319.3464811,doi::https://doi.org/10.1145/3460319.3464811;publisher::https://dl.acm.org/doi/10.1145/3460319.3464811,publisher::https://dl.acm.org/doi/10.1145/3460319.3464811,inproceedings,booktitle,https://doi.org/10.1145/3460319.3464811,Zohdinasab,personal;personal;personal;personal,The software artifact is associated with the study but is not part of the article's canonical source type or URL.
C0144,5145963e52826fab7f968167f39d5fa3bfda594b0be3aeeec7c2e1e45cccc1e2,metadata-03,2026-06-30,verified,GenRL at the SBST 2022 Tool Competition,Luigi Libero Lucio Starace; Andrea Romdhana; Sergio Di Martino,2022,Proceedings of the 15th Workshop on Search-Based Software Testing,10.1145/3526072.3527533,https://doi.org/10.1145/3526072.3527533,conference paper,publisher::https://dlnext.acm.org/doi/pdf/10.1145/3526072.3527533,publisher::https://dl.acm.org/doi/10.1145/3526072.3527533,publisher::https://dl.acm.org/doi/10.1145/3526072.3527533,publisher::https://dl.acm.org/doi/10.1145/3526072.3527533,doi::https://doi.org/10.1145/3526072.3527533;publisher::https://dl.acm.org/doi/10.1145/3526072.3527533,doi::https://doi.org/10.1145/3526072.3527533;publisher::https://dl.acm.org/doi/10.1145/3526072.3527533,publisher::https://dl.acm.org/doi/10.1145/3526072.3527533,inproceedings,booktitle,https://doi.org/10.1145/3526072.3527533,Starace,personal;personal;personal,Verified against the ACM version of record.
C0149,10b3a39ec819ff31a33071d3a634e5c454573a8277c630fec413fed671410fe4,metadata-03,2026-06-30,verified,Deep Reinforcement Learning Controller for 3D Path Following and Collision Avoidance by Autonomous Underwater Vehicles,Simen Theie Havenstrøm; Adil Rasheed; Omer San,2021,Frontiers in Robotics and AI,10.3389/frobt.2020.566037,https://www.frontiersin.org/journals/robotics-and-ai/articles/10.3389/frobt.2020.566037/full,journal article,publisher::https://www.frontiersin.org/journals/robotics-and-ai/articles/10.3389/frobt.2020.566037/full,publisher::https://www.frontiersin.org/journals/robotics-and-ai/articles/10.3389/frobt.2020.566037/full,publisher::https://www.frontiersin.org/journals/robotics-and-ai/articles/10.3389/frobt.2020.566037/full,publisher::https://www.frontiersin.org/journals/robotics-and-ai/articles/10.3389/frobt.2020.566037/full,doi::https://doi.org/10.3389/frobt.2020.566037;publisher::https://www.frontiersin.org/journals/robotics-and-ai/articles/10.3389/frobt.2020.566037/full,publisher::https://www.frontiersin.org/journals/robotics-and-ai/articles/10.3389/frobt.2020.566037/full,publisher::https://www.frontiersin.org/journals/robotics-and-ai/articles/10.3389/frobt.2020.566037/full,article,journal,https://www.frontiersin.org/journals/robotics-and-ai/articles/10.3389/frobt.2020.566037/full,Havenstrøm,personal;personal;personal,The publisher identifies the first author as Simen Theie Havenstrøm; the provisional ledger name was incorrect.
