candidate_id,input_sha256,agent_id,verified_on,metadata_status,title,authors,year,venue,doi,url,source_type,title_evidence,authors_evidence,year_evidence,venue_evidence,doi_evidence,url_evidence,source_type_evidence,bib_entry_type,bib_venue_field,bib_url,key_author,author_kinds,notes
C0003,5ee5b3fb1a8499d15db8aa9bf62ed8d91ab2c80e0076c7ff0e773b1e3530248a,metadata-06,NR,unverified,TrackGen: An interactive track generator for TORCS and Speed-Dreams,Luigi Cardamone; Pier Luca Lanzi; Daniele Loiacono,2015,Applied Soft Computing,10.1016/j.asoc.2014.11.010,https://www.sciencedirect.com/science/article/pii/S1568494614005705,journal article,publisher::https://api.elsevier.com/content/article/pii/S1568494614005705,crossref::https://api.crossref.org/works/10.1016/j.asoc.2014.11.010,publisher::https://api.elsevier.com/content/article/pii/S1568494614005705,publisher::https://api.elsevier.com/content/article/pii/S1568494614005705,publisher::https://api.elsevier.com/content/article/pii/S1568494614005705,publisher::https://api.elsevier.com/content/article/pii/S1568494614005705,publisher::https://api.elsevier.com/content/article/pii/S1568494614005705,article,journal,https://doi.org/10.1016/j.asoc.2014.11.010,Cardamone,personal;personal;personal,"Official Elsevier metadata confirms title, journal, 2015 cover date, DOI, and journal aggregation. Crossref corroborates the complete authors, but the accessible publisher endpoint omits them, so the record remains unverified."
C0008,de6c3c7216e0c31515106471fa1ab2b18c7ff58a20e8571303b5cb404f3e6414,metadata-06,NR,conflict,Procedural Generation of Complex Roundabouts for Autonomous Vehicle Testing,Ikram; Muktadir; Whitehead,2023,2023 IEEE Intelligent Vehicles Symposium,10.1109/iv55152.2023.10186533,https://doi.org/10.1109/iv55152.2023.10186533,paper,preprint_repository::https://arxiv.org/abs/2303.17900;crossref::https://api.crossref.org/works/10.1109/iv55152.2023.10186533,preprint_repository::https://arxiv.org/abs/2303.17900;crossref::https://api.crossref.org/works/10.1109/iv55152.2023.10186533,preprint_repository::https://arxiv.org/abs/2303.17900;crossref::https://api.crossref.org/works/10.1109/iv55152.2023.10186533,crossref::https://api.crossref.org/works/10.1109/iv55152.2023.10186533,doi::https://doi.org/10.1109/iv55152.2023.10186533,doi::https://doi.org/10.1109/iv55152.2023.10186533,crossref::https://api.crossref.org/works/10.1109/iv55152.2023.10186533,inproceedings,booktitle,https://doi.org/10.1109/iv55152.2023.10186533,Ikram,personal;personal;personal,"Official arXiv record and Crossref corroborate the publication, but IEEE Xplore was inaccessible. The frozen author conflict therefore remains unresolved."
C0012,7b7c21f7442ae1cbc47930f7c7d3bc1f54fd78165e3b6ae9a1686ddfce219f45,metadata-06,NR,conflict,Comparative Analysis of Metaheuristic Algorithms for Procedural Race Track Generation in Games,Alyaseri; Conner,2024,International Journal of Applied Metaheuristic Computing,10.4018/ijamc.350330,https://doi.org/10.4018/ijamc.350330,paper,crossref::https://api.crossref.org/works/10.4018/ijamc.350330,crossref::https://api.crossref.org/works/10.4018/ijamc.350330,crossref::https://api.crossref.org/works/10.4018/ijamc.350330,crossref::https://api.crossref.org/works/10.4018/ijamc.350330,doi::https://doi.org/10.4018/ijamc.350330,doi::https://doi.org/10.4018/ijamc.350330,crossref::https://api.crossref.org/works/10.4018/ijamc.350330,article,journal,https://doi.org/10.4018/ijamc.350330,Alyaseri,personal;personal,"Crossref corroborates the DOI and journal record, but IGI Global blocked the official page. Frozen author, venue, and source-type conflicts remain unresolved."
C0019,56c11d7a34b9e8f3825b1712eb1af43c96e307df655a6173fd3d6d31ac7d10fb,metadata-06,2026-06-30,verified,Prioritized Level Replay,Minqi Jiang; Edward Grefenstette; Tim Rocktäschel,2021,Proceedings of the 38th International Conference on Machine Learning,NR,https://proceedings.mlr.press/v139/jiang21b.html,conference paper,proceedings::https://proceedings.mlr.press/v139/jiang21b.html,proceedings::https://proceedings.mlr.press/v139/jiang21b.html,proceedings::https://proceedings.mlr.press/v139/jiang21b.html,proceedings::https://proceedings.mlr.press/v139/jiang21b.html,NR,proceedings::https://proceedings.mlr.press/v139/jiang21b.html,proceedings::https://proceedings.mlr.press/v139/jiang21b.html,inproceedings,booktitle,https://proceedings.mlr.press/v139/jiang21b.html,Jiang,personal;personal;personal,Official PMLR proceedings record reports no DOI.
C0030,577cddeab6234b4016b240ef07c27b691b1381fb3c27967573345e247ff94150,metadata-06,2026-06-30,verified,Gran Turismo,Polyphony Digital Inc.,1997,PlayStation,NR,https://www.polyphony.co.jp/products/,software,official_documentation::https://www.polyphony.co.jp/products/,official_documentation::https://www.polyphony.co.jp/products/,official_documentation::https://www.polyphony.co.jp/products/,official_documentation::https://www.polyphony.co.jp/products/,NR,official_documentation::https://www.polyphony.co.jp/products/,official_documentation::https://www.polyphony.co.jp/products/,misc,howpublished,https://www.polyphony.co.jp/products/,Polyphony Digital,corporate,Official product archive identifies the original 1997 PlayStation title and developer; no DOI applies to this software.
C0032,16e76f89088abce9e5b6d44104e8ca44fdaaa79f39e8ad548d202a14e83e40f6,metadata-06,2026-06-30,verified,A Super-human Vision-based Reinforcement Learning Agent for Autonomous Racing in Gran Turismo,Miguel Vasco; Takuma Seno; Kenta Kawamoto; Kaushik Subramanian; Peter R. Wurman; Peter Stone,2024,Reinforcement Learning Journal,NR,https://rlj.cs.umass.edu/2024/papers/Paper213.html,journal article,publisher::https://rlj.cs.umass.edu/2024/papers/Paper213.html,publisher::https://rlj.cs.umass.edu/2024/papers/Paper213.html,publisher::https://rlj.cs.umass.edu/2024/papers/Paper213.html,publisher::https://rlj.cs.umass.edu/2024/papers/Paper213.html,NR,publisher::https://rlj.cs.umass.edu/2024/papers/Paper213.html,publisher::https://rlj.cs.umass.edu/2024/papers/Paper213.html,article,journal,https://rlj.cs.umass.edu/2024/papers/Paper213.html,Vasco,personal;personal;personal;personal;personal;personal,Official Reinforcement Learning Journal record reports no DOI.
C0042,658cea7154882794e714a886dbec8053ab139d098ade4ce15887a1b2988a5057,metadata-06,NR,unverified,Computing the racing line using Bayesian optimization,Achin Jain; Manfred Morari,2020,2020 59th IEEE Conference on Decision and Control (CDC),10.1109/cdc42340.2020.9304147,https://doi.org/10.1109/cdc42340.2020.9304147,conference paper,crossref::https://api.crossref.org/works/10.1109/cdc42340.2020.9304147,crossref::https://api.crossref.org/works/10.1109/cdc42340.2020.9304147,crossref::https://api.crossref.org/works/10.1109/cdc42340.2020.9304147,crossref::https://api.crossref.org/works/10.1109/cdc42340.2020.9304147,doi::https://doi.org/10.1109/cdc42340.2020.9304147,doi::https://doi.org/10.1109/cdc42340.2020.9304147,crossref::https://api.crossref.org/works/10.1109/cdc42340.2020.9304147,inproceedings,booktitle,https://doi.org/10.1109/cdc42340.2020.9304147,Jain,personal;personal,"Crossref corroborates complete metadata, but IEEE Xplore was inaccessible, so published core metadata remains unverified."
C0046,4d5cb8d0383d52b9a47a3bd4b7ad6aaf2b5d25535fff0e387616c3b304f148a7,metadata-06,NR,conflict,MetaDrive: Composing Diverse Driving Scenarios for Generalizable Reinforcement Learning,Quanyi Li; Zhenghao Peng; Lan Feng; Qihang Zhang; Zhenghai Xue; Bolei Zhou,2021,IEEE Transactions on Pattern Analysis and Machine Intelligence 45(3),10.1109/TPAMI.2022.3190471,https://doi.org/10.1109/tpami.2022.3190471,paper,preprint_repository::https://arxiv.org/abs/2109.12674;crossref::https://api.crossref.org/works/10.1109/tpami.2022.3190471,preprint_repository::https://arxiv.org/abs/2109.12674;crossref::https://api.crossref.org/works/10.1109/tpami.2022.3190471,preprint_repository::https://arxiv.org/abs/2109.12674;crossref::https://api.crossref.org/works/10.1109/tpami.2022.3190471,crossref::https://api.crossref.org/works/10.1109/tpami.2022.3190471,doi::https://doi.org/10.1109/tpami.2022.3190471,doi::https://doi.org/10.1109/tpami.2022.3190471,crossref::https://api.crossref.org/works/10.1109/tpami.2022.3190471,article,journal,https://doi.org/10.1109/tpami.2022.3190471,Li,personal;personal;personal;personal;personal;personal,"Official arXiv and Crossref records distinguish the 2021 preprint from the 2023 journal issue, but IEEE Xplore was inaccessible. Frozen year, venue, and source-type conflicts remain unresolved."
C0047,392e4721c76ac28433e99695c26b221f09902fecec6c8fed6f4425fff5456185,metadata-06,2026-06-30,verified,ChickenKorma/Track-Generator,ChickenKorma,2022,GitHub repository,NR,https://github.com/ChickenKorma/Track-Generator,software repository,official_repository::https://api.github.com/repos/ChickenKorma/Track-Generator,official_repository::https://api.github.com/repos/ChickenKorma/Track-Generator,official_repository::https://api.github.com/repos/ChickenKorma/Track-Generator,official_repository::https://api.github.com/repos/ChickenKorma/Track-Generator,NR,official_repository::https://api.github.com/repos/ChickenKorma/Track-Generator,official_repository::https://api.github.com/repos/ChickenKorma/Track-Generator,misc,howpublished,https://github.com/ChickenKorma/Track-Generator,ChickenKorma,personal,Official repository metadata gives a 2022 creation date; no versioned release or DOI is reported.
C0054,dbe0959ea600a40530d2bddc09163ea9e2721a6cec6cf98edc1ef58c7b97dddd,metadata-06,NR,unverified,Interactive procedural street modeling,Guoning Chen; Gregory Esch; Peter Wonka; Pascal Müller; Eugene Zhang,2008,ACM Transactions on Graphics,10.1145/1360612.1360702,https://doi.org/10.1145/1360612.1360702,journal article,crossref::https://api.crossref.org/works/10.1145/1360612.1360702,crossref::https://api.crossref.org/works/10.1145/1360612.1360702,crossref::https://api.crossref.org/works/10.1145/1360612.1360702,crossref::https://api.crossref.org/works/10.1145/1360612.1360702,doi::https://doi.org/10.1145/1360612.1360702,doi::https://doi.org/10.1145/1360612.1360702,crossref::https://api.crossref.org/works/10.1145/1360612.1360702,article,journal,https://doi.org/10.1145/1360612.1360702,Chen,personal;personal;personal;personal;personal,"Crossref corroborates complete metadata, but ACM Digital Library was inaccessible, so published core metadata remains unverified."
C0056,f7ea3d9ebcc394ebef09350990fb46a22b996c62c3bd7f055952befcd0b55654,metadata-06,2026-06-30,verified,On the minimum ropelength of knots and links,Jason Cantarella; Robert B. Kusner; John M. Sullivan,2002,Inventiones mathematicae,10.1007/s00222-002-0234-y,https://link.springer.com/article/10.1007/s00222-002-0234-y,journal article,publisher::https://link.springer.com/article/10.1007/s00222-002-0234-y,publisher::https://link.springer.com/article/10.1007/s00222-002-0234-y,publisher::https://link.springer.com/article/10.1007/s00222-002-0234-y,publisher::https://link.springer.com/article/10.1007/s00222-002-0234-y,publisher::https://link.springer.com/article/10.1007/s00222-002-0234-y,publisher::https://link.springer.com/article/10.1007/s00222-002-0234-y,publisher::https://link.springer.com/article/10.1007/s00222-002-0234-y,article,journal,https://doi.org/10.1007/s00222-002-0234-y,Cantarella,personal;personal;personal,Metadata verified from the official Springer journal record.
C0057,c5ecca6a25e6358418d5c5849cd0f59d269fe1fc1de54aac5021c5cd6b41c84c,metadata-06,NR,conflict,Repulsive Curves,Yu; Schumacher; Crane,2020/2021,SIGGRAPH,10.1145/3439429,https://doi.org/10.1145/3439429,paper,preprint_repository::https://arxiv.org/abs/2006.07859;crossref::https://api.crossref.org/works/10.1145/3439429,preprint_repository::https://arxiv.org/abs/2006.07859;crossref::https://api.crossref.org/works/10.1145/3439429,preprint_repository::https://arxiv.org/abs/2006.07859;crossref::https://api.crossref.org/works/10.1145/3439429,crossref::https://api.crossref.org/works/10.1145/3439429,doi::https://doi.org/10.1145/3439429,doi::https://doi.org/10.1145/3439429,crossref::https://api.crossref.org/works/10.1145/3439429,article,journal,https://doi.org/10.1145/3439429,Yu,personal;personal;personal,"Official arXiv and Crossref records corroborate the work, but ACM Digital Library was inaccessible. Frozen author, year, and venue conflicts remain unresolved."
C0068,e58c83024c572e35f451d86fd8e8b62626f9db535b4a02e41b116b5169e5cd6f,metadata-06,NR,unverified,Search-Based Procedural Content Generation: A Taxonomy and Survey,Julian Togelius; Georgios N. Yannakakis; Kenneth O. Stanley; Cameron Browne,2011,IEEE Transactions on Computational Intelligence and AI in Games,10.1109/tciaig.2011.2148116,https://doi.org/10.1109/tciaig.2011.2148116,journal article,crossref::https://api.crossref.org/works/10.1109/tciaig.2011.2148116,crossref::https://api.crossref.org/works/10.1109/tciaig.2011.2148116,crossref::https://api.crossref.org/works/10.1109/tciaig.2011.2148116,crossref::https://api.crossref.org/works/10.1109/tciaig.2011.2148116,doi::https://doi.org/10.1109/tciaig.2011.2148116,doi::https://doi.org/10.1109/tciaig.2011.2148116,crossref::https://api.crossref.org/works/10.1109/tciaig.2011.2148116,article,journal,https://doi.org/10.1109/tciaig.2011.2148116,Togelius,personal;personal;personal;personal,"Crossref corroborates complete metadata, but IEEE Xplore was inaccessible, so published core metadata remains unverified."
C0073,4f23988fcf01c388e4ca5d1e4efaf176fcdb065fcfe1238468c6249cef14c35f,metadata-06,2026-06-30,verified,Deep Drone Racing: Learning Agile Flight in Dynamic Environments,Elia Kaufmann; Antonio Loquercio; Rene Ranftl; Alexey Dosovitskiy; Vladlen Koltun; Davide Scaramuzza,2018,Proceedings of The 2nd Conference on Robot Learning,NR,https://proceedings.mlr.press/v87/kaufmann18a.html,conference paper,proceedings::https://proceedings.mlr.press/v87/kaufmann18a.html,proceedings::https://proceedings.mlr.press/v87/kaufmann18a.html,proceedings::https://proceedings.mlr.press/v87/kaufmann18a.html,proceedings::https://proceedings.mlr.press/v87/kaufmann18a.html,NR,proceedings::https://proceedings.mlr.press/v87/kaufmann18a.html,proceedings::https://proceedings.mlr.press/v87/kaufmann18a.html,inproceedings,booktitle,https://proceedings.mlr.press/v87/kaufmann18a.html,Kaufmann,personal;personal;personal;personal;personal;personal,Official PMLR proceedings record reports no DOI.
C0076,74a5dcf8705a9f25fce91bcefb87d257b0237b732ecaef4558b8dff46ce3fa0b,metadata-06,2026-06-30,verified,Champion-level drone racing using deep reinforcement learning,Elia Kaufmann; Leonard Bauersfeld; Antonio Loquercio; Matthias Müller; Vladlen Koltun; Davide Scaramuzza,2023,Nature,10.1038/s41586-023-06419-4,https://www.nature.com/articles/s41586-023-06419-4,journal article,publisher::https://www.nature.com/articles/s41586-023-06419-4,publisher::https://www.nature.com/articles/s41586-023-06419-4,publisher::https://www.nature.com/articles/s41586-023-06419-4,publisher::https://www.nature.com/articles/s41586-023-06419-4,publisher::https://www.nature.com/articles/s41586-023-06419-4,publisher::https://www.nature.com/articles/s41586-023-06419-4,publisher::https://www.nature.com/articles/s41586-023-06419-4,article,journal,https://doi.org/10.1038/s41586-023-06419-4,Kaufmann,personal;personal;personal;personal;personal;personal,Metadata verified from the official Nature article record.
C0096,b2679645676e8cb0f6fda21ecc2b8bd93af1dcc14c62782a91957e6a776c9eda,metadata-06,NR,unverified,Autonomous Vehicles on the Edge: A Survey on Autonomous Vehicle Racing,Johannes Betz; Hongrui Zheng; Alexander Liniger; Ugo Rosolia; Phillip Karle; Madhur Behl; Venkat Krovi; Rahul Mangharam,2022,IEEE Open Journal of Intelligent Transportation Systems,10.1109/ojits.2022.3181510,https://doi.org/10.1109/ojits.2022.3181510,journal article,preprint_repository::https://arxiv.org/abs/2202.07008;crossref::https://api.crossref.org/works/10.1109/ojits.2022.3181510,preprint_repository::https://arxiv.org/abs/2202.07008;crossref::https://api.crossref.org/works/10.1109/ojits.2022.3181510,preprint_repository::https://arxiv.org/abs/2202.07008;crossref::https://api.crossref.org/works/10.1109/ojits.2022.3181510,crossref::https://api.crossref.org/works/10.1109/ojits.2022.3181510,doi::https://doi.org/10.1109/ojits.2022.3181510,doi::https://doi.org/10.1109/ojits.2022.3181510,crossref::https://api.crossref.org/works/10.1109/ojits.2022.3181510,article,journal,https://doi.org/10.1109/ojits.2022.3181510,Betz,personal;personal;personal;personal;personal;personal;personal;personal,"Official arXiv record and Crossref corroborate complete metadata, but IEEE Xplore was inaccessible, so the published record remains unverified."
C0104,23d23b3e8a1c5e46ab504577c77b78d70bf23c64f02859323423d4d6b4372c36,metadata-06,2026-06-30,verified,Air Learning: a deep reinforcement learning gym for autonomous aerial robot visual navigation,Srivatsan Krishnan; Behzad Boroujerdian; William Fu; Aleksandra Faust; Vijay Janapa Reddi,2021,Machine Learning,10.1007/s10994-021-06006-6,https://link.springer.com/article/10.1007/s10994-021-06006-6,journal article,publisher::https://link.springer.com/article/10.1007/s10994-021-06006-6,publisher::https://link.springer.com/article/10.1007/s10994-021-06006-6,publisher::https://link.springer.com/article/10.1007/s10994-021-06006-6,publisher::https://link.springer.com/article/10.1007/s10994-021-06006-6,publisher::https://link.springer.com/article/10.1007/s10994-021-06006-6,publisher::https://link.springer.com/article/10.1007/s10994-021-06006-6,publisher::https://link.springer.com/article/10.1007/s10994-021-06006-6,article,journal,https://doi.org/10.1007/s10994-021-06006-6,Krishnan,personal;personal;personal;personal;personal,Metadata verified from the official Springer journal record.
C0108,1d307a2514847dfce0c749be3439cbacc31dab8f138fb62addf6786644bfa03f,metadata-06,NR,unverified,AmbieGen: A search-based framework for autonomous systems testing,Dmytro Humeniuk; Foutse Khomh; Giuliano Antoniol,2023,Science of Computer Programming,10.1016/j.scico.2023.102990,https://www.sciencedirect.com/science/article/pii/S0167642323000722,journal article,publisher::https://api.elsevier.com/content/article/pii/S0167642323000722,crossref::https://api.crossref.org/works/10.1016/j.scico.2023.102990,publisher::https://api.elsevier.com/content/article/pii/S0167642323000722,publisher::https://api.elsevier.com/content/article/pii/S0167642323000722,publisher::https://api.elsevier.com/content/article/pii/S0167642323000722,publisher::https://api.elsevier.com/content/article/pii/S0167642323000722,publisher::https://api.elsevier.com/content/article/pii/S0167642323000722,article,journal,https://doi.org/10.1016/j.scico.2023.102990,Humeniuk,personal;personal;personal,"Official Elsevier metadata confirms title, journal, 2023 cover date, DOI, and journal aggregation. Crossref corroborates the complete authors, but the accessible publisher endpoint omits them, so the record remains unverified."
C0110,53e3cd422ce21013474dfe9ab2501a65f0d5a80a292f1b0b65fd72316fe6addd,metadata-06,NR,unverified,CRAG – a combinatorial testing-based generator of road geometries for ADS testing,Paolo Arcaini; Ahmet Cetinkaya,2024,Science of Computer Programming,10.1016/j.scico.2024.103171,https://www.sciencedirect.com/science/article/pii/S0167642324000947,journal article,publisher::https://api.elsevier.com/content/article/pii/S0167642324000947,crossref::https://api.crossref.org/works/10.1016/j.scico.2024.103171,publisher::https://api.elsevier.com/content/article/pii/S0167642324000947,publisher::https://api.elsevier.com/content/article/pii/S0167642324000947,publisher::https://api.elsevier.com/content/article/pii/S0167642324000947,publisher::https://api.elsevier.com/content/article/pii/S0167642324000947,publisher::https://api.elsevier.com/content/article/pii/S0167642324000947,article,journal,https://doi.org/10.1016/j.scico.2024.103171,Arcaini,personal;personal,"Official Elsevier metadata confirms title, journal, 2024 cover date, DOI, and journal aggregation. Crossref corroborates the complete authors, but the accessible publisher endpoint omits them, so the record remains unverified."
C0112,8a696f7bae396a6ef60471635b5fad4886b976a684d10eadd0d16f61d6a82baf,metadata-06,NR,unverified,ASVSim (AirSim for Surface Vehicles): A High-Fidelity Simulation Framework for Autonomous Surface Vehicle Research,Bavo Lesy; Siemen Herremans; Robin Kerstens; Jan Steckel; Walter Daems; Siegfried Mercelis; Ali Anwar,2026,IEEE Access,10.1109/ACCESS.2026.3687084,https://doi.org/10.1109/access.2026.3687084,journal article,preprint_repository::https://arxiv.org/abs/2506.22174;crossref::https://api.crossref.org/works/10.1109/access.2026.3687084,preprint_repository::https://arxiv.org/abs/2506.22174;crossref::https://api.crossref.org/works/10.1109/access.2026.3687084,preprint_repository::https://arxiv.org/abs/2506.22174;crossref::https://api.crossref.org/works/10.1109/access.2026.3687084,crossref::https://api.crossref.org/works/10.1109/access.2026.3687084,doi::https://doi.org/10.1109/ACCESS.2026.3687084,doi::https://doi.org/10.1109/access.2026.3687084,crossref::https://api.crossref.org/works/10.1109/access.2026.3687084,article,journal,https://doi.org/10.1109/ACCESS.2026.3687084,Lesy,personal;personal;personal;personal;personal;personal;personal,"Official arXiv record and Crossref corroborate complete metadata, but IEEE Xplore was inaccessible, so the published record remains unverified."
C0118,cee33bfabbad628575a6dece44e2c8975a8ab05612e1d8fa11b4036135f30bd5,metadata-06,NR,unverified,Virtual Worlds for Testing Robot Navigation: A Study on the Difficulty Level,Thierry Sotiropoulos; Jeremie Guiochet; Felix Ingrand; Helene Waeselynck,2016,2016 12th European Dependable Computing Conference (EDCC),10.1109/edcc.2016.14,https://doi.org/10.1109/edcc.2016.14,conference paper,crossref::https://api.crossref.org/works/10.1109/edcc.2016.14,crossref::https://api.crossref.org/works/10.1109/edcc.2016.14,crossref::https://api.crossref.org/works/10.1109/edcc.2016.14,crossref::https://api.crossref.org/works/10.1109/edcc.2016.14,doi::https://doi.org/10.1109/edcc.2016.14,doi::https://doi.org/10.1109/edcc.2016.14,crossref::https://api.crossref.org/works/10.1109/edcc.2016.14,inproceedings,booktitle,https://doi.org/10.1109/edcc.2016.14,Sotiropoulos,personal;personal;personal;personal,"Crossref corroborates complete metadata, but IEEE Xplore was inaccessible, so published core metadata remains unverified."
C0124,043f21a7c939916529ba91477831fe45e3585263d74e0eade5e95440eb08b549,metadata-06,NR,unverified,AV-FUZZER: Finding Safety Violations in Autonomous Driving Systems,Guanpeng Li; Yiran Li; Saurabh Jha; Timothy Tsai; Michael Sullivan; Siva Kumar Sastry Hari; Zbigniew Kalbarczyk; Ravishankar Iyer,2020,2020 IEEE 31st International Symposium on Software Reliability Engineering (ISSRE),10.1109/issre5003.2020.00012,https://doi.org/10.1109/issre5003.2020.00012,conference paper,crossref::https://api.crossref.org/works/10.1109/issre5003.2020.00012,crossref::https://api.crossref.org/works/10.1109/issre5003.2020.00012,crossref::https://api.crossref.org/works/10.1109/issre5003.2020.00012,crossref::https://api.crossref.org/works/10.1109/issre5003.2020.00012,doi::https://doi.org/10.1109/issre5003.2020.00012,doi::https://doi.org/10.1109/issre5003.2020.00012,crossref::https://api.crossref.org/works/10.1109/issre5003.2020.00012,inproceedings,booktitle,https://doi.org/10.1109/issre5003.2020.00012,Li,personal;personal;personal;personal;personal;personal;personal;personal,"Crossref corroborates complete metadata, but IEEE Xplore was inaccessible, so published core metadata remains unverified."
C0128,d9123bc53b161c42ff453568fc0e7bcded048676c5c679741a5d8382d1ca3578,metadata-06,NR,conflict,CommonRoad: Composable Benchmarks for Motion Planning on Roads,Matthias Althoff; Markus Koschi; Stefanie Manzinger,2017,2017 IEEE Intelligent Vehicles Symposium (IV),10.1109/IVS.2017.7995802,https://doi.org/10.1109/ivs.2017.7995802,primary paper; official repository; official benchmark portal,official_repository::https://commonroad.in.tum.de/static/media/LA17.8f9d9dc3.pdf;crossref::https://api.crossref.org/works/10.1109/ivs.2017.7995802,official_repository::https://commonroad.in.tum.de/static/media/LA17.8f9d9dc3.pdf;crossref::https://api.crossref.org/works/10.1109/ivs.2017.7995802,official_repository::https://commonroad.in.tum.de/static/media/LA17.8f9d9dc3.pdf;crossref::https://api.crossref.org/works/10.1109/ivs.2017.7995802,crossref::https://api.crossref.org/works/10.1109/ivs.2017.7995802,doi::https://doi.org/10.1109/ivs.2017.7995802,doi::https://doi.org/10.1109/ivs.2017.7995802,NR,inproceedings,booktitle,https://doi.org/10.1109/ivs.2017.7995802,Althoff,personal;personal;personal,"The official CommonRoad-hosted paper and Crossref corroborate core metadata, but IEEE Xplore was inaccessible. Frozen venue and source-type conflicts remain unresolved."
