assignment_id,candidate_id,input_sha256,snapshot_sha256,batch_id,phase,title,authors,year,venue,doi,url,source_type
A-C0175-03,C0175,a40f8096547c0cb64eaf0787a6e41c5a41331631c274c0216d035814f970598f,d91b44f278376601725a8290d24c75326d02808513f3e6c40f77b89493d6f14f,screening-03,calibration,CARLA Autonomous Driving Leaderboard 2.0,CARLA Leaderboard Team,NR,CARLA Leaderboard documentation and repositories,NR,https://leaderboard.carla.org/get_started_v2_0/,benchmark; official documentation; official repository
A-C0176-03,C0176,4616c1c26080aab1587b7dca0ca417795340a520d86a7aee63e8fd4546dc0e7a,d91b44f278376601725a8290d24c75326d02808513f3e6c40f77b89493d6f14f,screening-03,main,CommonRoad Scenario Designer: An Open-Source Toolbox for Map Conversion and Scenario Creation for Autonomous Vehicles,Sebastian Maierhofer; Moritz Klischat; Matthias Althoff,2021,2021 IEEE International Intelligent Transportation Systems Conference (ITSC),10.1109/itsc48978.2021.9564885,https://doi.org/10.1109/itsc48978.2021.9564885,conference paper
A-C0182-03,C0182,e3445c9786229e06ef9b08fa7c15b28ce7c6a9ea13196f2c928c5ec083bcf499,d91b44f278376601725a8290d24c75326d02808513f3e6c40f77b89493d6f14f,screening-03,main,f1tenth/f1tenth_racetracks,F1TENTH,2021,GitHub repository,NR,https://github.com/f1tenth/f1tenth_racetracks,dataset repository
A-C0185-03,C0185,05a109e97f17559f808b47cbe97a3c0420c0fed0bcff1091d2a78df637f1a293,d91b44f278376601725a8290d24c75326d02808513f3e6c40f77b89493d6f14f,screening-03,main,FSSIM,Juraj Kabzan,2019,Official GitHub repository,NR,https://github.com/AMZ-Racing/fssim,simulator software
A-C0189-03,C0189,b1d5640a35d9a4ef2bacc2fe76f2d51ff94988f7f826d4cc26a8d8dcf398d227,d91b44f278376601725a8290d24c75326d02808513f3e6c40f77b89493d6f14f,screening-03,main,TUMFTM/laptime-simulation,TUM - Institute of Automotive Technology,2020,GitHub repository,NR,https://github.com/TUMFTM/laptime-simulation,software repository
A-C0194-03,C0194,3a0e86ee1b1f8306fdb876a2574f1f4e6ee97d4840319d1b8b6102b7bfb07d7d,d91b44f278376601725a8290d24c75326d02808513f3e6c40f77b89493d6f14f,screening-03,main,PyFlyt -- UAV Simulation Environments for Reinforcement Learning Research,Jun Jet Tai; Jim Wong; Mauro Innocente; Nadjim Horri; James Brusey; Swee King Phang,2023,arXiv,10.48550/arxiv.2304.01305,https://arxiv.org/abs/2304.01305,preprint
A-C0199-03,C0199,4277b812688be8be7c2747140796b9a5ec96614f97834f14f011b1599da7a9ff,d91b44f278376601725a8290d24c75326d02808513f3e6c40f77b89493d6f14f,screening-03,main,Robot Parkour Learning,Ziwen Zhuang; Zipeng Fu; Jianren Wang; Christopher G. Atkeson; Sören Schwertfeger; Chelsea Finn; Hang Zhao,2023,Proceedings of The 7th Conference on Robot Learning,NR,https://proceedings.mlr.press/v229/zhuang23a.html,conference paper
A-C0201-03,C0201,2b34bdca537ff0af3dad12bdb7849f1f7c585d0e6cbabca60d2f8fe29a9157d6,d91b44f278376601725a8290d24c75326d02808513f3e6c40f77b89493d6f14f,screening-03,main,SailBot 2022 Events,SailBot Organizing Committee,2022,SailBot official competition event specification,NR,https://www.sailbot.org/wp-content/uploads/2022/05/SailBot-2022-Events.pdf,official competition specification
A-C0207-03,C0207,5badec865d11d3ab155667511e87fe7ade1816a64b2b8f995dd00e254391231e,d91b44f278376601725a8290d24c75326d02808513f3e6c40f77b89493d6f14f,screening-03,main,VRX Competition Technical Guide: Virtual RobotX 2022 Competition,RoboNation; Open Robotics,2021,Virtual RobotX 2022 competition documentation,NR,https://robonation.org/app/uploads/sites/2/2021/11/VRX2022_Technical-Guide_v1.1.pdf,official competition documentation; official repository
