assignment_id,phase,candidate_id,input_sha256,snapshot_sha256,batch_id,coder_id,screened_on,screening_status,criterion,access_status,source_urls,evidence_version,evidence_retrieved_on,evidence_archive_url,evidence_sha256,screening_locator,exclusion_reason,notes
A-C0011-03,calibration,C0011,8e6ea6e555dda494269cedd557e06171b5ebc06b5ffde6b90ef5c9022aab11dc,c0977ed07d0c0bb25ea3a6be52e377f86d10bf3fff91d6bdccd389395e842c07,screening-03,screening-03,2026-07-03,included,include-relevant,full_text,https://www.ijeei.org/docs-1804133866588e9f62ade3b.pdf,IJEEI-8-4-2016,2026-07-02,NR,653c84ca93cecdadc6614e817765da0422340cf249b5fb7824c6c83fbb5a632a,PDF p. 1; Abstract; PDF p. 5; Section 4. Track Representation,NR,Adjacent-domain mapping: the parameterized closed segment sequence transfers directly to a simulated racing-robot course centerline without changing the generation claim.
A-C0025-03,calibration,C0025,78066781b75e467b23083aa8705d4661317060ff6b9d8d30771f8065d8f29b5c,c0977ed07d0c0bb25ea3a6be52e377f86d10bf3fff91d6bdccd389395e842c07,screening-03,screening-03,2026-07-03,included,include-relevant,full_text,https://proceedings.mlr.press/v123/madaan20a/madaan20a.pdf,PMLR-v123-2020,2026-07-02,NR,ed3a9384cec193068e9c1631b7076a8eae1f8eaed2cbe704cdda7bac50e8ab7c,PDF p. 1; Abstract; PDF p. 4; Section 3. AirSim Drone Racing Lab,NR,NR
A-C0046-03,calibration,C0046,828a9557ee0299024f4776f385d6ba0a8165b379ee26b80c2a1c7496f31e4fca,c0977ed07d0c0bb25ea3a6be52e377f86d10bf3fff91d6bdccd389395e842c07,screening-03,screening-03,2026-07-03,excluded,exclude-insufficient-detail,full_text,https://arxiv.org/pdf/2109.12674v3,arXiv-2109.12674v3,2026-07-02,NR,72e78ea7f50b48779f8f6e6344cdba945a5d0d1502139ff5dd16018215f5e2ef,PDF artifact; structural parse failure before page enumeration (missing trailer and page tree),The staged MetaDrive PDF is structurally unreadable and supplies no inspectable material full-text evidence.,Packet defect: staged PDF is structurally unreadable (missing trailer and page tree).
A-C0063-03,calibration,C0063,f10c34f0102f7ce3dda4975eece0d0ea0803d32e37477df075a1ac8717700ec6,c0977ed07d0c0bb25ea3a6be52e377f86d10bf3fff91d6bdccd389395e842c07,screening-03,screening-03,2026-07-03,included,include-relevant,official_documentation,https://github.com/AntoineRichard/TrackGen/blob/cf9e9433eafa30c8311476cf75a356dd42c541cd/track_gen/_src/track_generator.py,git-cf9e9433eafa30c8311476cf75a356dd42c541cd,2026-07-02,NR,c130ac12a1f94cb2514c17bcbb485747499bc31878d4d01aa72f0b587419dafd,track_gen/_src/track_generator.py:34-45; track_gen/_src/track_generator.py:103-116,NR,NR
A-C0134-03,calibration,C0134,3f31e1bbc7a524493547d90db96df13be456f86940abe8a8743d8c1db607ed83,c0977ed07d0c0bb25ea3a6be52e377f86d10bf3fff91d6bdccd389395e842c07,screening-03,screening-03,2026-07-03,included,include-relevant,full_text,https://doi.org/10.1109/sbft59156.2023.00006,IEEE-SBFT-2023,2026-07-03,NR,f945db58780cf03f757f58865d7516412a6d598a94c2880eb238796bdf81ea3a,PDF p. 1; Section I. Introduction; Section II.A-B,NR,Adjacent-domain mapping: the road-segment generator transfers directly to a parameterized simulated racing-robot course route without changing its generation claim.
A-C0147-03,calibration,C0147,a6e8bc4417f99d4511a40a3547d4d75c99c295dd4c029dd52ba42a6d229ab080,c0977ed07d0c0bb25ea3a6be52e377f86d10bf3fff91d6bdccd389395e842c07,screening-03,screening-03,2026-07-03,included,include-relevant,official_documentation,https://github.com/osrf/vrx/tree/3a0aa019,git-3a0aa019,2026-07-02,NR,256d90498087a28c4fe4aad66d817b2dc086cdd408fb20b25cb3db1dc6489c84,vrx-navigation-course-3a0aa019.sdf:2-4; vrx-navigation-course-3a0aa019.sdf:6-90,NR,Supporting mapping: use the fixed SDF buoy-boundary coordinates as a citable simulator-course interface in the survey benchmark representation; it is not a generation method.
A-C0175-03,calibration,C0175,bbdd844c7b7e06c0b1df95a20f99d723117cb805ebe1ac738fff941054d86b3f,c0977ed07d0c0bb25ea3a6be52e377f86d10bf3fff91d6bdccd389395e842c07,screening-03,screening-03,2026-07-03,included,include-relevant,official_documentation,https://github.com/carla-simulator/leaderboard/tree/a87a3419e9d2e0d36deb25f1f26c17edee2d1420,git-a87a3419e9d2e0d36deb25f1f26c17edee2d1420,2026-07-02,NR,52c46f4889632be30af5c1a294275635aae0b22175921e909311c1a49716c85f,README.md:1-6; data/routes_training.xml: route id=0 waypoints; leaderboard/utils/route_parser.py:102-145,NR,Supporting mapping: use the fixed ordered route waypoints and parser as a citable benchmark course interface in the survey representation; it is not a generation method.
