candidate_id,cite_key,title,authors,year,venue,doi,url,source_type,discovery_stream,discovery_query,discovery_agent,screening_status,exclusion_reason,metadata_status,metadata_evidence,domain,vehicle,course_object,representation_family,generator_family,generation_role,validity_strategy,geometry_metrics,difficulty_metrics,diversity_metrics,training_distribution,evaluation_suite,simulator,export_format,code_status,asset_status,reproducibility_fields,evidence_locator,coding_notes
BG-033,WangEtAl2019POET,Paired Open-Ended Trailblazer (POET): Endlessly Generating Increasingly Complex and Diverse Learning Environments and Their Solutions,Rui Wang; Joel Lehman; Jeff Clune; Kenneth O. Stanley,2019,arXiv,10.48550/arXiv.1901.01753,https://arxiv.org/abs/1901.01753,preprint; official software,open-ended terrain curricula,open ended environment generation BipedalWalker obstacle courses POET PAIRED,blind-ground,candidate,NR,unverified,https://arxiv.org/abs/1901.01753; https://github.com/uber-research/poet/tree/8669a17e6958f80cd547b2de61c51d4518c833d9,robot learning; open-ended locomotion,simulated biped,2D obstacle course/terrain,environment parameter vector for roughness; stump height/spacing; gaps; stairs,mutation; novelty search; paired agent-environment evolution,mutates courses and maintains an open-ended distribution paired with policies,minimal criterion accepts environments neither too easy nor impossible; transfer tests,obstacle/gap/roughness parameters,agent return; minimal-criterion score range 50-300,environment novelty; archive diversity,continually expanding archive from an initial flat course,BipedalWalker-style experiments over open-ended runs; exact archive size NR,OpenAI Gym BipedalWalker-derived environment,environment parameter vector/runtime level,official_open,NR,environment bounds; mutation schedule; minimal criterion; novelty; transfer frequency; seeds; Fiber; NEAT-Python; OpenAI Gym,https://arxiv.org/pdf/1901.01753; https://github.com/uber-research/poet/blob/8669a17e6958f80cd547b2de61c51d4518c833d9/README.md,Course distribution coevolves with solutions; policy transfer is not itself course generation. The Uber Research repository explicitly implements POET and Enhanced POET and is pinned at 8669a17e6958f80cd547b2de61c51d4518c833d9. No generated-environment archive was verified as a released asset.
BG-034,WangEtAl2020EnhancedPOET,Enhanced POET: Open-Ended Reinforcement Learning through Unbounded Invention of Learning Challenges and their Solutions,Rui Wang; Joel Lehman; Aditya Rawal; Jiale Zhi; Yulun Li; Jeff Clune; Kenneth O. Stanley,2020,Proceedings of the 37th International Conference on Machine Learning; PMLR 119,NR,https://proceedings.mlr.press/v119/wang20l.html,conference paper; official software,open-ended terrain curricula,site:proceedings.mlr.press POET open ended environments BipedalWalker,blind-ground,candidate,NR,unverified,https://proceedings.mlr.press/v119/wang20l.html; https://github.com/uber-research/poet/tree/8669a17e6958f80cd547b2de61c51d4518c833d9,robot learning; open-ended locomotion,simulated biped,2D obstacle course/terrain,bounded environmental-characteristic vector with extended obstacle ranges,open-ended mutation; novelty; paired transfer,extends POET to invent progressively harder and more diverse courses beyond original bounds,minimal criterion; agent-transfer solvability checks; range expansion,stumps; gaps; roughness; stair parameters,agent return; solved-environment progression,novelty; archive coverage; challenge diversity,continually expanded environment-policy archive,long-running BipedalWalker experiments; exact archive counts vary by run,BipedalWalker-derived simulator,environment parameter vector/runtime level,official_open,NR,range expansion; mutation; minimal criterion; transfer; run length; seeds; Fiber; NEAT-Python; OpenAI Gym,https://proceedings.mlr.press/v119/wang20l/wang20l.pdf; https://github.com/uber-research/poet/blob/8669a17e6958f80cd547b2de61c51d4518c833d9/README.md,Enhanced POET changes the course distribution as well as the paired policies. The Uber Research repository explicitly implements POET and Enhanced POET and is pinned at 8669a17e6958f80cd547b2de61c51d4518c833d9. No generated-environment archive was verified as a released asset.
BG-035,RudinEtAl2022LearningToWalk,Learning to Walk in Minutes Using Massively Parallel Deep Reinforcement Learning,Nikita Rudin; David Hoeller; Philipp Reist; Marco Hutter,2022,Proceedings of the 5th Conference on Robot Learning; PMLR 164,NR,https://proceedings.mlr.press/v164/rudin22a.html,conference paper; official software,legged-robot terrain curricula,"""Learning to Walk in Minutes"" terrain curriculum procedural terrain official",blind-ground,candidate,NR,unverified,https://proceedings.mlr.press/v164/rudin22a.html; https://github.com/leggedrobotics/legged_gym/tree/8fa29acc6fd1910c3d9659eef6310bdd301cde0a,legged-robot learning,quadruped,rough-terrain training course,heightfield/trimesh terrain tiles arranged by type columns and difficulty rows,procedural terrain primitives; performance curriculum,samples terrain tiles and promotes/demotes robots across difficulty levels,simulator collision geometry; curriculum movement based on traveled distance,slope; stair; obstacle; roughness parameters,distance traveled; tracking reward; curriculum level,parallel mixture of terrain types; explicit diversity metric NR,thousands of parallel environments across terrain type/difficulty grid,flat-ground policy under 4 minutes; rough-terrain policy about 20 minutes; hardware tests,NVIDIA Isaac Gym,heightfield; triangle mesh; Isaac Gym environment,official_open,NR,environment count; terrain grid; curriculum thresholds; PPO and hardware settings; seed,https://proceedings.mlr.press/v164/rudin22a/rudin22a.pdf; https://github.com/leggedrobotics/legged_gym/tree/8fa29acc6fd1910c3d9659eef6310bdd301cde0a,"Geometry curriculum is in scope; dynamics randomization is a separate training component. Official code repository pinned at 8fa29acc6fd1910c3d9659eef6310bdd301cde0a; terrain configurations are code inputs, not coded as a separate released course asset."
BG-036,ZhuangEtAl2023RobotParkour,Robot Parkour Learning,Ziwen Zhuang; Zipeng Fu; Jianren Wang; Christopher Atkeson; Soeren Schwertfeger; Chelsea Finn; Hang Zhao,2023,Proceedings of the 7th Conference on Robot Learning,NR,https://proceedings.mlr.press/v229/zhuang23a.html,conference paper; official project,legged-robot obstacle courses,"""Robot Parkour Learning"" terrain generation obstacle curriculum",blind-ground,candidate,NR,unverified,https://proceedings.mlr.press/v229/zhuang23a.html; https://robot-parkour.github.io/,agile legged control,quadruped,parkour obstacle course,parameterized 3D obstacle primitives and sequential mixed courses,procedural sampling; automatic curriculum; soft-to-hard dynamics,constructs climb; leap; crawl; tilt; slit; and run obstacles for skill and composition training,soft-contact/penetration training stage; hard physical constraints; curriculum gating,obstacle dimensions; sequence composition,skill success; course completion; tracking performance,held-out obstacle parameters and mixed-course variety,parallel obstacle instances with progressively harder parameter ranges,simulation; indoor and outdoor real-robot courses; exact trial counts NR,Isaac Gym; Unitree A1/Go1 hardware,simulator terrain meshes,NR,NR,obstacle ranges; curriculum thresholds; soft/hard stage; policy and hardware settings,https://proceedings.mlr.press/v229/zhuang23a/zhuang23a.pdf; https://robot-parkour.github.io/,Obstacle-course construction is in scope; the skill selector/controller is downstream. The official project page provides paper/video evidence but no code or downloadable course-asset locator was asserted.
BG-037,ChengEtAl2024ExtremeParkour,Extreme Parkour with Legged Robots,Xuxin Cheng; Kexin Shi; Ananye Agarwal; Deepak Pathak,2024,Science Robotics 9,10.1126/scirobotics.adi7566,https://doi.org/10.1126/scirobotics.adi7566,journal article; official project,legged-robot obstacle courses,"""Extreme Parkour with Legged Robots"" procedural terrains",blind-ground,candidate,NR,unverified,https://doi.org/10.1126/scirobotics.adi7566; https://extreme-parkour.github.io/,agile legged control,quadruped,parkour obstacle course,parameterized terrain/obstacle meshes; sequences of gaps; hurdles; ramps and platforms,procedural randomization; staged curriculum,samples diverse parkour geometry for perception-conditioned locomotion training,curriculum restricts obstacle ranges to achievable levels; collision/kinematic simulation,gap; height; incline; clearance parameters,obstacle traversal and course success,randomized obstacle instances; held-out real layouts,massively parallel procedurally varied obstacle courses,simulation and real-world parkour evaluations; exact trials NR,Isaac Gym; Unitree quadruped,terrain mesh/runtime environment,NR,NR,obstacle ranges; curriculum; environment count; policy; sensor and hardware settings,https://doi.org/10.1126/scirobotics.adi7566; https://extreme-parkour.github.io/,Geometry randomization is separated from sensor and dynamics randomization. The official project page is evidence for the paper and demonstrations; it was not treated as proof of an open code or course-asset release.
BG-038,LiangEtAl2024Eurekaverse,Eurekaverse: Environment Curriculum Generation via Large Language Models,William Liang; Sam Wang; Hung-Ju Wang; Osbert Bastani; Dinesh Jayaraman; Yecheng Jason Ma,2024,Conference on Robot Learning (CoRL),10.48550/arXiv.2411.01775,https://arxiv.org/abs/2411.01775,conference paper; official software,legged-robot terrain curricula,"""Eurekaverse"" terrain generation quadruped official paper",blind-ground,candidate,NR,unverified,https://arxiv.org/abs/2411.01775; https://eureka-research.github.io/eurekaverse/; https://github.com/eureka-research/eurekaverse/tree/efee5a64ea3e32deeb90f0051193f1a7e43e925b,agile legged control,quadruped,parkour terrain/course distribution,executable terrain-generation programs producing heightfields/meshes,large-language-model program generation; iterative curriculum evolution,writes and revises terrain generators to create learnable; diverse; progressively harder courses,program execution/static checks; policy-feedback learnability tests; diversity prompting,terrain dimensions and obstacle parameters emitted by code,policy return; terrain pass rate; curriculum progress,terrain-program and generated-course diversity,multiple generated terrain programs sampled in parallel and iterated from feedback,simulation comparisons and zero-shot real-robot courses; exact generated count NR,Isaac Gym; quadruped hardware,Python terrain code; heightfield/mesh,official_open,NR,LLM/version; prompts; feedback; terrain-program count; seeds; policy settings; simulator settings; MIT license,https://eureka-research.github.io/eurekaverse/assets/eurekaverse_paper.pdf; https://github.com/eureka-research/eurekaverse/tree/efee5a64ea3e32deeb90f0051193f1a7e43e925b,"Unlike reward-generation work, the generated artifact here is executable course geometry. Official code repository pinned at efee5a64ea3e32deeb90f0051193f1a7e43e925b; generated programs embedded in the codebase were not separately coded as an asset release."
BG-039,ZhouVanschoren2022OpenEndedLocomotion,Open-Ended Learning Strategies for Learning Complex Locomotion Skills,Fangqin Zhou; Joaquin Vanschoren,2022,arXiv,10.48550/arXiv.2206.06796,https://arxiv.org/abs/2206.06796,preprint,open-ended terrain curricula,procedural obstacle course generation quadruped robot reinforcement learning paper,blind-ground,candidate,NR,unverified,https://arxiv.org/abs/2206.06796,robot learning; open-ended locomotion,simulated 3D legged agent,3D terrain/course,CPPN-NEAT terrain encoding; randomized terrain shapes,enhanced POET; neuroevolutionary environment mutation,adapts open-ended paired environment generation to complex 3D locomotion terrains,minimal criterion and agent-transfer checks; simulator collision validity,terrain-shape descriptors NR,agent return; locomotion progress,novelty/archive diversity,open-ended evolving terrain-policy archive,comparisons against open-ended baselines; exact runs NR,3D locomotion simulator NR,runtime terrain representation,NR,NR,terrain encoding; mutation; minimal criterion; transfer schedule; run seeds,https://arxiv.org/pdf/2206.06796,Included for generated 3D courses; general open-ended task scheduling alone would be excluded. Paper figures/examples are not coded as an open asset release.
BG-040,RajDasXiao2026RobotSquidGame,Robot Squid Game: Quadrupedal Locomotion for Traversing Narrow Tunnels,Amir Hossain Raj; Dibyendu Das; Xuesu Xiao,2026,arXiv,10.48550/arXiv.2605.13665,https://arxiv.org/abs/2605.13665,preprint,legged-robot obstacle courses,"""procedural tunnel geometry"" quadruped robot course generation",blind-ground,candidate,NR,unverified,https://arxiv.org/abs/2605.13665,agile legged control,Unitree Go2 quadruped,3D tunnel course,chains of hollow blocks with triangle; circle; half-circle; and gap cross sections,parametric procedural generation; difficulty curriculum,samples and connects tunnel segments with continuously varied clearance; rotation; orientation and gap geometry,class-specific parameter bounds; sequential curriculum; simulator collision checks,edge length; radius; gap width; shelf angle; rotation; incline,traversal success by difficulty; collision; 80 percent completion criterion,four geometry classes; continuous per-episode variation,2048 parallel environments; four expert-class distributions; class-balanced distillation replay,simulation by three difficulty levels; 10 real trials per reported tunnel configuration,Isaac Gym; Unitree Go2,triangle-mesh tunnel blocks/runtime environment,NR,NR,difficulty equations; 2048 environments; 10000 teacher iterations; sensing; real-trial protocol,https://arxiv.org/pdf/2605.13665,Procedural 3D confinement geometry is central; policy distillation is downstream. No official code or modular-tunnel asset release was located in the primary paper.
BG-041,HumeniukKhomhAntoniol2024RIGAA,Reinforcement Learning Informed Evolutionary Search for Autonomous Systems Testing,Dmytro Humeniuk; Foutse Khomh; Giuliano Antoniol,2024,ACM Transactions on Software Engineering and Methodology 33(8),10.1145/3680468,https://doi.org/10.1145/3680468,journal article; official artifact,targeted refinement round 1,"""RIGAA"" road topology generation autonomous vehicle",blind-ground,candidate,NR,unverified,https://doi.org/10.1145/3680468; https://arxiv.org/abs/2308.12762; https://zenodo.org/records/13131708,autonomous-systems testing,simulated car; MuJoCo Ant robot,road topology; maze course,road segment/action sequence; axis-aligned maze walls,reinforcement-learning-informed genetic algorithm; NSGA-II,uses an RL agent to seed evolutionary generation of failure-revealing roads and robot mazes,surrogate/domain rewards; representation bounds; evolutionary validity filters,road shape; maze topology NR,lane deviation; robot task failure; average test fitness,suite diversity; novelty,RL-generated initial population mixed with evolutionary candidates,two case studies; comparisons under a two-hour road-test budget reported,BeamNG.tech; MuJoCo-style Ant environment,BeamNG/SBFT road test; maze representation,official_open,official_open,RL training; seed fraction; EA settings; budgets; simulator/agent versions; seeds,https://arxiv.org/pdf/2308.12762; https://doi.org/10.1145/3680468; https://zenodo.org/records/13131708/files/RIGAA_tool.zip,"New in refinement round 1; generates geometry rather than only prioritizing tests. Zenodo record 13131708 is author-deposited and contains RIGAA_tool.zip, supporting both official_open statuses."
BG-042,AyerdiArrietaIllarramendi2023RoadSign,RoadSign at the SBFT 2023 Tool Competition Cyber-Physical Systems Track,Jon Ayerdi; Aitor Arrieta; Miren Illarramendi,2023,16th IEEE/ACM International Workshop on Search-Based and Fuzz Testing (SBFT),10.1109/SBFT59156.2023.00006,https://ieeexplore.ieee.org/document/10190387/,conference tool paper,targeted refinement round 1,"""RoadSign"" failure-revealing roads self-driving cars",blind-ground,candidate,NR,unverified,https://doi.org/10.1109/SBFT59156.2023.00006; https://ieeexplore.ieee.org/document/10190387/; https://www.beamng.tech/research/; https://sites.mdu.se/download/18.309552f318f0faf8277bd26/1714383875311/SBFT_Tool_Competition_2023_-_Cyber-Physical_Systems_Track.pdf,autonomous-vehicle testing,simulated car,road/test course,NR,diversity-promoting seeding; multiobjective optimization,generates failure-revealing roads by maximizing road features associated with out-of-bounds behavior,NR,direction coverage; maximum curvature,out-of-bounds events,four-dimensional feature-map out-of-bounds coverage,diversity-promoting seeded population; multiobjective search,SBFT 2023 CPS competition against BeamNG.AI and DAVE-2,BeamNG.tech; BeamNG.AI; DAVE-2,NR,NR,NR,seeding strategy; multiobjective search; competition budget; agent configurations; simulator configuration,"https://ieeexplore.ieee.org/document/10190387/; BeamNG official index entry abstract: https://www.beamng.tech/research/; SBFT 2023 competition report, pp. 46-48: https://sites.mdu.se/download/18.309552f318f0faf8277bd26/1714383875311/SBFT_Tool_Competition_2023_-_Cyber-Physical_Systems_Track.pdf","New in refinement round 1. DOI and IEEE document 10190387 are resolved. The RoadSign abstract and official competition report support seeding, multiobjective optimization, two agents, feature-map diversity, and >95% validity; exact road representation, validity predicates, export format, code, and released test assets remain NR."
BG-043,DeVivoFasolino2023Spirale,Spirale at the SBFT 2023 Tool Competiton - Cyber-Physical Systems Track,Domenico De Vivo; Anna Rita Fasolino,2023,16th IEEE/ACM International Workshop on Search-Based and Fuzz Testing (SBFT),10.1109/SBFT59156.2023.00007,https://doi.org/10.1109/SBFT59156.2023.00007,conference tool paper,targeted refinement round 1,"""Spirale"" lane keeping road generation SBFT 2023",blind-ground,candidate,NR,unverified,https://www.iris.unina.it/handle/11588/957564; https://doi.org/10.1109/SBFT59156.2023.00007,autonomous-vehicle testing,simulated car,road/test course,NR,search-based test generation,generates lane-keeping scenarios/roads for competition agents,NR,direction coverage; maximum curvature,out-of-bounds events,four-dimensional feature-map out-of-bounds coverage,NR,SBFT 2023 CPS competition,BeamNG.tech; BeamNG.AI; DAVE-2,NR,NR,NR,search settings; budget; seed; agent/simulator versions,"https://www.iris.unina.it/handle/11588/957564; https://doi.org/10.1109/SBFT59156.2023.00007; SBFT 2023 competition report, pp. 46-48: https://sites.mdu.se/download/18.309552f318f0faf8277bd26/1714383875311/SBFT_Tool_Competition_2023_-_Cyber-Physical_Systems_Track.pdf","New in refinement round 1. The primary two-page record supports a search-based LKAS scenario generator; the official SBFT report supports competition metrics and simulator setup. Representation, validity predicates, search configuration, export, code, and released assets remain NR."
BG-044,StaraceRomdhanaDiMartino2022GenRL,GenRL at the SBST 2022 Tool Competition,Luigi Libero Lucio Starace; Andrea Romdhana; Sergio Di Martino,2022,15th International Workshop on Search-Based Software Testing (SBST),10.1145/3526072.3527533,https://doi.org/10.1145/3526072.3527533,conference tool paper,targeted refinement round 1,"""GenRL"" road topology generation SBST 2022",blind-ground,candidate,NR,unverified,https://www.iris.unina.it/handle/11588/894581; https://doi.org/10.1145/3526072.3527533,autonomous-vehicle testing,simulated car,road/test course,NR,deep reinforcement learning,trains an RL generator to emit lane-keeping test roads,NR,road coverage/orientation features NR,lane departure; competition effectiveness and efficiency,failure diversity,NR,SBST 2022 competition against two driving agents,BeamNG.tech,NR,NR,NR,RL state/action/reward; training episodes; simulator and agent configuration,https://www.iris.unina.it/handle/11588/894581; https://doi.org/10.1145/3526072.3527533,"New in refinement round 1; unrelated robotics systems named GenRL were excluded. The primary record supports a deep-RL test generator for LKAS and SBST participation. Road representation, validity mechanism, training distribution, export, code, and released assets remain NR."
BG-045,WanEtAl2025GenTe,GenTe: Generative Real-world Terrains for General Legged Robot Locomotion Control,Hanwen Wan; Mengkang Li; Donghao Wu; Yebin Zhong; Yixuan Deng; Zhenglong Sun; Xiaoqiang Ji,2025,arXiv,10.48550/arXiv.2504.09997,https://arxiv.org/abs/2504.09997,preprint; official software reported,targeted refinement round 2,"""LLM terrain curriculum"" quadruped obstacle course generation",blind-ground,candidate,NR,unverified,https://arxiv.org/abs/2504.09997; https://github.com/HaronW/GenTe/tree/60ceed680802fb30db86e1be8f0e62a321e7d782,legged-robot learning,simulated biped,geometric and physical terrain distribution,heightmaps; geometric primitives; force-model terrain tools,vision-language-model function calling; procedural composition; domain randomization,maps text or image prompts to simulator-ready geometry and physical terrain models,typed terrain functions; human review of benchmark; simulator execution checks,elevation; slope; obstacle configuration; geometric/physical parameters,policy success; command following; waypoint traversal,human-reviewed prompt/terrain variety; 100-terrain benchmark,atomic terrain curriculum followed by prompt-conditioned generated terrains,100 generated terrains: 50 from text and 50 from figures; policy tests on unseen terrains,Isaac Gym,heightmap; geometric primitives; simulator force models,official_open,official_open,Qwen2-VL-72B-Instruct; Llama-3.1-8B-Instruct; prompt; function library; terrain parameters; benchmark split; policy settings; Isaac Gym,"Sections I, IV, and V: https://arxiv.org/pdf/2504.09997; https://github.com/HaronW/GenTe/blob/60ceed680802fb30db86e1be8f0e62a321e7d782/README.md; https://github.com/HaronW/GenTe/tree/60ceed680802fb30db86e1be8f0e62a321e7d782/GenTe/dataset; https://github.com/HaronW/GenTe/tree/60ceed680802fb30db86e1be8f0e62a321e7d782/GenTe/resources","New in refinement round 2; physical-force randomization is coded separately from generated geometry. The paper-linked official repository is live at pinned commit 60ceed680802fb30db86e1be8f0e62a321e7d782 and includes code, dataset, resources, and test terrains, so both statuses are official_open. No license file was found. The paper reports 100 terrains (50 text; 50 figure), while the pinned README reports 200 samples (100 text; 100 image); the CSV evaluation_suite preserves the paper value and records this contradiction here."
