candidate_id,cite_key,title,authors,year,venue,doi,url,source_type,discovery_stream,discovery_query,discovery_agent,screening_status,exclusion_reason,metadata_status,metadata_evidence,domain,vehicle,course_object,representation_family,generator_family,generation_role,validity_strategy,geometry_metrics,difficulty_metrics,diversity_metrics,training_distribution,evaluation_suite,simulator,export_format,code_status,asset_status,reproducibility_fields,evidence_locator,coding_notes
BG-017,ZohdinasabEtAl2021DeepHyperion,DeepHyperion: Exploring the Feature Space of Deep Learning-Based Systems through Illumination Search,Tahereh Zohdinasab; Vincenzo Riccio; Alessio Gambi; Paolo Tonella,2021,Proceedings of the 30th ACM SIGSOFT International Symposium on Software Testing and Analysis (ISSTA),10.1145/3460319.3464811,https://doi.org/10.1145/3460319.3464811,conference paper; official artifact,autonomous-vehicle testing,"""DeepHyperion: Exploring the Feature Space"" DOI",blind-ground,candidate,NR,unverified,https://arxiv.org/abs/2107.06997; https://doi.org/10.1145/3460319.3464811; https://doi.org/10.5281/zenodo.8146334,autonomous-vehicle testing,simulated car,road/test course,spline road encoded by mutable control points,MAP-Elites; illumination search,generates roads to populate user-selected geometric feature maps and reveal failures,inherits road bounds; curvature; continuity; and nonintersection checks,curvature; segment count; feature-map axes,lane departure; failure rate,feature-map coverage; occupied cells; failure diversity,archive of elites per feature cell,multiple illumination-search runs; exact budget NR,BeamNG.tech; DAVE-2,BeamNG test format,official_open,official_open,feature definitions; bins; search budget; seeds; simulator/model versions,https://arxiv.org/pdf/2107.06997; https://zenodo.org/records/8146334,"Illumination search generates geometry; it is not test selection over a fixed road pool. Zenodo record 8146334 contains code.zip, README.md, and LICENSE."
BG-018,HumeniukKhomhAntoniol2022AmbieGen,A Search-Based Framework for Automatic Generation of Testing Environments for Cyber-Physical Systems,Dmytro Humeniuk; Foutse Khomh; Giuliano Antoniol,2022,Information and Software Technology 149,10.1016/j.infsof.2022.106936,https://doi.org/10.1016/j.infsof.2022.106936,journal article; official software,autonomous-vehicle testing,"""A search-based framework for automatic generation of testing environments"" DOI",blind-ground,candidate,NR,unverified,https://arxiv.org/abs/2203.12138; https://doi.org/10.1016/j.infsof.2022.106936,autonomous-systems testing,simulated car; mobile robot,road course; 2D obstacle map,road matrix of straight/left/right segments with length and angle; obstacle-grid encoding,NSGA-II; random generation,generates road topologies for LKAS and obstacle maps for robot navigation,surrogate kinematic simulation; map bounds; segment feasibility; overlap checks,segment length 5-50 m; turn angle 5-85 degrees; path geometry,lane deviation; path/task fitness,Jaccard distance; suite diversity,multiobjective populations plus random/single-objective baselines,two case studies with repeated runs; exact counts NR,BeamNG.tech; lightweight bicycle/Stanley surrogate; robot simulator NR,BeamNG road test; obstacle map,not_found,not_found,segment ranges; objectives; population; generations; surrogate and simulator settings,https://arxiv.org/pdf/2203.12138,"Both road and obstacle-course generation are in scope; surrogate dynamics are validity/evaluation support. The paper cites https://github.com/dgumenyuk/Environment-generation.git for replication, but that official URL returned 404 during the 2026-06-29 audit; code_status and asset_status are therefore not_found."
BG-019,KlampflKlueckWotawa2022ALKSTesting,Using Genetic Algorithms for Automating Automated Lane-Keeping System Testing,Lorenz Klampfl; Florian Klueck; Franz Wotawa,2022,Journal of Software: Evolution and Process,10.1002/smr.2520,https://doi.org/10.1002/smr.2520,journal article,autonomous-vehicle testing,"""Using genetic algorithms for automating automated lane-keeping system testing"" DOI",blind-ground,candidate,NR,unverified,https://onlinelibrary.wiley.com/doi/10.1002/smr.2520,autonomous-vehicle testing,simulated car,road/test course,seven Bezier control points in a 200 m by 200 m map,genetic algorithm variants,evolves failure-revealing lane-keeping roads,map bounds; reject overly sharp or overlapping roads; geometric feasibility checks,road length; curvature; Frechet distance,failure probability; time to failure; lane departure,Frechet-distance sparseness,GA populations under multiple configurations,10 repetitions; 2400 configuration runs reported,BeamNG.tech,BeamNG road test,NR,NR,control-point count; map size; GA configurations; repetitions; validity thresholds,https://onlinelibrary.wiley.com/doi/10.1002/smr.2520,Published online in 2022; later issue dating should be checked during bibliography normalization.
BG-020,KlikovitsEtAl2023FreneticLib,Frenetic-lib: An Extensible Framework for Search-Based Generation of Road Structures for ADS Testing,Stefan Klikovits; Ezequiel Castellano; Ahmet Cetinkaya; Paolo Arcaini,2023,Science of Computer Programming 230,10.1016/j.scico.2023.102996,https://doi.org/10.1016/j.scico.2023.102996,journal article; official software,autonomous-vehicle testing,"""Frenetic-lib"" road structures ADS testing paper",blind-ground,candidate,NR,unverified,https://doi.org/10.1016/j.scico.2023.102996; https://frenetic-lib.readthedocs.io/; https://github.com/ERATOMMSD/frenetic-lib/tree/75c639f0773001779a7216b20c3a2f143eec1f1c,autonomous-vehicle testing,simulated car,road/test course,Bezier; Cartesian; curvature/kappa; theta road encodings,extensible genetic search,generates and optimizes roads through interchangeable representations and objectives,representation-specific bounds; curvature; continuity; self-intersection checks,length; curvature; representation-dependent geometry,lane departure; user-defined objective,pairwise road distance; suite spread,configurable evolutionary populations,cross-representation experiments; exact counts NR,simulator-pluggable; BeamNG adapters,library road objects; simulator adapters,official_open,NR,representation; operators; objective; seed; budget; simulator adapter; Python 3.9; MIT license,https://doi.org/10.1016/j.scico.2023.102996; https://github.com/ERATOMMSD/frenetic-lib/tree/75c639f0773001779a7216b20c3a2f143eec1f1c; https://frenetic-lib.readthedocs.io/,"A generator framework, not a fixed-course controller. Official documentation links the public GitHub repository and PyPI package; repository pinned at 75c639f0773001779a7216b20c3a2f143eec1f1c. A separate data asset was not verified."
BG-021,ArcainiCetinkaya2024CRAG,CRAG - A Combinatorial Testing-Based Generator of Road Geometries for ADS Testing,Paolo Arcaini; Ahmet Cetinkaya,2024,Science of Computer Programming 238,10.1016/j.scico.2024.103171,https://doi.org/10.1016/j.scico.2024.103171,journal article; official software,autonomous-vehicle testing,CRAG combinatorial testing based generator road geometries ADS testing paper,blind-ground,candidate,NR,unverified,https://www.sciencedirect.com/science/article/pii/S0167642324000947,autonomous-vehicle testing,simulated car,road/test course,high-level discrete road-section configuration plus continuous concrete geometry,combinatorial testing; local search,covers road-configuration interactions then searches concrete geometries for ADS failures,configurable road sections; partition bounds; geometry validity filters,section count; road scalar/shape parameters,out-of-bounds failures; test fitness,failure diversity; competition feature-map coverage,covering arrays/configuration suites plus search,16 hyperparameter combinations; SBFT 2023 competition evaluation,BeamNG.tech,SBFT road-test format,NR,NR,strength; section count; partitions; scalar bounds; search goal; time budget,https://www.sciencedirect.com/science/article/pii/S0167642324000947,"Combines topology/configuration coverage with concrete geometry generation. The focused audit found the official article but no accessible official repository/package locator, so code_status and asset_status are NR rather than inferred from the article's software-publication label."
BG-022,PeltomakiSpencerPorres2022WOGAN,Wasserstein Generative Adversarial Networks for Online Test Generation for Cyber Physical Systems,Jarkko Peltomaki; Frankie Spencer; Ivan Porres,2022,15th International Workshop on Search-Based Software Testing (SBST),10.1145/3526072.3527522,https://doi.org/10.1145/3526072.3527522,conference paper; official artifact,autonomous-vehicle testing,"""Wasserstein generative adversarial networks for online test generation""",blind-ground,candidate,NR,unverified,https://arxiv.org/abs/2205.11060; https://doi.org/10.1145/3526072.3527522,cyber-physical testing; autonomous driving,simulated car,road/test course,fixed-length continuous road/control-point vector,online Wasserstein GAN; adaptive sampling,learns the distribution of high-fitness counterexample roads while testing,competition road validity filters; generator output clipping/checks,road vector/curvature features NR,lane-assistance failure fitness,generated-suite diversity; exact metric NR,online batches updated from evaluated roads,SBST CPS road-generation case study,BeamNG.tech,SBST road-test format,NR,NR,GAN architecture; online batch schedule; seed; simulator/agent version,https://arxiv.org/pdf/2205.11060,The GAN generates road geometry; online task selection alone would be out of scope. The primary paper and publisher record did not expose an official code or test-asset locator in this audit; both statuses are NR.
BG-023,BlattnerEtAl2024Frenilla,Diversity-Guided Search Exploration for Self-Driving Cars Test Generation through Frenet Space Encoding,Timo Blattner; Christian Birchler; Timo Kehrer; Sebastiano Panichella,2024,46th IEEE/ACM International Conference on Software Engineering (ICSE),NR,https://arxiv.org/abs/2401.14682,conference paper; official artifact,autonomous-vehicle testing,"""Diversity-guided Search Exploration for Self-driving Cars Test Generation through Frenet Space Encoding""",blind-ground,candidate,NR,unverified,https://arxiv.org/abs/2401.14682; https://doi.org/10.5281/zenodo.10527295,autonomous-vehicle testing,simulated car,road/test course,50 Frenet curvature/step vectors; cubic-spline smoothing,genetic algorithm; learned failure predictor,generates diverse roads in Frenet space and searches for lane-keeping failures,curvature limits; map bounds; no self-intersection; smoothing,curvature sequence; road length,out-of-bounds prediction and observed failure,diversity-guided objective; invalid-road rate,evolutionary populations with predictor-assisted evaluation,1174 generated tests reported; 64 percent failing; sampled invalid rate zero,BeamNG.tech 0.24,JSON compatible with SDC-Scissor; BeamNG test,official_open,official_open,vector length; operators; predictor split; seed; BeamNG version; test count,https://arxiv.org/pdf/2401.14682; https://zenodo.org/records/10527295,Frenilla is the system name; road synthesis is distinct from SDC-Scissor test selection. Zenodo record 10527295 contains the official frenilla.zip replication package.
BG-024,MuktadirEtAl2023JunctionArt,Procedural Generation of High-Definition Road Networks for Autonomous Vehicle Testing and Traffic Simulations,Golam Md Muktadir; Abdul Jawad; Ishaan Paranjape; Jim Whitehead; Aleksey Shepelev,2023,SAE International Journal of Connected and Automated Vehicles 6(1),10.4271/12-06-01-0007,https://doi.org/10.4271/12-06-01-0007,journal article; official software,autonomous-vehicle testing,JunctionArt procedural generation high-definition road networks official paper,blind-ground,candidate,NR,unverified,https://saemobilus.sae.org/articles/procedural-generation-high-definition-road-networks-autonomous-vehicle-testing-traffic-simulations-12-06-01-0007,autonomous-vehicle testing; traffic simulation,simulated road vehicle,HD road network; intersection,control lines; lane configuration; 3-7 incident-road junction graph,constructive procedural generation,generates lane-level roads and intersections and serializes OpenDRIVE,connection-lane construction; geometric continuity; OpenDRIVE conformance checks,field of view; maximum curvature; corner deviation angle; conflict area; connection-lane count,complexity descriptor,expressive-range coverage,parameter sweeps over road and junction configurations,expressive-range analysis; exact generated count NR,RoadRunner; CARLA; esmini; SUMO-compatible tooling,OpenDRIVE,NR,NR,incident-road count; lane types; control lines; random seed; metric definitions,https://saemobilus.sae.org/articles/procedural-generation-high-definition-road-networks-autonomous-vehicle-testing-traffic-simulations-12-06-01-0007,"Generates static HD geometry; traffic-flow generation is separate. No accessible official JunctionArt code repository or downloadable OpenDRIVE asset locator was verified in the focused audit, so both statuses are NR."
BG-025,YangEtAl2024RoadGen,RoadGen: Generating Road Scenarios for Autonomous Vehicle Testing,Fan Yang; You Lu; Bihuan Chen; Peng Qin; Xin Peng,2024,arXiv,10.48550/arXiv.2411.19577,https://arxiv.org/abs/2411.19577,preprint; official project,autonomous-vehicle testing,RoadGen generating road scenarios autonomous vehicle testing official repository,blind-ground,candidate,NR,unverified,https://arxiv.org/abs/2411.19577; https://roadgen.github.io/; https://github.com/roadgen/RoadGen/tree/c5bb3420d394bc59f8fcb5dbd7aef7d6f0212137,autonomous-vehicle testing,simulated autonomous car,road network/scenario,graph assembled from 8 road-component families and 242 templates,template-guided constructive composition,connects compatible road components into complex test road networks,endpoint compatibility; parameter constraints; similarity-based duplicate filtering,component count; topology; geometric similarity,ADS failure/coverage metrics NR,uniqueness; duplicate rate; topology variety,generated maps with 4-8 components in reported configurations,map corpus and joint-simulation evaluation; exact size NR,Apollo; SVL Simulator reported,HD-map/scenario format NR,official_open,official_open,template library; component-count range; constraints; similarity threshold; simulator versions,https://arxiv.org/pdf/2411.19577; https://roadgen.github.io/; https://github.com/roadgen/RoadGen/tree/c5bb3420d394bc59f8fcb5dbd7aef7d6f0212137,"Road geometry is central; dynamic actor behavior is not coded as the course generator. The official project page links the public repository and downloadable Apollo XML, PNG, and Unity map assets for 4-8 component datasets; repository pinned at c5bb3420d394bc59f8fcb5dbd7aef7d6f0212137."
BG-026,ZhouEtAl2024DiffRoad,DiffRoad: Realistic and Diverse Road Scenario Generation for Autonomous Vehicle Testing,Junjie Zhou; Lin Wang; Qiang Meng; Xiaofan Wang,2024,arXiv,10.48550/arXiv.2411.09451,https://arxiv.org/abs/2411.09451,preprint,autonomous-vehicle testing,"""DiffRoad: Realistic and Diverse Road Scenario Generation for Autonomous Vehicle Testing""",blind-ground,candidate,NR,unverified,https://arxiv.org/abs/2411.09451,autonomous-vehicle testing,simulated autonomous car,3D road scenario,raster road representation converted to 3D/OpenDRIVE geometry,diffusion model; Road-UNet,samples novel road layouts from noise and converts accepted layouts to simulator roads,continuity and geometric-reasonableness filter; 3D conversion checks,continuity; curvature/shape realism NR,scenario challenge metric NR,realism; diversity,learned from real-world road datasets; sizes NR,generated-road comparison and simulator examples; counts NR,OpenDRIVE-compatible simulators,OpenDRIVE,NR,NR,training dataset; diffusion schedule; filter thresholds; conversion settings,https://arxiv.org/pdf/2411.09451,Appearance synthesis is not the coded object; the output is road geometry.
BG-027,ZhouEtAl2023FLYOVER,FLYOVER: A Model-Driven Method to Generate Diverse Highway Interchanges for Autonomous Vehicle Testing,Yuan Zhou; Gengjie Lin; Yun Tang; Kairui Yang; Wei Jing; Ping Zhang; Junbo Chen; Liang Gong; Yang Liu,2023,arXiv,10.48550/arXiv.2301.12738,https://arxiv.org/abs/2301.12738,preprint,autonomous-vehicle testing,"""FLYOVER: A Model-Driven Method to Generate Diverse Highway Interchanges for Autonomous Vehicle Testing""",blind-ground,candidate,NR,unverified,https://arxiv.org/abs/2301.12738,autonomous-vehicle testing; traffic simulation,simulated road vehicle; heavy truck,highway interchange,labeled directed topology graph; Bezier ramp geometry,model-driven generation; combinatorial testing; differential evolution,enumerates interchange topology classes and optimizes concrete ramp geometry,endpoint/smoothness constraints; minimum radius; maximum longitudinal slope,ramp radius; slope; topology; geometric fit,traffic throughput; truck fuel-use case,k-way topology/parameter coverage,combinatorial suites of interchange configurations,SUMO traffic and Alibaba truck fuel-optimization cases; exact suite size NR,SUMO,OpenDRIVE,NR,NR,topology model; k-way strength; parameter ranges; DE settings; geometric limits,https://arxiv.org/pdf/2301.12738,Topology and concrete geometry are generated; route optimization is downstream evaluation.
BG-028,MiEtAl2021HDMapGen,HDMapGen: A Hierarchical Graph Generative Model of High Definition Maps,Lu Mi; Hang Zhao; Charlie Nash; Xiaohan Jin; Jiyang Gao; Chen Sun; Cordelia Schmid; Nir Shavit; Yuning Chai; Dragomir Anguelov,2021,IEEE/CVF Conference on Computer Vision and Pattern Recognition (CVPR),NR,https://openaccess.thecvf.com/content/CVPR2021/html/Mi_HDMapGen_A_Hierarchical_Graph_Generative_Model_of_High_Definition_Maps_CVPR_2021_paper.html,conference paper,learned map generation,"""HDMapGen: A Hierarchical Graph Generative Model of High Definition Maps"" official",blind-ground,candidate,NR,unverified,https://openaccess.thecvf.com/content/CVPR2021/html/Mi_HDMapGen_A_Hierarchical_Graph_Generative_Model_of_High_Definition_Maps_CVPR_2021_paper.html,autonomous-driving simulation,simulated road vehicle,lane-level HD map,global topology graph plus local lane control-point sequences,hierarchical autoregressive graph generation,samples novel lane topology then detailed lane geometry,hierarchical connectivity model,graph size; lane geometry quality; scalability,NR,sample quality; diversity,Argoverse and in-house HD-map datasets,held-out generative evaluation on two datasets,NR,lane graph representation; simulator export NR,NR,NR,dataset split; hierarchy; autoregressive ordering; model hyperparameters,https://openaccess.thecvf.com/content/CVPR2021/papers/Mi_HDMapGen_A_Hierarchical_Graph_Generative_Model_of_High_Definition_Maps_CVPR_2021_paper.pdf,"Included because it synthesizes new map topology/geometry, unlike perception methods that reconstruct a fixed scene. Explicit engineering repair was not resolved; paper figures alone are not coded as released assets."
BG-029,SunEtAl2023DriveSceneGen,DriveSceneGen: Generating Diverse and Realistic Driving Scenarios from Scratch,Shuo Sun; Zekai Gu; Tianchen Sun; Jiawei Sun; Chengran Yuan; Yuhang Han; Dongen Li; Marcelo H. Ang Jr.,2023,arXiv,10.48550/arXiv.2309.14685,https://arxiv.org/abs/2309.14685,preprint; official project,learned map generation,"""DriveSceneGen: Generating Diverse and Realistic Driving Scenarios from Scratch"" official paper",blind-ground,candidate,NR,unverified,https://arxiv.org/abs/2309.14685; https://ss47816.github.io/DriveSceneGen/; https://github.com/SS47816/DriveSceneGen/tree/91a475407869e13c2f371c56b718c36c05a15a6c,autonomous-driving simulation,simulated road vehicle,static lanelet map plus dynamic scenario,rasterized/vectorized lanelet map; agent states,two-stage diffusion generation,generates static road/lane geometry from scratch then separately generates agents,learned map prior; rule-based vectorization,map similarity/geometry metrics NR,agent/scenario realism NR,realism; diversity; scalability,driving-scenario training corpus; dataset size NR,5000 generated scenarios reported,NR,lanelet/vector scenario format NR,official_open,NR,dataset; diffusion stages; sample count; vectorization parameters,https://arxiv.org/pdf/2309.14685; https://ss47816.github.io/DriveSceneGen/; https://github.com/SS47816/DriveSceneGen/tree/91a475407869e13c2f371c56b718c36c05a15a6c,"Only the static-map stage is course generation; actor generation is separately coded. The official project page links the public code repository, pinned at 91a475407869e13c2f371c56b718c36c05a15a6c; the dataset link is commented out, so no asset release is asserted."
BG-030,ChittaDaunerGeiger2024SLEDGE,SLEDGE: Synthesizing Simulation Environments for Driving Agents with Generative Models,Kashyap Chitta; Daniel Dauner; Andreas Geiger,2024,European Conference on Computer Vision (ECCV),NR,https://www.ecva.net/papers/eccv_2024/papers_ECCV/papers/00490.pdf,conference paper; official software,learned map generation,SLEDGE generative simulator road map generation autonomous driving official paper,blind-ground,candidate,NR,unverified,https://www.ecva.net/papers/eccv_2024/papers_ECCV/papers/00490.pdf; https://github.com/autonomousvision/sledge/tree/3d72828a1895d1a467f11a8343988c6a1eb4b684,autonomous-driving simulation,simulated road vehicle,lane graph and driving scene,raster-to-vector latent representation of lanes and agents,autoencoder; diffusion transformer,samples vectorized simulation maps and associated traffic elements,vector decoder; map-connectivity checks,lane geometry and graph metrics NR,closed-loop planning performance,distributional realism; diversity,nuPlan-derived scene distribution,generative metrics plus closed-loop planner evaluation; counts NR,nuPlan simulation stack,vector scene representation,official_open,not_found,dataset split; latent dimensions; diffusion settings; evaluation protocol; code version,https://www.ecva.net/papers/eccv_2024/papers_ECCV/papers/00490.pdf; https://github.com/autonomousvision/sledge/tree/3d72828a1895d1a467f11a8343988c6a1eb4b684,"Lane geometry generation is included; planning on generated/fixed maps is downstream. SLEDGE code v0.1 is public at pinned commit 3d72828a1895d1a467f11a8343988c6a1eb4b684, but the README still listed checkpoint release as TODO during the 2026-06-29 audit; asset_status is not_found."
BG-031,RoweEtAl2025ScenarioDreamer,Scenario Dreamer: Vectorized Latent Diffusion for Generating Driving Simulation Environments,Luke Rowe; Roger Girgis; Anthony Gosselin; Liam Paull; Christopher Pal; Felix Heide,2025,IEEE/CVF Conference on Computer Vision and Pattern Recognition (CVPR),NR,https://openaccess.thecvf.com/content/CVPR2025/html/Rowe_Scenario_Dreamer_Vectorized_Latent_Diffusion_for_Generating_Driving_Simulation_Environments_CVPR_2025_paper.html,conference paper; official project,learned map generation,CVPR 2025 driving simulation environment generation vectorized map geometry Scenario Dreamer,blind-ground,candidate,NR,unverified,https://openaccess.thecvf.com/content/CVPR2025/html/Rowe_Scenario_Dreamer_Vectorized_Latent_Diffusion_for_Generating_Driving_Simulation_Environments_CVPR_2025_paper.html; https://arxiv.org/abs/2503.22496,autonomous-driving simulation,simulated road vehicle,lane graph and driving environment,vectorized lane-graph and oriented-box latent tokens,latent diffusion; autoregressive agent rollout; inpainting,generates road/lane geometry and actors; extends maps by vector inpainting,learned structural prior; connectivity-preserving vector decoding,urban-planning lane-graph metrics; route extent,planner/RL performance,realism; coverage; diversity,large real-driving scene corpus; exact size NR,lane metrics on 50000 real/generated samples; long-route demonstrations up to 500 m reported,custom driving simulation pipeline,vector environment representation,NR,NR,dataset split; latent tokenizer; diffusion schedule; sample count; inpainting setup,https://openaccess.thecvf.com/content/CVPR2025/papers/Rowe_Scenario_Dreamer_Vectorized_Latent_Diffusion_for_Generating_Driving_Simulation_Environments_CVPR_2025_paper.pdf,Static lane-graph generation is in scope; agent behavior generation is separately noted. Explicit repair details were not resolved; paper demonstrations are not coded as released assets.
BG-032,SteiningerEtAl2025RoadGPT,Automatically Generating Content for Testing Autonomous Vehicles from User Descriptions,Benedikt Steininger; Chrysanthi Papamichail; David Stark; Dejan Nickovic; Alessio Gambi,2025,47th IEEE/ACM International Conference on Software Engineering: New Ideas and Emerging Results (ICSE-NIER),10.1109/ICSE-NIER66352.2025.00021,https://ieeexplore.ieee.org/document/11023959/,conference paper,autonomous-vehicle testing,"""Automatically Generating Content for Testing Autonomous Vehicles from User Descriptions""",blind-ground,candidate,NR,unverified,https://doi.org/10.1109/ICSE-NIER66352.2025.00021; https://ieeexplore.ieee.org/document/11023959/,autonomous-vehicle testing,NR,NR,NR,NR,NR,NR,NR,NR,NR,NR,NR,NR,NR,NR,NR,NR,https://ieeexplore.ieee.org/document/11023959/,"The IEEE DOI and document record support bibliographic metadata only. No paper-specific full text or author copy was located in the 2026-06-29 final audit; the generic BeamNG index and abstract-level technical claims are not used as evidence. Vehicle, course, representation, generator, validity, distribution, evaluation, simulator/export, reproducibility, code, and asset fields remain NR."
