assignment_id,candidate_id,input_sha256,snapshot_sha256,batch_id,phase,title,authors,year,venue,doi,url,source_type
A-C0003-06,C0003,1734ebc62e9def5a18b9cb5bebe4f1e2af9fbc1372753d308862b0ca37d56232,a57cb89fd689d156d04c0b7ec8c95a90edeb0d360589ea01cb39ce04c82e4d4e,screening-06,main,TrackGen: An interactive track generator for TORCS and Speed-Dreams,Luigi Cardamone; Pier Luca Lanzi; Daniele Loiacono,2015,Applied Soft Computing,10.1016/j.asoc.2014.11.010,https://www.sciencedirect.com/science/article/pii/S1568494614005705,journal article
A-C0007-06,C0007,0d45d88f38ffa97d4571d254f2ac49e031148a01324bc4775a1132947f0cba86,a57cb89fd689d156d04c0b7ec8c95a90edeb0d360589ea01cb39ce04c82e4d4e,screening-06,main,ASAM OpenDRIVE,ASAM e.V.,2026,ASAM,NR,https://www.asam.net/standards/detail/opendrive/,standard
A-C0009-06,C0009,256e85758a73997a36446568d476851c0ce211a78f1c8498ad83302dfc69e174,a57cb89fd689d156d04c0b7ec8c95a90edeb0d360589ea01cb39ce04c82e4d4e,screening-06,calibration,Automatic Track Generation for High-End Racing Games Using Evolutionary Computation,Daniele Loiacono; Luigi Cardamone; Pier Luca Lanzi,2011,IEEE Transactions on Computational Intelligence and AI in Games,10.1109/tciaig.2011.2163692,https://doi.org/10.1109/tciaig.2011.2163692,journal article
A-C0011-06,C0011,bf0c18c88d755766762ba324d0ee78b07cac4785d5841de27583e22d82406302,a57cb89fd689d156d04c0b7ec8c95a90edeb0d360589ea01cb39ce04c82e4d4e,screening-06,calibration,Search-based Procedural Content Generation for Race Tracks in Video Games,Hafizh Adi Prasetya; Nur Ulfa Maulidevi,2016,International Journal on Electrical Engineering and Informatics,10.15676/ijeei.2016.8.4.6,https://doi.org/10.15676/ijeei.2016.8.4.6,journal article
A-C0013-06,C0013,39c5e195e4faa59b5c8afb26b5004dcf8316e45cc3e97b9775fd7dc3e0e64e56,a57cb89fd689d156d04c0b7ec8c95a90edeb0d360589ea01cb39ce04c82e4d4e,screening-06,main,Procedural Generation of Isometric Racetracks Using Chain Code for Racing Games,Erik Jhones F. do Nascimento; Tassiana M. Castro; Ana Carolina S. Abreu; Filipe A. Lira; Amauri H. Souza,2021,2021 20th Brazilian Symposium on Computer Games and Digital Entertainment (SBGames),10.1109/sbgames54170.2021.00025,https://doi.org/10.1109/sbgames54170.2021.00025,conference paper
A-C0015-06,C0015,079c8e9a1df260402a376739aa0fb944d8fd036dcc7318b0c6c41ddedc5503e4,a57cb89fd689d156d04c0b7ec8c95a90edeb0d360589ea01cb39ce04c82e4d4e,screening-06,calibration,UN Regulation No. 157 - Automated Lane Keeping Systems (ALKS),United Nations Economic Commission for Europe,2021,United Nations Regulation No. 157,NR,https://unece.org/transport/documents/2021/03/standards/un-regulation-no-157-automated-lane-keeping-systems-alks,official standard
A-C0017-06,C0017,9a32adbcbf8984869c04b09746181d34e6b3b339c9b1fcfeecb84ed69110560d,a57cb89fd689d156d04c0b7ec8c95a90edeb0d360589ea01cb39ce04c82e4d4e,screening-06,calibration,Car Racing,Oleg Klimov,NR,Gymnasium Documentation,NR,https://gymnasium.farama.org/environments/box2d/car_racing/,benchmark environment; official documentation
A-C0019-06,C0019,c7c5fbde19021a4d64577a0315af8e5763942cce2837e46d229d37d1f02f4913,a57cb89fd689d156d04c0b7ec8c95a90edeb0d360589ea01cb39ce04c82e4d4e,screening-06,main,Prioritized Level Replay,Minqi Jiang; Edward Grefenstette; Tim Rocktäschel,2021,Proceedings of the 38th International Conference on Machine Learning,NR,https://proceedings.mlr.press/v139/jiang21b.html,conference paper
A-C0021-06,C0021,04cd9108b968d07cdbf7dae29f82dca7059977f5a4b24a30ea5759433553a168,a57cb89fd689d156d04c0b7ec8c95a90edeb0d360589ea01cb39ce04c82e4d4e,screening-06,main,Evolving Curricula with Regret-Based Environment Design,Jack Parker-Holder; Minqi Jiang; Michael Dennis; Mikayel Samvelyan; Jakob Foerster; Edward Grefenstette; Tim Rocktäschel,2022,Proceedings of the 39th International Conference on Machine Learning,NR,https://proceedings.mlr.press/v162/parker-holder22a.html,conference paper
A-C0026-06,C0026,4a11e5b16e5ed427bdc7fa4f148eb75912c7db85a730748652b4b5c04728deec,a57cb89fd689d156d04c0b7ec8c95a90edeb0d360589ea01cb39ce04c82e4d4e,screening-06,main,Autonomous Drone Racing with Deep Reinforcement Learning,Yunlong Song; Mats Steinweg; Elia Kaufmann; Davide Scaramuzza,2021,2021 IEEE/RSJ International Conference on Intelligent Robots and Systems (IROS),10.1109/iros51168.2021.9636053,https://doi.org/10.1109/IROS51168.2021.9636053,conference paper
A-C0030-06,C0030,67f0ec817d7ba8dd2c33b8d1d3b3e7a5429229a87f2f124d7d534e6bb9567390,a57cb89fd689d156d04c0b7ec8c95a90edeb0d360589ea01cb39ce04c82e4d4e,screening-06,main,Gran Turismo,Polyphony Digital Inc.,1997,PlayStation,NR,https://www.polyphony.co.jp/products/,software
A-C0031-06,C0031,994e24ac0f8661b7f644614974f544f465c379d7da4107afcc8f7f9cbe9a2c03,a57cb89fd689d156d04c0b7ec8c95a90edeb0d360589ea01cb39ce04c82e4d4e,screening-06,main,Super-Human Performance in Gran Turismo Sport Using Deep Reinforcement Learning,Florian Fuchs; Yunlong Song; Elia Kaufmann; Davide Scaramuzza; Peter Dürr,2021,IEEE Robotics and Automation Letters,10.1109/lra.2021.3064284,https://doi.org/10.1109/lra.2021.3064284,journal article
A-C0032-06,C0032,58304018881d98b62c779c13fa3023f3b8d8dce30149dac064dadc11b3fe7d2e,a57cb89fd689d156d04c0b7ec8c95a90edeb0d360589ea01cb39ce04c82e4d4e,screening-06,main,A Super-human Vision-based Reinforcement Learning Agent for Autonomous Racing in Gran Turismo,Miguel Vasco; Takuma Seno; Kenta Kawamoto; Kaushik Subramanian; Peter R. Wurman; Peter Stone,2024,Reinforcement Learning Journal,NR,https://rlj.cs.umass.edu/2024/papers/Paper213.html,journal article
A-C0033-06,C0033,0370802ddd9b17006e48cc398a1b63b986f7cfd07e8f7dfd28579413f4dd3e72,a57cb89fd689d156d04c0b7ec8c95a90edeb0d360589ea01cb39ce04c82e4d4e,screening-06,main,A Champion-Level Vision-Based Reinforcement Learning Agent for Competitive Racing in Gran Turismo 7,Hojoon Lee; Takuma Seno; Jun Jet Tai; Kaushik Subramanian; Kenta Kawamoto; Peter Stone; Peter R. Wurman,2025,IEEE Robotics and Automation Letters,10.1109/lra.2025.3560873,https://doi.org/10.1109/lra.2025.3560873,journal article
A-C0035-06,C0035,bab48b247a1e169111c4bcab01e94d246019857de4a3cb51f932a92fb05cb3e5,a57cb89fd689d156d04c0b7ec8c95a90edeb0d360589ea01cb39ce04c82e4d4e,screening-06,main,Gran Turismo 7,Polyphony Digital Inc.,2022,Sony Interactive Entertainment,NR,https://www.gran-turismo.com/us/products/gt7/,video game software
A-C0040-06,C0040,676cbc16d40fc566e6e94e0f6b77d8d4362989cec82dc2cd7ad65e3aecc731f7,a57cb89fd689d156d04c0b7ec8c95a90edeb0d360589ea01cb39ce04c82e4d4e,screening-06,main,Searching for the optimal racing line using genetic algorithms,Luigi Cardamone;Daniele Loiacono;Pier Luca Lanzi;Alessandro Pietro Bardelli,2010,Proceedings of the 2010 IEEE Conference on Computational Intelligence and Games,10.1109/itw.2010.5593330,https://doi.org/10.1109/itw.2010.5593330,conference paper
A-C0043-06,C0043,413d01317774a7de899d0de0ff0c44dc192186351d67cce1eb28d303503cea55,a57cb89fd689d156d04c0b7ec8c95a90edeb0d360589ea01cb39ce04c82e4d4e,screening-06,main,Learning at the Racetrack: Data-Driven Methods to Improve Racing Performance Over Multiple Laps,Nitin R. Kapania;J. Christian Gerdes,2020,IEEE Transactions on Vehicular Technology,10.1109/tvt.2020.2998065,https://doi.org/10.1109/tvt.2020.2998065,journal article
A-C0044-06,C0044,3790f05c6e4f08c17a015f5126e6a965e5ad9b83ac5ca205a569be97c6f9041e,a57cb89fd689d156d04c0b7ec8c95a90edeb0d360589ea01cb39ce04c82e4d4e,screening-06,main,Optimization-based Path Planning for an Autonomous Vehicle in a Racing Track,Saeed Amirfarhangi Bonab; Ali Emadi,2019,IECON 2019 - 45th Annual Conference of the IEEE Industrial Electronics Society,10.1109/iecon.2019.8926856,https://doi.org/10.1109/iecon.2019.8926856,conference paper
A-C0049-06,C0049,72ce8bd876daede3dda1b705164bc575bf3a6f2d31d3a23fc41e33fb6675244e,a57cb89fd689d156d04c0b7ec8c95a90edeb0d360589ea01cb39ce04c82e4d4e,screening-06,main,Procedural Race Track Generator,Luke Gillard,NR,GitHub,NR,https://github.com/Drallig/ProceduralTrack,software repository
A-C0050-06,C0050,6ceb416f772a235a6e55d3cd09dae00f3b810b27f56cff4bc42a70a61bccc7a3,a57cb89fd689d156d04c0b7ec8c95a90edeb0d360589ea01cb39ce04c82e4d4e,screening-06,main,meraccos/random_car_racing_track_generator,meraccos,2023,GitHub repository,NR,https://github.com/meraccos/random_car_racing_track_generator,software repository
A-C0051-06,C0051,06af6a036ee04316d5910318cae27be577adcbe6732545ed56948cf1de75a814,a57cb89fd689d156d04c0b7ec8c95a90edeb0d360589ea01cb39ce04c82e4d4e,screening-06,main,Racetrackgen2,h3h3h0h0,2023,GitHub repository,NR,https://github.com/h3h3h0h0/Racetrackgen2,software; official repository
A-C0053-06,C0053,0798b50f93f3daaae25a334deb1fddf0d62448b5494ea25a9482ea5470e48ea9,a57cb89fd689d156d04c0b7ec8c95a90edeb0d360589ea01cb39ce04c82e4d4e,screening-06,main,ArcGIS CityEngine,Esri,NR,Esri,NR,https://www.esri.com/en-us/arcgis/products/arcgis-cityengine/overview,software
A-C0062-06,C0062,3546a228a6fc72451323f5f236d87dad0876e71ce4927e64d0adb6336b6cdd2c,a57cb89fd689d156d04c0b7ec8c95a90edeb0d360589ea01cb39ce04c82e4d4e,screening-06,main,Robotic Manipulation of Deformable Rope-Like Objects Using Differentiable Compliant Position-Based Dynamics,Fei Liu;Entong Su;Jingpei Lu;Mingen Li;Michael C. Yip,2023,IEEE Robotics and Automation Letters,10.1109/lra.2023.3264766,https://doi.org/10.1109/lra.2023.3264766,journal article
A-C0063-06,C0063,6dd04aaf421191408960759ccc51d1c784d1c9db9d72c96c2babf534b7fbaa8c,a57cb89fd689d156d04c0b7ec8c95a90edeb0d360589ea01cb39ce04c82e4d4e,screening-06,calibration,TrackGen,Antoine Richard,2026,GitHub repository,NR,https://github.com/AntoineRichard/TrackGen,software repository
A-C0064-06,C0064,ea918849ee8a290828cf3c5373c24ae239c83a87cdcbf86f09c80c9fb4b930c0,a57cb89fd689d156d04c0b7ec8c95a90edeb0d360589ea01cb39ce04c82e4d4e,screening-06,main,Warp: A High-performance Python Framework for GPU Simulation and Graphics,Miles Macklin,2022,NVIDIA GPU Technology Conference (GTC),NR,https://github.com/NVIDIA/warp,software
A-C0069-06,C0069,39d6225597e9e17c77de4676f0721b32700e771b74a85042611cad9343e69bc5,a57cb89fd689d156d04c0b7ec8c95a90edeb0d360589ea01cb39ce04c82e4d4e,screening-06,main,Experience-Driven Procedural Content Generation,Georgios N. Yannakakis; Julian Togelius,2011,IEEE Transactions on Affective Computing,10.1109/t-affc.2011.6,https://doi.org/10.1109/T-AFFC.2011.6,journal article
A-C0077-06,C0077,edd1b1258e812022d029a706f79bcb29acdbadfc81479cf241f35644104f8356,a57cb89fd689d156d04c0b7ec8c95a90edeb0d360589ea01cb39ce04c82e4d4e,screening-06,main,Reaching the Limit in Autonomous Racing: Optimal Control versus Reinforcement Learning,Yunlong Song; Angel Romero; Matthias Müller; Vladlen Koltun; Davide Scaramuzza,2023,Science Robotics,10.1126/scirobotics.adg1462,https://doi.org/10.1126/scirobotics.adg1462,journal article
A-C0082-06,C0082,7d5b36f29f4b3e822fac40c0ea9e6c3e89546725e1e57a7c8c57c582b6004c02,a57cb89fd689d156d04c0b7ec8c95a90edeb0d360589ea01cb39ce04c82e4d4e,screening-06,main,MIT RACECAR,Massachusetts Institute of Technology,2015,MIT RACECAR project website,NR,https://mit-racecar.github.io/,robotics platform
A-C0084-06,C0084,2182453d349b0e220066960ef5a1a273dc30e941f4f035a6e2539b8ef681921f,a57cb89fd689d156d04c0b7ec8c95a90edeb0d360589ea01cb39ce04c82e4d4e,screening-06,main,Advancing Autonomous Racing: A Comprehensive Survey of the Roboracer (F1TENTH) Platform,Israel Charles; Hossein Maghsoumi; Yaser Fallah,2025,"2025 6th International Conference on Artificial Intelligence, Robotics and Control (AIRC)",10.1109/airc64931.2025.11077481,https://doi.org/10.1109/airc64931.2025.11077481,conference paper; survey
A-C0085-06,C0085,425a96081b6d2c075998a0bfe6d6ab7f41f18e310e284f94f7de49c4a06e4565,a57cb89fd689d156d04c0b7ec8c95a90edeb0d360589ea01cb39ce04c82e4d4e,screening-06,main,Optimization-based autonomous racing of 1:43 scale RC cars,Alexander Liniger;Alexander Domahidi;Manfred Morari,2015,Optimal Control Applications and Methods,10.1002/oca.2123,https://doi.org/10.1002/oca.2123,journal article
A-C0086-06,C0086,0cd0828a876cd24c29fd6ab36e6bd619cf8c6990283f05670b92e191403793c4,a57cb89fd689d156d04c0b7ec8c95a90edeb0d360589ea01cb39ce04c82e4d4e,screening-06,main,TUM autonomous motorsport: An autonomous racing software for the Indy Autonomous Challenge,Johannes Betz; Tobias Betz; Felix Fent; Maximilian Geisslinger; Alexander Heilmeier; Leonhard Hermansdorfer; Thomas Herrmann; Sebastian Huch; Phillip Karle; Markus Lienkamp; Boris Lohmann; Felix Nobis; Levent Ögretmen; Matthias Rowold; Florian Sauerbeck; Tim Stahl; Rainer Trauth; Frederik Werner; Alexander Wischnewski,2023,Journal of Field Robotics,10.1002/rob.22153,https://doi.org/10.1002/rob.22153,journal article
A-C0087-06,C0087,1b1e22da56806ddc58c67cb24d638b51087848436ae51a6d337c99a8a04ad4a6,a57cb89fd689d156d04c0b7ec8c95a90edeb0d360589ea01cb39ce04c82e4d4e,screening-06,main,Indy Autonomous Challenge - Autonomous Race Cars at the Handling Limits,Alexander Wischnewski; Maximilian Geisslinger; Johannes Betz; Tobias Betz; Felix Fent; Alexander Heilmeier; Leonhard Hermansdorfer; Thomas Herrmann; Sebastian Huch; Phillip Karle; Felix Nobis; Levent Ögretmen; Matthias Rowold; Florian Sauerbeck; Tim Stahl; Rainer Trauth; Markus Lienkamp; Boris Lohmann,2022,12th International Munich Chassis Symposium 2021,10.1007/978-3-662-64550-5_10,https://doi.org/10.1007/978-3-662-64550-5_10,book chapter; conference paper
A-C0089-06,C0089,82b6201910b214a46a7654d933d283c618280d328533086b76d63acb1adb08af,a57cb89fd689d156d04c0b7ec8c95a90edeb0d360589ea01cb39ce04c82e4d4e,screening-06,main,AutoRally: An Open Platform for Aggressive Autonomous Driving,Brian Goldfain;Paul Drews;Changxi You;Matthew Barulic;Orlin Velev;Panagiotis Tsiotras;James M. Rehg,2019,IEEE Control Systems,10.1109/mcs.2018.2876958,https://doi.org/10.1109/mcs.2018.2876958,journal article
A-C0095-06,C0095,333b64bd5ef6e90ac98f978e7d78777528572258e56f730a182e3641275cf168,a57cb89fd689d156d04c0b7ec8c95a90edeb0d360589ea01cb39ce04c82e4d4e,screening-06,main,LLA-MPC: Fast Adaptive Control for Autonomous Racing,Maitham F. AL-Sunni; Hassan Almubarak; Katherine Horng; John M. Dolan,2025,arXiv,10.48550/arxiv.2505.19512,https://arxiv.org/abs/2505.19512,preprint
A-C0096-06,C0096,c3c0a9ca8eab0896686145cb784b0349f8c7abb8b60600ff19098e3ba546836e,a57cb89fd689d156d04c0b7ec8c95a90edeb0d360589ea01cb39ce04c82e4d4e,screening-06,main,Autonomous Vehicles on the Edge: A Survey on Autonomous Vehicle Racing,Johannes Betz; Hongrui Zheng; Alexander Liniger; Ugo Rosolia; Phillip Karle; Madhur Behl; Venkat Krovi; Rahul Mangharam,2022,IEEE Open Journal of Intelligent Transportation Systems,10.1109/ojits.2022.3181510,https://doi.org/10.1109/ojits.2022.3181510,journal article
A-C0097-06,C0097,97100b83705cba3a38f9c210fcce4fcef0341c7b47f3966570ea8561dc10a1f3,a57cb89fd689d156d04c0b7ec8c95a90edeb0d360589ea01cb39ce04c82e4d4e,screening-06,calibration,HDMapGen: A Hierarchical Graph Generative Model of High Definition Maps,Lu Mi; Hang Zhao; Charlie Nash; Xiaohan Jin; Jiyang Gao; Chen Sun; Cordelia Schmid; Nir Shavit; Yuning Chai; Dragomir Anguelov,2021,Proceedings of the IEEE/CVF Conference on Computer Vision and Pattern Recognition (CVPR),10.1109/cvpr46437.2021.00421,https://openaccess.thecvf.com/content/CVPR2021/html/Mi_HDMapGen_A_Hierarchical_Graph_Generative_Model_of_High_Definition_Maps_CVPR_2021_paper.html,conference paper
A-C0101-06,C0101,0aea79250fc310e567034cb3b5875b75da1e5a449dc9e76b3273d523d65c3bc6,a57cb89fd689d156d04c0b7ec8c95a90edeb0d360589ea01cb39ce04c82e4d4e,screening-06,main,Using Genetic Algorithms for Automating Automated Lane-Keeping System Testing,Lorenz Klampfl; Florian Klück; Franz Wotawa,2022,Journal of Software: Evolution and Process,10.1002/smr.2520,https://doi.org/10.1002/smr.2520,journal article
A-C0106-06,C0106,a0537cca419388bb0171730979a1ee1adc2453e54ae6bd65b772be56a052cf51,a57cb89fd689d156d04c0b7ec8c95a90edeb0d360589ea01cb39ce04c82e4d4e,screening-06,main,A voyage planning framework for energy performance analysis of autonomous inland waterway vessels,Chengqian Zhang; Chi Zhang; Fabian Thies; Wengang Mao; Jonas W. Ringsberg,2025,Energy,10.1016/j.energy.2025.137906,https://www.sciencedirect.com/science/article/pii/S0360544225035480,journal article
A-C0114-06,C0114,84b78ef1d5ee1e3c30796cd634e5c37c79f86a9eac512521ce49a62296e2d2c8,a57cb89fd689d156d04c0b7ec8c95a90edeb0d360589ea01cb39ce04c82e4d4e,screening-06,main,Racing tracks improvisation,Jiao Jian Wang; Olana Missura,2014,2014 IEEE Conference on Computational Intelligence and Games,10.1109/cig.2014.6932899,https://doi.org/10.1109/cig.2014.6932899,conference paper
A-C0125-06,C0125,b3e82edfb53ccf52e7bacfc3346bf1ea3d28190acb75b7d158162c3d89a197d2,a57cb89fd689d156d04c0b7ec8c95a90edeb0d360589ea01cb39ce04c82e4d4e,screening-06,main,EvoScenario: Integrating Road Structures into Critical Scenario Generation for Autonomous Driving System Testing,Shuncheng Tang; Zhenya Zhang; Jixiang Zhou; Yuan Zhou; Yan-Fu Li; Yinxing Xue,2023,2023 IEEE 34th International Symposium on Software Reliability Engineering (ISSRE),10.1109/issre59848.2023.00054,https://doi.org/10.1109/issre59848.2023.00054,conference paper
A-C0127-06,C0127,049742c6fb77a4a9cba3b7e9c2e49e906a3dbe47298763d2302e59126f00801f,a57cb89fd689d156d04c0b7ec8c95a90edeb0d360589ea01cb39ce04c82e4d4e,screening-06,main,Scenario Factory: Creating Safety-Critical Traffic Scenarios for Automated Vehicles,Moritz Klischat; Edmond Irani Liu; Fabian Holtke; Matthias Althoff,2020,2020 IEEE 23rd International Conference on Intelligent Transportation Systems (ITSC),10.1109/itsc45102.2020.9294629,https://doi.org/10.1109/itsc45102.2020.9294629,conference paper
A-C0128-06,C0128,bb7c89c66b6cce4debf36d75b49d0b9b7ebe75a95d435a6ba8c2d3a8629cee4f,a57cb89fd689d156d04c0b7ec8c95a90edeb0d360589ea01cb39ce04c82e4d4e,screening-06,calibration,CommonRoad: Composable Benchmarks for Motion Planning on Roads,Matthias Althoff; Markus Koschi; Stefanie Manzinger,2017,2017 IEEE Intelligent Vehicles Symposium (IV),10.1109/ivs.2017.7995802,https://doi.org/10.1109/ivs.2017.7995802,conference paper
A-C0133-06,C0133,c18792e5d5eaddf885dafc6d3596a74271afb54942b208d251acdc56f4a46cee,a57cb89fd689d156d04c0b7ec8c95a90edeb0d360589ea01cb39ce04c82e4d4e,screening-06,main,Analysis of Road Representations in Search-Based Testing of Autonomous Driving Systems,Ezequiel Castellano; Ahmet Cetinkaya; Paolo Arcaini,2021,"2021 IEEE 21st International Conference on Software Quality, Reliability and Security (QRS)",10.1109/qrs54544.2021.00028,https://ieeexplore.ieee.org/document/9724804/,conference paper
A-C0135-06,C0135,01817ce1d76933b0494b361f0f0f97f1514c484d2c3a65a04bd22bd6a0aab873,a57cb89fd689d156d04c0b7ec8c95a90edeb0d360589ea01cb39ce04c82e4d4e,screening-06,main,Spirale at the SBFT 2023 Tool Competiton - Cyber-Physical Systems Track,Domenico De Vivo; Anna Rita Fasolino,2023,2023 IEEE/ACM International Workshop on Search-Based and Fuzz Testing (SBFT),10.1109/sbft59156.2023.00007,https://ieeexplore.ieee.org/document/10190397/,conference paper
A-C0136-06,C0136,380e4322482222a17acb0eb0b8dc9b36adfafb1be50f93160c2491a4ffcd2278,a57cb89fd689d156d04c0b7ec8c95a90edeb0d360589ea01cb39ce04c82e4d4e,screening-06,calibration,SBST Tool Competition 2021,Sebastiano Panichella; Alessio Gambi; Fiorella Zampetti; Vincenzo Riccio,2021,2021 IEEE/ACM 14th International Workshop on Search-Based Software Testing (SBST),10.1109/sbst52555.2021.00011,https://ieeexplore.ieee.org/document/9476243/,conference paper; competition report
A-C0137-06,C0137,7630bdad3cc69a3a5d38f9b45a82d68b01a2b0db9085a213124921d1fa4e6631,a57cb89fd689d156d04c0b7ec8c95a90edeb0d360589ea01cb39ce04c82e4d4e,screening-06,main,Preliminary Evaluation of Path-aware Crossover Operators for Search-Based Test Data Generation for Autonomous Driving,Seunghee Han; Jaeuk Kim; Geon Kim; Jaemin Cho; Jiin Kim; Shin Yoo,2021,2021 IEEE/ACM 14th International Workshop on Search-Based Software Testing (SBST),10.1109/sbst52555.2021.00020,https://doi.org/10.1109/SBST52555.2021.00020,workshop paper
A-C0138-06,C0138,1fa2807e196952a9e7041a0b25f7ba67de633c7009b0cd8e6d0d52f6058439b0,a57cb89fd689d156d04c0b7ec8c95a90edeb0d360589ea01cb39ce04c82e4d4e,screening-06,main,Autonomous Port Navigation With Ranging Sensors Using Model-Based Reinforcement Learning,Siemen Herremans;Ali Anwar;Arne Troch;Ian Ravijts;Maarten Vangeneugden;Siegfried Mercelis;Peter Hellinckx,2023,"ASME 2023 42nd International Conference on Ocean, Offshore and Arctic Engineering",10.1115/omae2023-104455,https://doi.org/10.1115/omae2023-104455,conference paper
A-C0142-06,C0142,61c5e7221b626257dd30019ac9b2f11ba060cba79a61fd91002d456572ff393b,a57cb89fd689d156d04c0b7ec8c95a90edeb0d360589ea01cb39ce04c82e4d4e,screening-06,main,DeepHyperion: Exploring the Feature Space of Deep Learning-Based Systems through Illumination Search,Tahereh Zohdinasab; Vincenzo Riccio; Alessio Gambi; Paolo Tonella,2021,Proceedings of the 30th ACM SIGSOFT International Symposium on Software Testing and Analysis,10.1145/3460319.3464811,https://doi.org/10.1145/3460319.3464811,conference paper
A-C0143-06,C0143,f334a3e120dcdd03a5590cb5111a698a68243551e5b64e73589fb6e6bb1fdf45,a57cb89fd689d156d04c0b7ec8c95a90edeb0d360589ea01cb39ce04c82e4d4e,screening-06,main,Wasserstein generative adversarial networks for online test generation for cyber physical systems,Jarkko Peltomäki; Frankie Spencer; Ivan Porres,2022,Proceedings of the 15th Workshop on Search-Based Software Testing,10.1145/3526072.3527522,https://doi.org/10.1145/3526072.3527522,conference paper
A-C0144-06,C0144,c98b8f58994b29c3c4f72d3396a0d3f5d55dbc58badefa1b969bd3988940b530,a57cb89fd689d156d04c0b7ec8c95a90edeb0d360589ea01cb39ce04c82e4d4e,screening-06,main,GenRL at the SBST 2022 Tool Competition,Luigi Libero Lucio Starace; Andrea Romdhana; Sergio Di Martino,2022,Proceedings of the 15th Workshop on Search-Based Software Testing,10.1145/3526072.3527533,https://doi.org/10.1145/3526072.3527533,conference paper
A-C0145-06,C0145,ff66ca310a6693cb1527e134089545afdd97b493329b697732d9616273888d84,a57cb89fd689d156d04c0b7ec8c95a90edeb0d360589ea01cb39ce04c82e4d4e,screening-06,calibration,Reinforcement Learning Informed Evolutionary Search for Autonomous Systems Testing,Dmytro Humeniuk;Foutse Khomh;Giuliano Antoniol,2024,ACM Transactions on Software Engineering and Methodology,10.1145/3680468,https://doi.org/10.1145/3680468,journal article
A-C0147-06,C0147,092bd6b5d78be8d5af0184cd0fabcf4c345d369d3cc257c68cc97315fc9f63fe,a57cb89fd689d156d04c0b7ec8c95a90edeb0d360589ea01cb39ce04c82e4d4e,screening-06,calibration,Toward Maritime Robotic Simulation in Gazebo,Brian Bingham;Carlos Agüero;Michael McCarrin;Joseph Klamo;Joshua Malia;Kevin Allen;Tyler Lum;Marshall Rawson;Rumman Waqar,2019,OCEANS 2019 MTS/IEEE SEATTLE,10.23919/oceans40490.2019.8962724,https://doi.org/10.23919/oceans40490.2019.8962724,conference paper
A-C0153-06,C0153,1b60046b51ddaa8e3eb6743752bfe3eed43472619b01913a67102d5bbcfbae41,a57cb89fd689d156d04c0b7ec8c95a90edeb0d360589ea01cb39ce04c82e4d4e,screening-06,main,OpenAI Gym,Greg Brockman; Vicki Cheung; Ludwig Pettersson; Jonas Schneider; John Schulman; Jie Tang; Wojciech Zaremba,2016,arXiv,10.48550/arxiv.1606.01540,https://arxiv.org/abs/1606.01540,preprint
A-C0154-06,C0154,510675320edf98d3ed7f0171beac0364d48a14bad9602cb4fbff4973edb59c5b,a57cb89fd689d156d04c0b7ec8c95a90edeb0d360589ea01cb39ce04c82e4d4e,screening-06,main,POET: Open-Ended Coevolution of Environments and their Optimized Solutions,Rui Wang; Joel Lehman; Jeff Clune; Kenneth O. Stanley,2019,The Genetic and Evolutionary Computation Conference (GECCO 2019),10.1145/3321707.3321799,https://gecco-2019.sigevo.org/index.html/Accepted+Papers,conference paper
A-C0155-06,C0155,bf4f4ecf2487b9e1d7f1643921e2f3cccda4ca4721cea652c2223fe0ffa5b394,a57cb89fd689d156d04c0b7ec8c95a90edeb0d360589ea01cb39ce04c82e4d4e,screening-06,main,Open-Ended Learning Strategies for Learning Complex Locomotion Skills,Fangqin Zhou; Joaquin Vanschoren,2022,arXiv,10.48550/arxiv.2206.06796,https://arxiv.org/abs/2206.06796,preprint
A-C0156-06,C0156,29d632d860daf8b182bf5433cb45aa83e8725d5a276243095df735d850ae640c,a57cb89fd689d156d04c0b7ec8c95a90edeb0d360589ea01cb39ce04c82e4d4e,screening-06,main,FLYOVER: A Model-Driven Method to Generate Diverse Highway Interchanges for Autonomous Vehicle Testing,Yuan Zhou; Gengjie Lin; Yun Tang; Kairui Yang; Wei Jing; Ping Zhang; Junbo Chen; Liang Gong; Yang Liu,2023,arXiv,10.48550/arxiv.2301.12738,https://arxiv.org/abs/2301.12738,preprint
A-C0158-06,C0158,0ea451b434b4a7436904f35ca8184e2d1d9bce69d8741c552f9ce0e5a99f8648,a57cb89fd689d156d04c0b7ec8c95a90edeb0d360589ea01cb39ce04c82e4d4e,screening-06,main,DriveSceneGen: Generating Diverse and Realistic Driving Scenarios from Scratch,Shuo Sun; Zekai Gu; Tianchen Sun; Jiawei Sun; Chengran Yuan; Yuhang Han; Dongen Li; Marcelo H. Ang Jr.,2024,IEEE Robotics and Automation Letters,10.1109/lra.2024.3416792,https://arxiv.org/abs/2309.14685,journal article
A-C0160-06,C0160,8795fc6101b7490f86b3331f516cb1525ef61345de1ba6f4d8753f6ac39bb93b,a57cb89fd689d156d04c0b7ec8c95a90edeb0d360589ea01cb39ce04c82e4d4e,screening-06,main,Learning Speed Adaptation for Flight in Clutter,Guangyu Zhao; Tianyue Wu; Yeke Chen; Fei Gao,2024,IEEE Robotics and Automation Letters,10.1109/lra.2024.3421789,https://doi.org/10.1109/lra.2024.3421789,journal article
A-C0163-06,C0163,da6be1cbed5538023f78230ac6fb85e73c8f3db0f21502390268d700c751f05e,a57cb89fd689d156d04c0b7ec8c95a90edeb0d360589ea01cb39ce04c82e4d4e,screening-06,main,RoadGen: Generating Road Scenarios for Autonomous Vehicle Testing,Fan Yang; You Lu; Bihuan Chen; Peng Qin; Xin Peng,2024,arXiv,10.48550/arxiv.2411.19577,https://arxiv.org/abs/2411.19577,preprint
A-C0164-06,C0164,4843b0543dc5bef75ec958ac5e3c85c93c860a2de07990f55e0b8723a5991448,a57cb89fd689d156d04c0b7ec8c95a90edeb0d360589ea01cb39ce04c82e4d4e,screening-06,main,GenTe: Generative Real-world Terrains for General Legged Robot Locomotion Control,Hanwen Wan; Mengkang Li; Donghao Wu; Yebin Zhong; Yixuan Deng; Zhenglong Sun; Xiaoqiang Ji,2025,arXiv,10.48550/arxiv.2504.09997,https://arxiv.org/abs/2504.09997,preprint
