assignment_id,phase,candidate_id,input_sha256,snapshot_sha256,batch_id,coder_id,screened_on,screening_status,criterion,access_status,source_urls,evidence_version,evidence_retrieved_on,evidence_archive_url,evidence_sha256,screening_locator,exclusion_reason,notes
A-C0017-02,calibration,C0017,1b4e0b02863780bd1ad91b88a138e91b7d0386ae97758c89c8343089cc194365,aba4aabafecb7fa51291898cafe52b86bb72793f99b81fb168705037ff305794,screening-02,screening-02,2026-07-02,included,include-1,official_documentation,https://gymnasium.farama.org/environments/box2d/car_racing/;https://raw.githubusercontent.com/Farama-Foundation/Gymnasium/v1.2.3/gymnasium/envs/box2d/car_racing.py,Gymnasium v1.2.3,2026-07-02,https://raw.githubusercontent.com/Farama-Foundation/Gymnasium/v1.2.3/gymnasium/envs/box2d/car_racing.py,d0d8c61ba32101d480b46c416b6a0854614efd6f7180aba1276ac0ec4e7f3662,Car Racing Description and Version History; gymnasium/envs/box2d/car_racing.py lines 308-470 and 515-526,NR,Random checkpoint sampling creates each episode road geometry and road tiles.
A-C0090-02,calibration,C0090,07ff0010a19bc0f5824fd0b4808fc6768024d46ef0cd5feef2d7d76fb4aa671a,aba4aabafecb7fa51291898cafe52b86bb72793f99b81fb168705037ff305794,screening-02,screening-02,2026-07-02,excluded,exclude-out-of-scope,official_documentation,https://www.ri.cmu.edu/robotics-groups/driverless-intelligent-vehicles-lab/,unversioned@2026-07-02,2026-07-02,NR,1dadb909338c2dd0a5997b144cb44272be84c8e0101ace27256083cdccded4aa,HTML meta description and page heading Driverless Intelligent Vehicles Lab,The inspected lab page lists research areas including planning control perception and racing but defines no source-native course artifact generator representation metric or benchmark.,NR
A-C0110-02,calibration,C0110,d0c96c7e1508b47e5f15b4230076c822feb22ddc1b30e15cf4c7dd6ebd662547,aba4aabafecb7fa51291898cafe52b86bb72793f99b81fb168705037ff305794,screening-02,screening-02,2026-07-02,excluded,exclude-insufficient-detail,abstract_only,https://api.crossref.org/works/10.1016/j.scico.2024.103171;https://api.crossref.org/works?query.title=CRAG%20a%20combinatorial%20testing%20based%20generator%20of%20road%20geometries%20for%20ADS%20testing&query.author=Paolo%20Arcaini&rows=1;https://api.github.com/search/repositories?q=CRAG+Arcaini;https://api.openalex.org/works/https://doi.org/10.1016/j.scico.2024.103171;https://www.sciencedirect.com/science/article/pii/S0167642324000947,Science of Computer Programming 238 (2024),2026-07-02,NR,0b3e8fc58015aa07e2c2283210e141ebcca0a1e8093e418ce1486687c44e98ca,Crossref API message.title; OpenAlex API open_access and locations; GitHub Search API total_count,Publisher and scholarly records identify the report but no accessible full text or authoritative project artifact was found to verify its claimed road-generation method.,Exhaustive retrieval attempted DOI publisher exact-title-author search scholarly index and official-source GitHub search with no full text found.
A-C0131-02,calibration,C0131,db3ff346c5d5c199904e19db589b744ad06c704002e4c3bfeae18b75c07f1140,aba4aabafecb7fa51291898cafe52b86bb72793f99b81fb168705037ff305794,screening-02,screening-02,2026-07-02,excluded,exclude-out-of-scope,full_text,https://arxiv.org/pdf/2503.01471,arXiv:2503.01471v1,2026-07-02,https://arxiv.org/pdf/2503.01471,5c73cafa8c22f042be02a8fc6729f3cb6de510c054e3646a2aade76e60b5ecd0,Sections III-A Simulation Framework and IV-A Position-Setpoint Tracking Task,The report presents a multirotor simulator with mutable environment meshes and position-setpoint tasks but no source-native racing course generation representation or generated-course evaluation.,NR
A-C0172-02,calibration,C0172,cefbd04dfcbe5274122aab7f7cbe3d6f908daee772e148d9f03be812795e41c2,aba4aabafecb7fa51291898cafe52b86bb72793f99b81fb168705037ff305794,screening-02,screening-02,2026-07-02,included,include-1,official_documentation,https://publications.pages.asam.net/standards/ASAM_OpenSCENARIO/ASAM_OpenSCENARIO_XML/v1.3.0/06_general_concepts/06_08_routes.html;https://publications.pages.asam.net/standards/ASAM_OpenSCENARIO/ASAM_OpenSCENARIO_XML/v1.3.0/generated/content/RandomRouteAction.html,ASAM OpenSCENARIO XML v1.3.0,2026-07-02,https://publications.pages.asam.net/standards/ASAM_OpenSCENARIO/ASAM_OpenSCENARIO_XML/v1.3.0/06_general_concepts/06_08_routes.html,d8e9d8da0b1951bffb2ab521e129e0220ee99b6ac66161477a42e545684cde0c,Section 6.8.1 Randomly determined route; Section 6.8.2 Explicitly assigned route; Class RandomRouteAction,NR,Adjacent-domain mapping: the standard selects road paths and defines ordered waypoint routes whose constraints map directly to a robot race course route.
A-C0177-02,calibration,C0177,cbd828c392e98016e29376e7432970ad347a1434c9db6790160f7ed368fc287a,aba4aabafecb7fa51291898cafe52b86bb72793f99b81fb168705037ff305794,screening-02,screening-02,2026-07-02,included,include-1,full_text,https://proceedings.mlr.press/v119/wang20l/wang20l.pdf,PMLR v119 (2020),2026-07-02,https://proceedings.mlr.press/v119/wang20l/wang20l.pdf,6a01e35d2d0a6ee93015824d3fd2789997057fd604f9389089d5fe04d28c10ab,Sections 3.1 and 4 More Expressive Environment Encoding; Section 5 Experiments,NR,Adjacent-domain mapping: CPPN terrain coordinates and obstacle-course instances can represent ordered traversable ground-course elevation and obstacle constraints without changing the generator claim.
A-C0180-02,calibration,C0180,6fc84402102a67978f406452b2f2acdc0879568a262bf9ed7f9a9ae58cb481f8,aba4aabafecb7fa51291898cafe52b86bb72793f99b81fb168705037ff305794,screening-02,screening-02,2026-07-02,boundary,boundary,full_text,https://proceedings.mlr.press/v123/o-kelly20a/o-kelly20a.pdf,PMLR v123 (2020),2026-07-02,https://proceedings.mlr.press/v123/o-kelly20a/o-kelly20a.pdf,45e171299565b5c99026c1e589b0c74dd73bebc69c72449ef86009446d77699d,Section 3 Benchmarks and Benchmark 1,NR,Boundary transfer: collision-free completion and minimum lap time on a known race track are citable course-validity and performance requirements.
A-C0187-02,calibration,C0187,2bea957a43e09441176e3924a070b6890394b1cc002c918a56f5ed50e7f3c4a8,aba4aabafecb7fa51291898cafe52b86bb72793f99b81fb168705037ff305794,screening-02,screening-02,2026-07-02,excluded,exclude-out-of-scope,official_documentation,https://byu-holoocean.github.io/holoocean-docs/v1.0.0/usage/scenarios.html,HoloOcean 1.0.0,2026-07-02,https://byu-holoocean.github.io/holoocean-docs/v1.0.0/usage/scenarios.html,d1c51cac66c5dd9ebb83402605a2815dae24eeb5642eea950e598ac356284961,Scenarios What is a scenario?; Scenario File Format; Agent objects,The documentation states that a scenario loads a world and places agents while the world or map itself does not change so it supplies no course-generation contribution.,NR
A-C0198-02,calibration,C0198,7f517454af3f20e8f709de0807ef4e75919f0e9f381b836599846f7b8a08a8d5,aba4aabafecb7fa51291898cafe52b86bb72793f99b81fb168705037ff305794,screening-02,screening-02,2026-07-02,boundary,boundary,full_text,https://robonation.org/app/uploads/sites/3/2025/10/RoboBoat-2026-Team-Handbook_111125.pdf,RoboBoat 2026 Team Handbook revision 111125,2026-07-02,https://robonation.org/app/uploads/sites/3/2025/10/RoboBoat-2026-Team-Handbook_111125.pdf,ee93f4b9775a646657cde91b442f4ed2daedc6f68e3db54e04316bea8e3b2d69,Section 3.2.1 Evacuation Route and Return; Section 3.2.2 Navigation Channel; Section 5 Course Boundaries,NR,Boundary transfer: ordered red and green buoy gates and course-boundary compliance define navigable water-course constraints with timed autonomous traversal.
