assignment_id,candidate_id,input_sha256,snapshot_sha256,batch_id,phase,title,authors,year,venue,doi,url,source_type
A-C0007-04,C0007,7293c4730d411e15b3932e0fc61258b4ef801d6862dd404765180a758d073afa,af56d9b391df4d05182c1ac7703ccae3afd94afc5bb84f5c5ca41f8ac52892df,screening-04,main,ASAM OpenDRIVE,ASAM e.V.,2026,ASAM,NR,https://www.asam.net/standards/detail/opendrive/,standard
A-C0012-04,C0012,ca28e432479a14297a10eb2f7cc4be3bfa68d3e2c7afe3368a029465b1550514,af56d9b391df4d05182c1ac7703ccae3afd94afc5bb84f5c5ca41f8ac52892df,screening-04,main,Comparative Analysis of Metaheuristic Algorithms for Procedural Race Track Generation in Games,Sana Alyaseri; Andy Conner,2024,International Journal of Applied Metaheuristic Computing,10.4018/ijamc.350330,https://doi.org/10.4018/ijamc.350330,journal article
A-C0013-04,C0013,e42a5ea3f229e8ea1500b5874bef6b4a6659e224895bad90ea575115ad78f034,af56d9b391df4d05182c1ac7703ccae3afd94afc5bb84f5c5ca41f8ac52892df,screening-04,main,Procedural Generation of Isometric Racetracks Using Chain Code for Racing Games,Erik Jhones F. do Nascimento; Tassiana M. Castro; Ana Carolina S. Abreu; Filipe A. Lira; Amauri H. Souza,2021,2021 20th Brazilian Symposium on Computer Games and Digital Entertainment (SBGames),10.1109/sbgames54170.2021.00025,https://doi.org/10.1109/sbgames54170.2021.00025,conference paper
A-C0014-04,C0014,c886f14937986fa9066ea814a52eb26da9cb244eb1ce161eca47fd40b665135b,af56d9b391df4d05182c1ac7703ccae3afd94afc5bb84f5c5ca41f8ac52892df,screening-04,main,Automatic Generation of Challenging Road Networks for ALKS Testing based on Bezier Curves and Search,Florian Klück;Lorenz Klampfl;Franz Wotawa,2021,arXiv,10.48550/arxiv.2103.01288,https://arxiv.org/abs/2103.01288,preprint
A-C0018-04,C0018,b7d2bb6f381b07a6d1a5ad403be3f767f0f3a84fae2bb98a307e344a47c4c371,af56d9b391df4d05182c1ac7703ccae3afd94afc5bb84f5c5ca41f8ac52892df,screening-04,main,CLUTR: Curriculum Learning via Unsupervised Task Representation Learning,Abdus Salam Azad; Izzeddin Gur; Jasper Emhoff; Nathaniel Alexis; Aleksandra Faust; Pieter Abbeel; Ion Stoica,2023,Proceedings of the 40th International Conference on Machine Learning,NR,https://proceedings.mlr.press/v202/azad23a.html,conference paper
A-C0020-04,C0020,5a966a1ba04efc27f8de78512e132d6ba14332a633abec953033ce4fa2cb47c9,af56d9b391df4d05182c1ac7703ccae3afd94afc5bb84f5c5ca41f8ac52892df,screening-04,main,Emergent Complexity and Zero-shot Transfer via Unsupervised Environment Design,Michael Dennis; Natasha Jaques; Eugene Vinitsky; Alexandre Bayen; Stuart J. Russell; Andrew Critch; Sergey Levine,2020,Advances in Neural Information Processing Systems 33,NR,https://proceedings.neurips.cc/paper_files/paper/2020/hash/985e9a46e10005356bbaf194249f6856-Abstract.html,conference paper
A-C0024-04,C0024,5b97c093a26249546cd706506b04db00ce6b19a3b6fcb40ab84027a79bcc7157,af56d9b391df4d05182c1ac7703ccae3afd94afc5bb84f5c5ca41f8ac52892df,screening-04,main,Diversity-guided Search Exploration for Self-driving Cars Test Generation through Frenet Space Encoding,Timo Blattner;Christian Birchler;Timo Kehrer;Sebastiano Panichella,2024,Proceedings of the 17th ACM/IEEE International Workshop on Search-Based and Fuzz Testing,10.1145/3643659.3643926,https://doi.org/10.1145/3643659.3643926,conference paper
A-C0027-04,C0027,ce0ffa9d871e2deb6532eea99bc9bb6fbd266f638288d2c5443d75b00c9aec7b,af56d9b391df4d05182c1ac7703ccae3afd94afc5bb84f5c5ca41f8ac52892df,screening-04,main,Learning Generalizable Policy for Obstacle-Aware Autonomous Drone Racing,Yueqian Liu,2024,arXiv,10.48550/arxiv.2411.04246,https://arxiv.org/abs/2411.04246,preprint
A-C0029-04,C0029,1b68956fd78c76b4064da6bc395a9ea921eb342577b3ba4438b6ce5d480a6cd7,af56d9b391df4d05182c1ac7703ccae3afd94afc5bb84f5c5ca41f8ac52892df,screening-04,main,Outracing champion Gran Turismo drivers with deep reinforcement learning,Peter R. Wurman; Samuel Barrett; Kenta Kawamoto; James MacGlashan; Kaushik Subramanian; Thomas J. Walsh; Roberto Capobianco; Alisa Devlic; Franziska Eckert; Florian Fuchs; Leilani Gilpin; Piyush Khandelwal; Varun Kompella; HaoChih Lin; Patrick MacAlpine; Declan Oller; Takuma Seno; Craig Sherstan; Michael D. Thomure; Houmehr Aghabozorgi; Leon Barrett; Rory Douglas; Dion Whitehead; Peter Dürr; Peter Stone; Michael Spranger; Hiroaki Kitano,2022,Nature,10.1038/s41586-021-04357-7,https://www.nature.com/articles/s41586-021-04357-7,journal article
A-C0036-04,C0036,a2e9336f8371311dc6f375dedf88e7860b5fb7c001528fa745005bb250af9eaf,af56d9b391df4d05182c1ac7703ccae3afd94afc5bb84f5c5ca41f8ac52892df,screening-04,main,Generating a Racing Line for an Autonomous Racecar Using Professional Driving Techniques,Paul A. Theodosis; J. Christian Gerdes,2011,"ASME 2011 Dynamic Systems and Control Conference and Bath/ASME Symposium on Fluid Power and Motion Control, Volume 2",10.1115/dscc2011-6097,https://doi.org/10.1115/DSCC2011-6097,conference paper
A-C0038-04,C0038,22c030813a47602a2c6eb21d6d27e7b6702b85427419fd030a887a3d4d95214c,af56d9b391df4d05182c1ac7703ccae3afd94afc5bb84f5c5ca41f8ac52892df,screening-04,main,Minimum curvature trajectory planning and control for an autonomous race car,Alexander Heilmeier; Alexander Wischnewski; Leonhard Hermansdorfer; Johannes Betz; Markus Lienkamp; Boris Lohmann,2020,Vehicle System Dynamics,10.1080/00423114.2019.1631455,https://doi.org/10.1080/00423114.2019.1631455,journal article
A-C0039-04,C0039,534790903dfd1a814eab8e4314f159140b4250d8de39bbc76ce620a03dcebcc2,af56d9b391df4d05182c1ac7703ccae3afd94afc5bb84f5c5ca41f8ac52892df,screening-04,main,Optimization of the Driving Line on a Race Track,Martin Mühlmeier; Norbert Müller,2002,Motorsports Engineering Conference & Exhibition,10.4271/2002-01-3339,https://doi.org/10.4271/2002-01-3339,conference technical paper
A-C0046-04,C0046,1f01eaa8bf6a35e59aca788932566533be438258dd540c21fa6f4a084a7211b0,af56d9b391df4d05182c1ac7703ccae3afd94afc5bb84f5c5ca41f8ac52892df,screening-04,calibration,MetaDrive: Composing Diverse Driving Scenarios for Generalizable Reinforcement Learning,Quanyi Li; Zhenghao Peng; Lan Feng; Qihang Zhang; Zhenghai Xue; Bolei Zhou,2023,IEEE Transactions on Pattern Analysis and Machine Intelligence,10.1109/tpami.2022.3190471,https://doi.org/10.1109/tpami.2022.3190471,journal article
A-C0047-04,C0047,f4ac7245dfd63d9de10ccbd32b4096b0134d0d757716fb9bb909dcb0039003bc,af56d9b391df4d05182c1ac7703ccae3afd94afc5bb84f5c5ca41f8ac52892df,screening-04,main,ChickenKorma/Track-Generator,ChickenKorma,2022,GitHub repository,NR,https://github.com/ChickenKorma/Track-Generator,software repository
A-C0052-04,C0052,27f650d568eaca94084808f7372657ae6cc1ce216173ebe0e31958e2902f0803,af56d9b391df4d05182c1ac7703ccae3afd94afc5bb84f5c5ca41f8ac52892df,screening-04,main,Procedural modeling of cities,Yoav I. H. Parish; Pascal Müller,2001,Proceedings of the 28th annual conference on Computer graphics and interactive techniques,10.1145/383259.383292,https://doi.org/10.1145/383259.383292,conference paper
A-C0056-04,C0056,6c67d0ef0832f79006985924554f4f34034d67381e51cb78cfae19408c0c59f6,af56d9b391df4d05182c1ac7703ccae3afd94afc5bb84f5c5ca41f8ac52892df,screening-04,main,On the minimum ropelength of knots and links,Jason Cantarella; Robert B. Kusner; John M. Sullivan,2002,Inventiones mathematicae,10.1007/s00222-002-0234-y,https://link.springer.com/article/10.1007/s00222-002-0234-y,journal article
A-C0058-04,C0058,cbcef497f42e7b0132ef29140a85a24e1e5b0afa7982ed93d5673fa586238d39,af56d9b391df4d05182c1ac7703ccae3afd94afc5bb84f5c5ca41f8ac52892df,screening-04,main,From Generation to Gameplay: Authoring Race Tracks With Repulsive Curves,Lasse Henrich;Falko Kötter,2025,IEEE Transactions on Games,10.1109/tg.2025.3561107,https://doi.org/10.1109/tg.2025.3561107,journal article
A-C0060-04,C0060,6907f41bfd9da2097852404e3054e67539794e57bbd3264e411dc38b9b170d09,af56d9b391df4d05182c1ac7703ccae3afd94afc5bb84f5c5ca41f8ac52892df,screening-04,main,Position Based Dynamics,Matthias Müller; Bruno Heidelberger; Marcus Hennix; John Ratcliff,2007,Journal of Visual Communication and Image Representation,10.1016/j.jvcir.2007.01.005,https://doi.org/10.1016/j.jvcir.2007.01.005,journal article
A-C0061-04,C0061,5498563cfb6622c1e393704d6af9ffe6c6a945f6a88c3276dc3059840532be0e,af56d9b391df4d05182c1ac7703ccae3afd94afc5bb84f5c5ca41f8ac52892df,screening-04,calibration,XPBD: Position-Based Simulation of Compliant Constrained Dynamics,Miles Macklin; Matthias Müller; Nuttapong Chentanez,2016,Proceedings of the 9th International Conference on Motion in Games,10.1145/2994258.2994272,https://doi.org/10.1145/2994258.2994272,conference paper
A-C0067-04,C0067,f09d61d60557f6a8a88fae56ef4ad902c3ccf024b3aa9036063879356d751d77,af56d9b391df4d05182c1ac7703ccae3afd94afc5bb84f5c5ca41f8ac52892df,screening-04,main,Towards automatic personalised content creation for racing games,Julian Togelius; Renzo De Nardi; Simon M. Lucas,2007,2007 IEEE Symposium on Computational Intelligence and Games,10.1109/cig.2007.368106,https://doi.org/10.1109/cig.2007.368106,conference paper
A-C0069-04,C0069,1070e3f35067788e943d8f7348aacfcad1f41a8a49f3386c06d11976393b29a4,af56d9b391df4d05182c1ac7703ccae3afd94afc5bb84f5c5ca41f8ac52892df,screening-04,main,Experience-Driven Procedural Content Generation,Georgios N. Yannakakis; Julian Togelius,2011,IEEE Transactions on Affective Computing,10.1109/t-affc.2011.6,https://doi.org/10.1109/T-AFFC.2011.6,journal article
A-C0073-04,C0073,06dafee3a7b094eafc2363748fc0e2e8830c5062cf09d904c4ef4b9296080f74,af56d9b391df4d05182c1ac7703ccae3afd94afc5bb84f5c5ca41f8ac52892df,screening-04,main,Deep Drone Racing: Learning Agile Flight in Dynamic Environments,Elia Kaufmann; Antonio Loquercio; Rene Ranftl; Alexey Dosovitskiy; Vladlen Koltun; Davide Scaramuzza,2018,Proceedings of The 2nd Conference on Robot Learning,NR,https://proceedings.mlr.press/v87/kaufmann18a.html,conference paper
A-C0085-04,C0085,eb66eb240d8654fd45a2aab1211a19676c9aa9bc2d7b0bad613c685350e6983c,af56d9b391df4d05182c1ac7703ccae3afd94afc5bb84f5c5ca41f8ac52892df,screening-04,main,Optimization-based autonomous racing of 1:43 scale RC cars,Alexander Liniger;Alexander Domahidi;Manfred Morari,2015,Optimal Control Applications and Methods,10.1002/oca.2123,https://doi.org/10.1002/oca.2123,journal article
A-C0087-04,C0087,544675838561948e3c4fc756220ba38e88a01171c36e07c5487e7bd77507a1db,af56d9b391df4d05182c1ac7703ccae3afd94afc5bb84f5c5ca41f8ac52892df,screening-04,main,Indy Autonomous Challenge - Autonomous Race Cars at the Handling Limits,Alexander Wischnewski; Maximilian Geisslinger; Johannes Betz; Tobias Betz; Felix Fent; Alexander Heilmeier; Leonhard Hermansdorfer; Thomas Herrmann; Sebastian Huch; Phillip Karle; Felix Nobis; Levent Ögretmen; Matthias Rowold; Florian Sauerbeck; Tim Stahl; Rainer Trauth; Markus Lienkamp; Boris Lohmann,2022,12th International Munich Chassis Symposium 2021,10.1007/978-3-662-64550-5_10,https://doi.org/10.1007/978-3-662-64550-5_10,book chapter; conference paper
A-C0088-04,C0088,e689a4540128005ea48af825f03e339b56cd88195102ae2297e38b91da21fc85,af56d9b391df4d05182c1ac7703ccae3afd94afc5bb84f5c5ca41f8ac52892df,screening-04,calibration,Indy Autonomous Challenge,Indy Autonomous Challenge,NR,Official competition website,NR,https://www.indyautonomouschallenge.com/,competition
A-C0090-04,C0090,d4e9b17d4b6448293c25383eb658283b7c06f84756bd82e54bc5a66c2a68b701,af56d9b391df4d05182c1ac7703ccae3afd94afc5bb84f5c5ca41f8ac52892df,screening-04,calibration,Driverless Intelligent Vehicles Lab,Carnegie Mellon University Robotics Institute,2024,Robotics Institute Carnegie Mellon University,NR,https://www.ri.cmu.edu/robotics-groups/driverless-intelligent-vehicles-lab/,official lab documentation; research lab
A-C0091-04,C0091,7c0dd007e706c3c9872757e8064b0c8a5ffe4b004287fd1fa1e9b156b2a1837d,af56d9b391df4d05182c1ac7703ccae3afd94afc5bb84f5c5ca41f8ac52892df,screening-04,main,AI Racing Tech,AI Racing Tech,2020,Official team website,NR,https://www.airacingtech.com/about-us,competition system; official website
A-C0092-04,C0092,b1183b30318452d0cc3516cf574179fc7e0426f536b7c1bc4741eb4b8248c286,af56d9b391df4d05182c1ac7703ccae3afd94afc5bb84f5c5ca41f8ac52892df,screening-04,main,Learning Model Predictive Control with Error Dynamics Regression for Autonomous Racing,Haoru Xue;Edward L. Zhu;John M. Dolan;Francesco Borrelli,2024,2024 IEEE International Conference on Robotics and Automation (ICRA),10.1109/icra57147.2024.10611628,https://doi.org/10.1109/icra57147.2024.10611628,conference paper
A-C0093-04,C0093,499e14dc52b1ed379c26144b16e8695ef7684529d90e83bd730b23fe7a664297,af56d9b391df4d05182c1ac7703ccae3afd94afc5bb84f5c5ca41f8ac52892df,screening-04,main,Towards Safety Assured End-to-End Vision-Based Control for Autonomous Racing,Dvij Kalaria; Qin Lin; John M. Dolan,2023,arXiv,10.48550/arxiv.2303.02267,https://arxiv.org/abs/2303.02267,preprint
A-C0096-04,C0096,1db32864555363e37774e817b72a374da68ca3a17f5d179e5c609f7bbb083945,af56d9b391df4d05182c1ac7703ccae3afd94afc5bb84f5c5ca41f8ac52892df,screening-04,main,Autonomous Vehicles on the Edge: A Survey on Autonomous Vehicle Racing,Johannes Betz; Hongrui Zheng; Alexander Liniger; Ugo Rosolia; Phillip Karle; Madhur Behl; Venkat Krovi; Rahul Mangharam,2022,IEEE Open Journal of Intelligent Transportation Systems,10.1109/ojits.2022.3181510,https://doi.org/10.1109/ojits.2022.3181510,journal article
A-C0098-04,C0098,8ab0decab60dee294bc682f44a72f6498956e092434c267c05b63e0e5241d30f,af56d9b391df4d05182c1ac7703ccae3afd94afc5bb84f5c5ca41f8ac52892df,screening-04,main,OpenStreetMap,OpenStreetMap contributors,NR,OpenStreetMap project,NR,https://www.openstreetmap.org/,geospatial dataset and platform
A-C0101-04,C0101,96801b21550835fd44c5fe23657ebada3c2c246dc5e9b1ac8e403b00f0347dd9,af56d9b391df4d05182c1ac7703ccae3afd94afc5bb84f5c5ca41f8ac52892df,screening-04,main,Using Genetic Algorithms for Automating Automated Lane-Keeping System Testing,Lorenz Klampfl; Florian Klück; Franz Wotawa,2022,Journal of Software: Evolution and Process,10.1002/smr.2520,https://doi.org/10.1002/smr.2520,journal article
A-C0103-04,C0103,674ee5bb69d03d4ce925d33c4c0a08de68a6d1fe8184c0c9c8e2b2317857aebc,af56d9b391df4d05182c1ac7703ccae3afd94afc5bb84f5c5ca41f8ac52892df,screening-04,main,Machine learning-based test selection for simulation-based testing of self-driving cars software,Christian Birchler;Sajad Khatiri;Bill Bosshard;Alessio Gambi;Sebastiano Panichella,2023,Empirical Software Engineering,10.1007/s10664-023-10286-y,https://doi.org/10.1007/s10664-023-10286-y,journal article
A-C0104-04,C0104,46c632cc1b0d8aa8bf196b1f95f2e719a9dc2be08df819a3d6c870a058839517,af56d9b391df4d05182c1ac7703ccae3afd94afc5bb84f5c5ca41f8ac52892df,screening-04,main,Air Learning: a deep reinforcement learning gym for autonomous aerial robot visual navigation,Srivatsan Krishnan; Behzad Boroujerdian; William Fu; Aleksandra Faust; Vijay Janapa Reddi,2021,Machine Learning,10.1007/s10994-021-06006-6,https://link.springer.com/article/10.1007/s10994-021-06006-6,journal article
A-C0111-04,C0111,3bf6ddfdd14f34a46fa0ce2c15089ad2b95b71037c4e6faa50cd9fdc7a11ef00,af56d9b391df4d05182c1ac7703ccae3afd94afc5bb84f5c5ca41f8ac52892df,screening-04,main,Learning vision-based agile flight via differentiable physics,Yuang Zhang; Yu Hu; Yunlong Song; Danping Zou; Weiyao Lin,2025,Nature Machine Intelligence,10.1038/s42256-025-01048-0,https://www.nature.com/articles/s42256-025-01048-0,journal article
A-C0113-04,C0113,8f019bb18b4797883a623df74ee56c1513e6d5f8e15fce2c294e49e5b42e0d11,af56d9b391df4d05182c1ac7703ccae3afd94afc5bb84f5c5ca41f8ac52892df,screening-04,main,Evolving A Diverse Collection of Robot Path Planning Problems,D. A. Ashlock; T. W. Manikas; K. Ashenayi,2006,2006 IEEE International Conference on Evolutionary Computation,10.1109/cec.2006.1688530,https://doi.org/10.1109/cec.2006.1688530,conference paper
A-C0115-04,C0115,74dec027879a6a153a218dc458056746be55e83c32743a3cd6889d11c50b7509,af56d9b391df4d05182c1ac7703ccae3afd94afc5bb84f5c5ca41f8ac52892df,screening-04,main,Personalised track design in car racing games,Theodosis Georgiou; Yiannis Demiris,2016,2016 IEEE Conference on Computational Intelligence and Games (CIG),10.1109/cig.2016.7860435,https://doi.org/10.1109/cig.2016.7860435,conference paper
A-C0123-04,C0123,65262148463ed75838572fe0d437295ec76351b72b9f26631a319d93570c873d,af56d9b391df4d05182c1ac7703ccae3afd94afc5bb84f5c5ca41f8ac52892df,screening-04,main,Quality Metrics and Oracles for Autonomous Vehicles Testing,Gunel Jahangirova; Andrea Stocco; Paolo Tonella,2021,"2021 14th IEEE Conference on Software Testing, Verification and Validation (ICST)",10.1109/icst49551.2021.00030,https://doi.org/10.1109/ICST49551.2021.00030,conference paper
A-C0129-04,C0129,1b01a460e22355fcd83b35aa9d5672b6a46f756eae15735842a18dd3afcfa7fc,af56d9b391df4d05182c1ac7703ccae3afd94afc5bb84f5c5ca41f8ac52892df,screening-04,main,OmniDrones: An Efficient and Flexible Platform for Reinforcement Learning in Drone Control,Botian Xu; Feng Gao; Chao Yu; Ruize Zhang; Yi Wu; Yu Wang,2024,IEEE Robotics and Automation Letters,10.1109/lra.2024.3356168,https://arxiv.org/abs/2309.12825,journal article
A-C0131-04,C0131,6aa3956a188f64b3a02f150bbea96717cbd874ee2e666d1ed6cf6b64f032280f,af56d9b391df4d05182c1ac7703ccae3afd94afc5bb84f5c5ca41f8ac52892df,screening-04,calibration,Aerial Gym Simulator: A Framework for Highly Parallelized Simulation of Aerial Robots,Mihir Kulkarni;Welf Rehberg;Kostas Alexis,2025,IEEE Robotics and Automation Letters,10.1109/lra.2025.3548507,https://doi.org/10.1109/lra.2025.3548507,journal article
A-C0137-04,C0137,15f74972c986435590545adce12c0780b795ccae28aa05053642d96964b7cec3,af56d9b391df4d05182c1ac7703ccae3afd94afc5bb84f5c5ca41f8ac52892df,screening-04,main,Preliminary Evaluation of Path-aware Crossover Operators for Search-Based Test Data Generation for Autonomous Driving,Seunghee Han; Jaeuk Kim; Geon Kim; Jaemin Cho; Jiin Kim; Shin Yoo,2021,2021 IEEE/ACM 14th International Workshop on Search-Based Software Testing (SBST),10.1109/sbst52555.2021.00020,https://doi.org/10.1109/SBST52555.2021.00020,workshop paper
A-C0138-04,C0138,132d1b8ca54db0407e6da4a08743e1c900e101c80c7e7c159c81d5cdb0e6cc2f,af56d9b391df4d05182c1ac7703ccae3afd94afc5bb84f5c5ca41f8ac52892df,screening-04,main,Autonomous Port Navigation With Ranging Sensors Using Model-Based Reinforcement Learning,Siemen Herremans;Ali Anwar;Arne Troch;Ian Ravijts;Maarten Vangeneugden;Siegfried Mercelis;Peter Hellinckx,2023,"ASME 2023 42nd International Conference on Ocean, Offshore and Arctic Engineering",10.1115/omae2023-104455,https://doi.org/10.1115/omae2023-104455,conference paper
A-C0145-04,C0145,ad76bbb8c1a72cd8ea1297b1814455dc129a23ecbe87696387af99aa481df6be,af56d9b391df4d05182c1ac7703ccae3afd94afc5bb84f5c5ca41f8ac52892df,screening-04,calibration,Reinforcement Learning Informed Evolutionary Search for Autonomous Systems Testing,Dmytro Humeniuk;Foutse Khomh;Giuliano Antoniol,2024,ACM Transactions on Software Engineering and Methodology,10.1145/3680468,https://doi.org/10.1145/3680468,journal article
A-C0148-04,C0148,96161ea85742ffa8beee806118156451d2529219214780ca4c5d9b7a342e34f5,af56d9b391df4d05182c1ac7703ccae3afd94afc5bb84f5c5ca41f8ac52892df,screening-04,main,Complexity controllable road network generation for virtual testing of autonomous driving,Yu Zhu; Jiaxin Wang; Shaoxin Yuan; Zhigang Xu; Xiaobo Qu,2026,Communications in Transportation Research,10.26599/commtr.2026.9640024,https://doi.org/10.26599/commtr.2026.9640024,journal article
A-C0149-04,C0149,a6f503a3676977cda5271d940746aeba8f19ba65117ac156babc03b503203e78,af56d9b391df4d05182c1ac7703ccae3afd94afc5bb84f5c5ca41f8ac52892df,screening-04,main,Deep Reinforcement Learning Controller for 3D Path Following and Collision Avoidance by Autonomous Underwater Vehicles,Simen Theie Havenstrøm; Adil Rasheed; Omer San,2021,Frontiers in Robotics and AI,10.3389/frobt.2020.566037,https://www.frontiersin.org/journals/robotics-and-ai/articles/10.3389/frobt.2020.566037/full,journal article
A-C0150-04,C0150,63b48cf3896ae637bdad647cfa9623b0670bc3e27f4c7c0cc060327d93034413,af56d9b391df4d05182c1ac7703ccae3afd94afc5bb84f5c5ca41f8ac52892df,screening-04,main,Navigation Scenario Permutation Model for Training of Maritime Autonomous Surface Ship Remote Operators,Taemin Hwang; Ik-Hyun Youn,2022,Applied Sciences,10.3390/app12031651,https://www.mdpi.com/2076-3417/12/3/1651,journal article
A-C0155-04,C0155,169a7b9e5dd75e55c0ca358790ce4e15342f1c0d9fd4d00a232b3fd001a6bdb2,af56d9b391df4d05182c1ac7703ccae3afd94afc5bb84f5c5ca41f8ac52892df,screening-04,main,Open-Ended Learning Strategies for Learning Complex Locomotion Skills,Fangqin Zhou; Joaquin Vanschoren,2022,arXiv,10.48550/arxiv.2206.06796,https://arxiv.org/abs/2206.06796,preprint
A-C0156-04,C0156,3ba8e369e41a1767249e8d902b0a19e40b8a4c72c8b79baa6b90c87e9067a911,af56d9b391df4d05182c1ac7703ccae3afd94afc5bb84f5c5ca41f8ac52892df,screening-04,main,FLYOVER: A Model-Driven Method to Generate Diverse Highway Interchanges for Autonomous Vehicle Testing,Yuan Zhou; Gengjie Lin; Yun Tang; Kairui Yang; Wei Jing; Ping Zhang; Junbo Chen; Liang Gong; Yang Liu,2023,arXiv,10.48550/arxiv.2301.12738,https://arxiv.org/abs/2301.12738,preprint
A-C0163-04,C0163,5d4fc2f19dabfbec7d13ba91552fbe38f87744420977657a13b6306ecc8cca73,af56d9b391df4d05182c1ac7703ccae3afd94afc5bb84f5c5ca41f8ac52892df,screening-04,main,RoadGen: Generating Road Scenarios for Autonomous Vehicle Testing,Fan Yang; You Lu; Bihuan Chen; Peng Qin; Xin Peng,2024,arXiv,10.48550/arxiv.2411.19577,https://arxiv.org/abs/2411.19577,preprint
A-C0168-04,C0168,c5e10e73fb74bbf841dffd2ac5b898f633578b39525d3bb4ce3ccf2d56d33fae,af56d9b391df4d05182c1ac7703ccae3afd94afc5bb84f5c5ca41f8ac52892df,screening-04,calibration,2022 Maritime RobotX Challenge Team Handbook,RoboNation,2022,Maritime RobotX Challenge official documentation,NR,https://robonation.org/app/uploads/sites/2/2022/10/2022-RobotX_Team-Handbook_v3.0.pdf,official competition documentation
A-C0173-04,C0173,39d2060f9f7fd287396bbd988355a84da6b1d5fc1b0a50e4b80f435051b5870d,af56d9b391df4d05182c1ac7703ccae3afd94afc5bb84f5c5ca41f8ac52892df,screening-04,calibration,BayesRace: Learning to race autonomously using prior experience,Achin Jain;Matthew O'Kelly;Pratik Chaudhari;Manfred Morari,2021,Proceedings of the 2020 Conference on Robot Learning,NR,https://proceedings.mlr.press/v155/jain21b.html,conference paper
A-C0178-04,C0178,82f1f3ecd17f3f57550c86ef852563c8a86f5b4c633b66e641ef5fb26de14175,af56d9b391df4d05182c1ac7703ccae3afd94afc5bb84f5c5ca41f8ac52892df,screening-04,main,EUFS maps,Edinburgh University Formula Student,2023,Official GitLab repository,NR,https://gitlab.com/eufs/public/eufs_maps,track dataset repository
A-C0183-04,C0183,7c60bd2458bb73da799febc0331e9505005eb7fe6d0c25aff5f0b7b154d823d2,af56d9b391df4d05182c1ac7703ccae3afd94afc5bb84f5c5ca41f8ac52892df,screening-04,calibration,Flightmare: A Flexible Quadrotor Simulator,Yunlong Song; Selim Naji; Elia Kaufmann; Antonio Loquercio; Davide Scaramuzza,2021,Proceedings of the 2020 Conference on Robot Learning,NR,https://proceedings.mlr.press/v155/song21a.html,conference paper; simulator
A-C0184-04,C0184,851aeb8bc4f57e70a7ed2ab330341a2af56c683bfd3c4b1dba711a4f8f3090a3,af56d9b391df4d05182c1ac7703ccae3afd94afc5bb84f5c5ca41f8ac52892df,screening-04,main,Formula Student Driverless Simulator 2.2.0,FS-Driverless,2023,GitHub release and official documentation,NR,https://github.com/FS-Driverless/Formula-Student-Driverless-Simulator/releases/tag/v2.2.0,software release; official documentation
A-C0187-04,C0187,e43727a46aaaf2fcc69cf76dade159e0b35c403204f2079379e0d8af2f2bfa03,af56d9b391df4d05182c1ac7703ccae3afd94afc5bb84f5c5ca41f8ac52892df,screening-04,calibration,HoloOcean 1.0.0: Scenarios,BYU FRoStLab,NR,HoloOcean 1.0.0 official documentation,NR,https://byu-holoocean.github.io/holoocean-docs/v1.0.0/usage/scenarios.html,official documentation
A-C0189-04,C0189,970b1f6f55e2a03bfbb6a4a8b3c89242586a46b61cbc2ddb6fd62f5300fe6ee5,af56d9b391df4d05182c1ac7703ccae3afd94afc5bb84f5c5ca41f8ac52892df,screening-04,main,TUMFTM/laptime-simulation,TUM - Institute of Automotive Technology,2020,GitHub repository,NR,https://github.com/TUMFTM/laptime-simulation,software repository
A-C0190-04,C0190,e7abf4f2f319bcdfc5b4321a15f1e5636e87381f6a0ed3f6c7813c5df5c3da96,af56d9b391df4d05182c1ac7703ccae3afd94afc5bb84f5c5ca41f8ac52892df,screening-04,main,Learning to Walk in Minutes Using Massively Parallel Deep Reinforcement Learning,Nikita Rudin; David Hoeller; Philipp Reist; Marco Hutter,2022,Proceedings of the 5th Conference on Robot Learning,NR,https://proceedings.mlr.press/v164/rudin22a.html,conference paper
A-C0192-04,C0192,94854f1868c4526b7800440d5dfa5802e15cdcef626ae2096c175bf895b0efc4,af56d9b391df4d05182c1ac7703ccae3afd94afc5bb84f5c5ca41f8ac52892df,screening-04,main,OpenDRIVE standalone mode,CARLA Team,2021,CARLA 0.9.12 documentation,NR,https://carla.readthedocs.io/en/0.9.12/adv_opendrive/,software documentation
A-C0195-04,C0195,b2bf7ad40b65c95edd6ffe1e5b353e1ec2f94d18a3276400340a5ba1a776989c,af56d9b391df4d05182c1ac7703ccae3afd94afc5bb84f5c5ca41f8ac52892df,screening-04,main,Race Track Database,TUMFTM contributors,2020,GitHub repository,NR,https://github.com/TUMFTM/racetrack-database,dataset; official repository
A-C0196-04,C0196,fb49f53df4c54c965e4b5dd6f1ad7ccb8601d7ba499dcdff7d12dcb42fb429de,af56d9b391df4d05182c1ac7703ccae3afd94afc5bb84f5c5ca41f8ac52892df,screening-04,calibration,Random Track Generator,Formula Student Team Delft,2026,Python Package Index,NR,https://pypi.org/project/random-track-generator/,software package; official repository
A-C0200-04,C0200,6d5aa33f259f37599483d8502383c09cd9fcd1564f0a22bca265a8bfe7b5a8f7,af56d9b391df4d05182c1ac7703ccae3afd94afc5bb84f5c5ca41f8ac52892df,screening-04,main,RobotX 2026 | Team Handbook,"RoboNation, Inc.; U.S. Office of Naval Research",2026,Maritime RobotX Challenge,NR,https://robonation.org/app/uploads/sites/2/2026/06/RobotX-2026_Team-Handbook-20260625.pdf,competition specification
