assignment_id,candidate_id,input_sha256,snapshot_sha256,batch_id,phase,title,authors,year,venue,doi,url,source_type
A-C0175-03,C0175,f716ce0f43cc7102d179305b45b89c30277df6fa6bc3579e08a61332ccb2c90d,af56d9b391df4d05182c1ac7703ccae3afd94afc5bb84f5c5ca41f8ac52892df,screening-03,calibration,CARLA Autonomous Driving Leaderboard 2.0,CARLA Leaderboard Team,NR,CARLA Leaderboard documentation and repositories,NR,https://leaderboard.carla.org/get_started_v2_0/,benchmark; official documentation; official repository
A-C0176-03,C0176,737894f964b08d89c68d2d9659b2b2cddfa343ce0281724fe46d8a7b616e7598,af56d9b391df4d05182c1ac7703ccae3afd94afc5bb84f5c5ca41f8ac52892df,screening-03,main,CommonRoad Scenario Designer: An Open-Source Toolbox for Map Conversion and Scenario Creation for Autonomous Vehicles,Sebastian Maierhofer; Moritz Klischat; Matthias Althoff,2021,2021 IEEE International Intelligent Transportation Systems Conference (ITSC),10.1109/itsc48978.2021.9564885,https://doi.org/10.1109/itsc48978.2021.9564885,conference paper
A-C0182-03,C0182,40f3c4bade8789bf2fc54b998f884eff082aaf1d82240e8a8c88ddad19017907,af56d9b391df4d05182c1ac7703ccae3afd94afc5bb84f5c5ca41f8ac52892df,screening-03,main,f1tenth/f1tenth_racetracks,F1TENTH,2021,GitHub repository,NR,https://github.com/f1tenth/f1tenth_racetracks,dataset repository
A-C0185-03,C0185,62a7a1eceb4ca8d0991cf2de9a011dc93087499b61c48b9b95ebf63bd70b7fc0,af56d9b391df4d05182c1ac7703ccae3afd94afc5bb84f5c5ca41f8ac52892df,screening-03,main,FSSIM,Juraj Kabzan,2019,Official GitHub repository,NR,https://github.com/AMZ-Racing/fssim,simulator software
A-C0189-03,C0189,970b1f6f55e2a03bfbb6a4a8b3c89242586a46b61cbc2ddb6fd62f5300fe6ee5,af56d9b391df4d05182c1ac7703ccae3afd94afc5bb84f5c5ca41f8ac52892df,screening-03,main,TUMFTM/laptime-simulation,TUM - Institute of Automotive Technology,2020,GitHub repository,NR,https://github.com/TUMFTM/laptime-simulation,software repository
A-C0194-03,C0194,a85bf7ebe126ec25231df1dd033c912f60f17256840b637b65ac1d467fdbdf4a,af56d9b391df4d05182c1ac7703ccae3afd94afc5bb84f5c5ca41f8ac52892df,screening-03,main,PyFlyt -- UAV Simulation Environments for Reinforcement Learning Research,Jun Jet Tai; Jim Wong; Mauro Innocente; Nadjim Horri; James Brusey; Swee King Phang,2023,arXiv,10.48550/arxiv.2304.01305,https://arxiv.org/abs/2304.01305,preprint
A-C0199-03,C0199,100ace81ea566905d0ff581eba0f4effdfaec5c9f9562b1c8bbf4f5828d44dbc,af56d9b391df4d05182c1ac7703ccae3afd94afc5bb84f5c5ca41f8ac52892df,screening-03,main,Robot Parkour Learning,Ziwen Zhuang; Zipeng Fu; Jianren Wang; Christopher G. Atkeson; Sören Schwertfeger; Chelsea Finn; Hang Zhao,2023,Proceedings of The 7th Conference on Robot Learning,NR,https://proceedings.mlr.press/v229/zhuang23a.html,conference paper
A-C0201-03,C0201,005b3376144a0daea39786fd6f4b9eb92576853447c46c645d05b606a1f23615,af56d9b391df4d05182c1ac7703ccae3afd94afc5bb84f5c5ca41f8ac52892df,screening-03,main,SailBot 2022 Events,SailBot Organizing Committee,2022,SailBot official competition event specification,NR,https://www.sailbot.org/wp-content/uploads/2022/05/SailBot-2022-Events.pdf,official competition specification
A-C0207-03,C0207,bad8b44fefa04ff665c59486754ecee46f0109d8322101bcdefcfad8d3163aef,af56d9b391df4d05182c1ac7703ccae3afd94afc5bb84f5c5ca41f8ac52892df,screening-03,main,VRX Competition Technical Guide: Virtual RobotX 2022 Competition,RoboNation; Open Robotics,2021,Virtual RobotX 2022 competition documentation,NR,https://robonation.org/app/uploads/sites/2/2021/11/VRX2022_Technical-Guide_v1.1.pdf,official competition documentation; official repository
