candidate_id,input_sha256,snapshot_sha256,primary_snapshot_sha256,assignment_ids,adjudicator_id,reviewer_ids,decided_on,screening_status,criterion,access_status,source_urls,evidence_version,evidence_retrieved_on,evidence_archive_url,evidence_sha256,screening_locator,exclusion_reason,resolution_evidence,resolved_conflict_ids,notes
C0073,a39c55a6670c95ae63c5e4e3c6e2f7b71e88bebde12e3c9fade3fb0c3e8e8714,c0977ed07d0c0bb25ea3a6be52e377f86d10bf3fff91d6bdccd389395e842c07,4c3c7b94db4f0cab66f00e4c2f9ada1198f700b0ad9857f19b8b4fee1dd7f212,A-C0073-01;A-C0073-04,adjudication-01,screening-01;screening-04,2026-07-06,excluded,exclude-insufficient-detail,full_text,https://proceedings.mlr.press/v87/kaufmann18a/kaufmann18a.pdf,PMLR volume 87 (CoRL 2018),2026-07-06,NR,9be82e11d0c3d2ee4c9d1cb745a62c27131f4e804fd73a12f192d2d2a203d48d,PDF p. 3; Section 3.1 Training procedure; PDF p. 3; Dynamic environments,"The report says training layouts are made by slightly moving gates, but it does not define a reusable course-generation procedure, representation, or retained interface beyond control of supplied race tracks.","{""comparison_analysis"":""C0073 received exclude-fixed-racing-line and exclude-out-of-scope, whereas both locked reviewers assessed excluded. The paper's gate-layout variation merely supports training a flight policy: it does not define how layouts are parameterized, serialized, validated, or made reusable. Its central method predicts waypoints and commands during traversal. Because the packet mentions layout variation yet lacks sufficient details for a survey claim, exclude-insufficient-detail is more precise than either raw criterion."",""controlling_rules"":[""A2""],""deciding_fact"":{""kind"":""exclusion_reason"",""text"":""The report says training layouts are made by slightly moving gates, but it does not define a reusable course-generation procedure, representation, or retained interface beyond control of supplied race tracks.""},""deciding_locator"":""PDF p. 3; Section 3.1 Training procedure; PDF p. 3; Dynamic environments"",""final_decision"":{""criterion"":""exclude-insufficient-detail"",""screening_status"":""excluded""},""raw_exclusion_reasons"":[],""raw_ratings"":[{""assignment_id"":""A-C0073-01"",""criterion"":""exclude-fixed-racing-line"",""screening_status"":""excluded""},{""assignment_id"":""A-C0073-04"",""criterion"":""exclude-out-of-scope"",""screening_status"":""excluded""}],""resolved_conflicts"":[],""schema_version"":""1"",""source_url"":""https://proceedings.mlr.press/v87/kaufmann18a/kaufmann18a.pdf""}",NR,NR
C0098,e3f0657df14bf1555b173f7982ef6a4ff60618c4e335f2d56f5db0ac9cfeb19d,c0977ed07d0c0bb25ea3a6be52e377f86d10bf3fff91d6bdccd389395e842c07,4c3c7b94db4f0cab66f00e4c2f9ada1198f700b0ad9857f19b8b4fee1dd7f212,A-C0098-03;A-C0098-04,adjudication-01,screening-03;screening-04,2026-07-06,excluded,exclude-out-of-scope,official_documentation,https://www.openstreetmap.org/about,OpenStreetMap About page snapshot 2026-07-06,2026-07-06,https://www.openstreetmap.org/about,b40a85c003a30a0e2c0904cb2b03e6cfd9ad74af988f22b12a24e96d139a460f,HTML #open-data; paragraphs 1-2,"The frozen About page states only that OpenStreetMap is open data under licensing terms and provides no map schema, route or road representation, generator, benchmark, or supporting transfer fact.","{""comparison_analysis"":""C0098 received exclude-insufficient-detail and exclude-out-of-scope, whereas both locked reviewers assessed excluded. The frozen About page supplies only licensing language declaring OpenStreetMap open data. It contains neither a data schema nor any documented route, road, map, level, or test-input construction. Since the packet establishes no eligibility-bearing technical property rather than an incomplete description of one, exclude-out-of-scope is the direct result."",""controlling_rules"":[""A2""],""deciding_fact"":{""kind"":""exclusion_reason"",""text"":""The frozen About page states only that OpenStreetMap is open data under licensing terms and provides no map schema, route or road representation, generator, benchmark, or supporting transfer fact.""},""deciding_locator"":""HTML #open-data; paragraphs 1-2"",""final_decision"":{""criterion"":""exclude-out-of-scope"",""screening_status"":""excluded""},""raw_exclusion_reasons"":[],""raw_ratings"":[{""assignment_id"":""A-C0098-03"",""criterion"":""exclude-insufficient-detail"",""screening_status"":""excluded""},{""assignment_id"":""A-C0098-04"",""criterion"":""exclude-out-of-scope"",""screening_status"":""excluded""}],""resolved_conflicts"":[],""schema_version"":""1"",""source_url"":""https://www.openstreetmap.org/about""}",NR,NR
C0131,650909ec33a0048c1346ffcd70e0ed11b8c54d64a701e0c56eb9cadec45c6bec,c0977ed07d0c0bb25ea3a6be52e377f86d10bf3fff91d6bdccd389395e842c07,4c3c7b94db4f0cab66f00e4c2f9ada1198f700b0ad9857f19b8b4fee1dd7f212,A-C0131-02;A-C0131-04,adjudication-01,screening-02;screening-04,2026-07-06,included,include-relevant,official_documentation,https://github.com/ntnu-arl/aerial_gym/blob/v2.0.0/docs/2_simulation_components.md,Aerial-Gym-v2.0.0,2026-07-02,NR,af05e2c0e11366a6b85cabfb94e398979f03ae16a5365d5b3195a68c24f5b267,"repository path docs/2_simulation_components.md, lines 66-83; Section Environments, lines 121-123",NR,"{""comparison_analysis"":""C0131 received excluded with exclude-out-of-scope and included with include-relevant, whereas the frozen documentation directly specifies random asset selection, position ratios, and spawning with randomized obstacle positions within environment bounds. Those configurable spatial obstacles are a source-native adjacent level/test-input generator, not merely appearance randomization. Mapping the bounded obstacle layouts to aerial course geometry preserves the environment-configuration claim, so the documented generator satisfies retention."",""controlling_rules"":[""A1"",""A2""],""deciding_fact"":{""kind"":""transfer_source_fact"",""text"":""The documentation specifies random asset selection, asset-position ratios, and an environment strategy that spawns and randomizes obstacle positions within configured bounds.""},""deciding_locator"":""repository path docs/2_simulation_components.md, lines 66-83; Section Environments, lines 121-123"",""final_decision"":{""criterion"":""include-relevant"",""screening_status"":""included""},""raw_exclusion_reasons"":[],""raw_ratings"":[{""assignment_id"":""A-C0131-02"",""criterion"":""exclude-out-of-scope"",""screening_status"":""excluded""},{""assignment_id"":""A-C0131-04"",""criterion"":""include-relevant"",""screening_status"":""included""}],""resolved_conflicts"":[],""schema_version"":""1"",""source_url"":""https://github.com/ntnu-arl/aerial_gym/blob/v2.0.0/docs/2_simulation_components.md""}",NR,Transferable mapping: source-native obstacle selection and bounded position randomization form adjacent-domain level/test-input generation that maps to parameterized aerial course geometry and obstacle constraints.
C0140,f3e8eba599c3d9ec3570f5feacad61cf226eb5d0e92d0eec62fe1ecf9d2fbb65,c0977ed07d0c0bb25ea3a6be52e377f86d10bf3fff91d6bdccd389395e842c07,4c3c7b94db4f0cab66f00e4c2f9ada1198f700b0ad9857f19b8b4fee1dd7f212,A-C0140-01;A-C0140-05,adjudication-01,screening-01;screening-05,2026-07-06,included,include-relevant,full_text,https://arxiv.org/pdf/2309.14341v1,arXiv-2309.14341v1,2026-07-02,NR,50f1cf2b73b9147111100994d1dfffbfd15a9a6c2412aee1921d4d3e58ee2285,PDF p. 6; Section 3.2; PDF p. 8; Section 4.3.1; Table 2,NR,"{""comparison_analysis"":""C0140 received included with include-relevant and excluded with exclude-insufficient-detail, whereas the bound full report explicitly creates several obstacle terrains in increasing difficulty and evaluates ordered waypoint courses using displacement and edge-violation measures. This establishes an adjacent-domain course progression and reusable traversal metrics, rather than a bare mention of terrain. The complete frozen PDF contains the cited technical sections, so retained supporting evidence is sufficient."",""controlling_rules"":[""A1"",""A2""],""deciding_fact"":{""kind"":""transfer_source_fact"",""text"":""The report creates ramps, gaps, hurdles, and high-step terrains in increasing difficulty, and evaluates waypoint obstacle courses with mean displacement and mean edge-violation metrics.""},""deciding_locator"":""PDF p. 6; Section 3.2; PDF p. 8; Section 4.3.1; Table 2"",""final_decision"":{""criterion"":""include-relevant"",""screening_status"":""included""},""raw_exclusion_reasons"":[],""raw_ratings"":[{""assignment_id"":""A-C0140-01"",""criterion"":""include-relevant"",""screening_status"":""included""},{""assignment_id"":""A-C0140-05"",""criterion"":""exclude-insufficient-detail"",""screening_status"":""excluded""}],""resolved_conflicts"":[],""schema_version"":""1"",""source_url"":""https://arxiv.org/pdf/2309.14341v1""}",NR,Supporting mapping: its ordered obstacle-course difficulty progression plus mean displacement and mean edge violation map to course-generator difficulty and traversal-validity evaluation.
C0143,efb402cd3856f8f21483b758dc068d35771916cf0c1b0e47b2e02317271e9bc6,c0977ed07d0c0bb25ea3a6be52e377f86d10bf3fff91d6bdccd389395e842c07,4c3c7b94db4f0cab66f00e4c2f9ada1198f700b0ad9857f19b8b4fee1dd7f212,A-C0143-02;A-C0143-06,adjudication-01,screening-02;screening-06,2026-07-06,included,include-relevant,full_text,https://arxiv.org/abs/2205.11060,arXiv:2205.11060v1,2026-07-06,NR,d7965979d29824c35dd84cb6a784092e404839d2776b8e349ddc4236f55aecd8,PDF p. 1; Abstract and Section 1 Introduction; PDF p. 2; Section 2.1 Feature Representation,NR,"{""comparison_analysis"":""C0143's two locked reviewers both returned included and include-relevant, whereas unresolved conflict X57B57E64E501 records historical candidate versus excluded values that must be resolved atomically. The bound paper describes WGAN-based road-test generation and a feature representation of road geometry and curvature. That source-native adjacent road generator maps directly to parameterized robot-course centerlines, so the locked inclusion is retained and the coordinator conflict is resolved."",""controlling_rules"":[""A4""],""deciding_fact"":{""kind"":""transfer_source_fact"",""text"":""The report uses a Wasserstein generative adversarial network to generate road test cases from feature representations that encode road geometry and curvature.""},""deciding_locator"":""PDF p. 1; Abstract and Section 1 Introduction; PDF p. 2; Section 2.1 Feature Representation"",""final_decision"":{""criterion"":""include-relevant"",""screening_status"":""included""},""raw_exclusion_reasons"":[],""raw_ratings"":[{""assignment_id"":""A-C0143-02"",""criterion"":""include-relevant"",""screening_status"":""included""},{""assignment_id"":""A-C0143-06"",""criterion"":""include-relevant"",""screening_status"":""included""}],""resolved_conflicts"":[{""conflict_id"":""X57B57E64E501"",""field"":""screening_status"",""value_a"":""candidate"",""value_b"":""excluded""}],""schema_version"":""1"",""source_url"":""https://arxiv.org/abs/2205.11060""}",X57B57E64E501,Adjacent-domain mapping: generated road point sequences and curvature representations map to parameterized robot-course centerlines.
C0187,92d86d20559409f5ed826e11f8dc0c7a1d2a06fd37521890816800b6b420ea22,c0977ed07d0c0bb25ea3a6be52e377f86d10bf3fff91d6bdccd389395e842c07,4c3c7b94db4f0cab66f00e4c2f9ada1198f700b0ad9857f19b8b4fee1dd7f212,A-C0187-02;A-C0187-04,adjudication-01,screening-02;screening-04,2026-07-06,excluded,exclude-out-of-scope,official_documentation,https://byu-holoocean.github.io/holoocean-docs/v1.0.0/usage/scenarios.html,HoloOcean-v1.0.0,2026-07-02,NR,d1c51cac66c5dd9ebb83402605a2815dae24eeb5642eea950e598ac356284961,official documentation anchor #what-is-a-scenario; #scenario-file-format; #location-randomization,"The scenario schema loads a pre-existing world and randomizes only agents' start location or rotation; it neither defines nor changes a route, course, gate, buoy, or course-generation interface.","{""comparison_analysis"":""C0187 received excluded with exclude-out-of-scope and included with include-relevant, whereas the scenario documentation says that a scenario loads a world, places agents, and may randomize only their start locations or rotations. It expressly leaves the underlying world or map unchanged. These agent and sensor settings do not supply an ordered marine course, a course representation, or a retained simulator-course property, so exclusion governs."",""controlling_rules"":[""A1"",""A2""],""deciding_fact"":{""kind"":""exclusion_reason"",""text"":""The scenario schema loads a pre-existing world and randomizes only agents' start location or rotation; it neither defines nor changes a route, course, gate, buoy, or course-generation interface.""},""deciding_locator"":""official documentation anchor #what-is-a-scenario; #scenario-file-format; #location-randomization"",""final_decision"":{""criterion"":""exclude-out-of-scope"",""screening_status"":""excluded""},""raw_exclusion_reasons"":[],""raw_ratings"":[{""assignment_id"":""A-C0187-02"",""criterion"":""exclude-out-of-scope"",""screening_status"":""excluded""},{""assignment_id"":""A-C0187-04"",""criterion"":""include-relevant"",""screening_status"":""included""}],""resolved_conflicts"":[],""schema_version"":""1"",""source_url"":""https://byu-holoocean.github.io/holoocean-docs/v1.0.0/usage/scenarios.html""}",NR,NR
C0188,b77c5f90dc49df8d4633bfbd084023ce847eebcee223f3d2eb0a154b81d1219c,c0977ed07d0c0bb25ea3a6be52e377f86d10bf3fff91d6bdccd389395e842c07,4c3c7b94db4f0cab66f00e4c2f9ada1198f700b0ad9857f19b8b4fee1dd7f212,A-C0188-02;A-C0188-05,adjudication-01,screening-02;screening-05,2026-07-06,included,include-relevant,official_documentation,https://isaac-sim.github.io/IsaacLab/main/_modules/isaaclab/terrains/terrain_generator.html,Isaac Lab documentation 2.3.2,2026-07-06,https://isaac-sim.github.io/IsaacLab/v2.3.2/_modules/isaaclab/terrains/terrain_generator.html,d0aa981cff7add4fee5a9bcc6e00725da20ec3fffe3c032e4ea3e4de8419f0ec,Documentation anchor #TerrainGenerator; source code lines 634-688; source code lines 821-840,NR,"{""comparison_analysis"":""C0188 received included with include-relevant and excluded with exclude-out-of-scope, whereas the versioned source code defines a terrain generator that constructs mesh terrains, selects random or curriculum difficulty, and lays out subterrain by grid position. This is source-native adjacent level generation with explicit spatial representation and parameters. Mapping those meshes, origins, and difficulty values into a ground-racing course level preserves the technical claim, so inclusion is warranted."",""controlling_rules"":[""A1"",""A2""],""deciding_fact"":{""kind"":""transfer_source_fact"",""text"":""TerrainGenerator creates terrain meshes from height fields or generator functions, samples or curricula their difficulty, and places subterrain meshes by row and column.""},""deciding_locator"":""Documentation anchor #TerrainGenerator; source code lines 634-688; source code lines 821-840"",""final_decision"":{""criterion"":""include-relevant"",""screening_status"":""included""},""raw_exclusion_reasons"":[],""raw_ratings"":[{""assignment_id"":""A-C0188-02"",""criterion"":""include-relevant"",""screening_status"":""included""},{""assignment_id"":""A-C0188-05"",""criterion"":""exclude-out-of-scope"",""screening_status"":""excluded""}],""resolved_conflicts"":[],""schema_version"":""1"",""source_url"":""https://isaac-sim.github.io/IsaacLab/main/_modules/isaaclab/terrains/terrain_generator.html""}",NR,"Transferable mapping: generated terrain meshes, per-subterrain origins, and difficulty parameters map to a parameterized ground-racing course level without changing the terrain-generation claim."
C0203,5ea86ffb191b9180dcebab390b2880aadf9b83e1dabbcf40cc53220384831d18,c0977ed07d0c0bb25ea3a6be52e377f86d10bf3fff91d6bdccd389395e842c07,4c3c7b94db4f0cab66f00e4c2f9ada1198f700b0ad9857f19b8b4fee1dd7f212,A-C0203-01;A-C0203-04,adjudication-01,screening-01;screening-04,2026-07-06,included,include-relevant,official_documentation,https://gazebosim.org/docs/harmonic/sdf_worlds/,Gazebo Harmonic documentation,2026-07-06,https://gazebosim.org/docs/harmonic/sdf_worlds/,74e40502aa45901ec1066dd551632190ce7643ed2bb23113c27590d182c92da1,official documentation anchor #defining-a-world; official documentation anchor #adding-models,NR,"{""comparison_analysis"":""C0203 received included with include-relevant and excluded with exclude-out-of-scope, whereas the Harmonic documentation defines an SDF world container and the procedure for adding models to that world. The resulting serializable simulator-world interface can represent placed corridor, gate, and obstacle elements without recasting the source as a generator. This is a concrete transferable representation property, so inclusion is supported."",""controlling_rules"":[""A1"",""A2""],""deciding_fact"":{""kind"":""transfer_source_fact"",""text"":""The SDF tutorial defines a versioned world container and documents adding models to it, furnishing a serializable simulator-world interface for positioned course elements.""},""deciding_locator"":""official documentation anchor #defining-a-world; official documentation anchor #adding-models"",""final_decision"":{""criterion"":""include-relevant"",""screening_status"":""included""},""raw_exclusion_reasons"":[],""raw_ratings"":[{""assignment_id"":""A-C0203-01"",""criterion"":""include-relevant"",""screening_status"":""included""},{""assignment_id"":""A-C0203-04"",""criterion"":""exclude-out-of-scope"",""screening_status"":""excluded""}],""resolved_conflicts"":[],""schema_version"":""1"",""source_url"":""https://gazebosim.org/docs/harmonic/sdf_worlds/""}",NR,"Supporting mapping: SDF world and model definitions serialize a simulator course layout by placing corridor, gate, and obstacle models; it is a representation interface, not a generation method."
