assignment_id,candidate_id,input_sha256,snapshot_sha256,batch_id,phase,title,authors,year,venue,doi,url,source_type
A-C0017-02,C0017,48f8b3d4f29fa3e5f34853686cdce0e4b2e65ea7faf67da709f73b907f1db051,af56d9b391df4d05182c1ac7703ccae3afd94afc5bb84f5c5ca41f8ac52892df,screening-02,calibration,Car Racing,Oleg Klimov,NR,Gymnasium Documentation,NR,https://gymnasium.farama.org/environments/box2d/car_racing/,benchmark environment; official documentation
A-C0090-02,C0090,d4e9b17d4b6448293c25383eb658283b7c06f84756bd82e54bc5a66c2a68b701,af56d9b391df4d05182c1ac7703ccae3afd94afc5bb84f5c5ca41f8ac52892df,screening-02,calibration,Driverless Intelligent Vehicles Lab,Carnegie Mellon University Robotics Institute,2024,Robotics Institute Carnegie Mellon University,NR,https://www.ri.cmu.edu/robotics-groups/driverless-intelligent-vehicles-lab/,official lab documentation; research lab
A-C0110-02,C0110,e86a2e333f840b3d7dd45dc3a9a2236167dbfbaaefcf6e57fb0fa7ab58713799,af56d9b391df4d05182c1ac7703ccae3afd94afc5bb84f5c5ca41f8ac52892df,screening-02,calibration,CRAG – a combinatorial testing-based generator of road geometries for ADS testing,Paolo Arcaini; Ahmet Cetinkaya,2024,Science of Computer Programming,10.1016/j.scico.2024.103171,https://www.sciencedirect.com/science/article/pii/S0167642324000947,journal article
A-C0131-02,C0131,6aa3956a188f64b3a02f150bbea96717cbd874ee2e666d1ed6cf6b64f032280f,af56d9b391df4d05182c1ac7703ccae3afd94afc5bb84f5c5ca41f8ac52892df,screening-02,calibration,Aerial Gym Simulator: A Framework for Highly Parallelized Simulation of Aerial Robots,Mihir Kulkarni;Welf Rehberg;Kostas Alexis,2025,IEEE Robotics and Automation Letters,10.1109/lra.2025.3548507,https://doi.org/10.1109/lra.2025.3548507,journal article
A-C0172-02,C0172,74d8e551d818135be7f11dbd606a772543cf1aca4a129c2864523b0a91f28a6f,af56d9b391df4d05182c1ac7703ccae3afd94afc5bb84f5c5ca41f8ac52892df,screening-02,calibration,"ASAM OpenSCENARIO® XML BS 1.3.0 Specification, 2024-03-07",ASAM e.V.,2024,ASAM standard,NR,https://publications.pages.asam.net/standards/ASAM_OpenSCENARIO/ASAM_OpenSCENARIO_XML/v1.3.0/index.html,standard; official specification
A-C0177-02,C0177,6e59172665b9890fa1fa8006852e12e584df16420b38fa699263f56c6d7fc720,af56d9b391df4d05182c1ac7703ccae3afd94afc5bb84f5c5ca41f8ac52892df,screening-02,calibration,Enhanced POET: Open-ended Reinforcement Learning through Unbounded Invention of Learning Challenges and their Solutions,Rui Wang; Joel Lehman; Aditya Rawal; Jiale Zhi; Yulun Li; Jeffrey Clune; Kenneth Stanley,2020,Proceedings of the 37th International Conference on Machine Learning,NR,https://proceedings.mlr.press/v119/wang20l.html,conference paper
A-C0180-02,C0180,139f12501f24748d79ade03c898f36ad4bf3bb521c266d42ae1c1e8adb0cc77d,af56d9b391df4d05182c1ac7703ccae3afd94afc5bb84f5c5ca41f8ac52892df,screening-02,calibration,F1TENTH: An Open-source Evaluation Environment for Continuous Control and Reinforcement Learning,Matthew O'Kelly; Hongrui Zheng; Dhruv Karthik; Rahul Mangharam,2020,Proceedings of the NeurIPS 2019 Competition and Demonstration Track,NR,https://proceedings.mlr.press/v123/o-kelly20a.html,conference paper; official software
A-C0187-02,C0187,e43727a46aaaf2fcc69cf76dade159e0b35c403204f2079379e0d8af2f2bfa03,af56d9b391df4d05182c1ac7703ccae3afd94afc5bb84f5c5ca41f8ac52892df,screening-02,calibration,HoloOcean 1.0.0: Scenarios,BYU FRoStLab,NR,HoloOcean 1.0.0 official documentation,NR,https://byu-holoocean.github.io/holoocean-docs/v1.0.0/usage/scenarios.html,official documentation
A-C0198-02,C0198,fb013458f174398cbc644248620f92e3222f1d1292de06eb8d72f67904984c3b,af56d9b391df4d05182c1ac7703ccae3afd94afc5bb84f5c5ca41f8ac52892df,screening-02,calibration,RoboBoat 2026 | Team Handbook,RoboNation,2026,RoboBoat official handbook,NR,https://robonation.org/app/uploads/sites/3/2025/10/RoboBoat-2026-Team-Handbook_111125.pdf,official competition specification
