assignment_id,candidate_id,input_sha256,snapshot_sha256,batch_id,phase,title,authors,year,venue,doi,url,source_type
A-C0011-03,C0011,bf0c18c88d755766762ba324d0ee78b07cac4785d5841de27583e22d82406302,a57cb89fd689d156d04c0b7ec8c95a90edeb0d360589ea01cb39ce04c82e4d4e,screening-03,calibration,Search-based Procedural Content Generation for Race Tracks in Video Games,Hafizh Adi Prasetya; Nur Ulfa Maulidevi,2016,International Journal on Electrical Engineering and Informatics,10.15676/ijeei.2016.8.4.6,https://doi.org/10.15676/ijeei.2016.8.4.6,journal article
A-C0025-03,C0025,9b56ea61d6861a51fd3c2940511ef1b9bf42b34a77c9e2b20fa88b7f86361049,a57cb89fd689d156d04c0b7ec8c95a90edeb0d360589ea01cb39ce04c82e4d4e,screening-03,calibration,AirSim Drone Racing Lab,Ratnesh Madaan; Nicholas Gyde; Sai Vemprala; Matthew Brown; Keiko Nagami; Tim Taubner; Eric Cristofalo; Davide Scaramuzza; Mac Schwager; Ashish Kapoor,2020,Proceedings of the NeurIPS 2019 Competition and Demonstration Track,NR,https://proceedings.mlr.press/v123/madaan20a.html,conference paper
A-C0046-03,C0046,aec65454cdfe6597b38d481fea5ae6a999a28fad5264922bf5f08bd981c4712e,a57cb89fd689d156d04c0b7ec8c95a90edeb0d360589ea01cb39ce04c82e4d4e,screening-03,calibration,MetaDrive: Composing Diverse Driving Scenarios for Generalizable Reinforcement Learning,Quanyi Li; Zhenghao Peng; Lan Feng; Qihang Zhang; Zhenghai Xue; Bolei Zhou,2023,IEEE Transactions on Pattern Analysis and Machine Intelligence,10.1109/tpami.2022.3190471,https://doi.org/10.1109/tpami.2022.3190471,journal article
A-C0063-03,C0063,6dd04aaf421191408960759ccc51d1c784d1c9db9d72c96c2babf534b7fbaa8c,a57cb89fd689d156d04c0b7ec8c95a90edeb0d360589ea01cb39ce04c82e4d4e,screening-03,calibration,TrackGen,Antoine Richard,2026,GitHub repository,NR,https://github.com/AntoineRichard/TrackGen,software repository
A-C0134-03,C0134,a2f5adea36cbc95b7f6c9f1a344b0c5369a20106c7a6fe6fd59ea267fb501030,a57cb89fd689d156d04c0b7ec8c95a90edeb0d360589ea01cb39ce04c82e4d4e,screening-03,calibration,RoadSign at the SBFT 2023 Tool Competition Cyber-Physical Systems Track,Jon Ayerdi; Aitor Arrieta; Miren Illarramendi,2023,2023 IEEE/ACM International Workshop on Search-Based and Fuzz Testing (SBFT),10.1109/sbft59156.2023.00006,https://doi.org/10.1109/sbft59156.2023.00006,conference paper; tool paper
A-C0147-03,C0147,092bd6b5d78be8d5af0184cd0fabcf4c345d369d3cc257c68cc97315fc9f63fe,a57cb89fd689d156d04c0b7ec8c95a90edeb0d360589ea01cb39ce04c82e4d4e,screening-03,calibration,Toward Maritime Robotic Simulation in Gazebo,Brian Bingham;Carlos Agüero;Michael McCarrin;Joseph Klamo;Joshua Malia;Kevin Allen;Tyler Lum;Marshall Rawson;Rumman Waqar,2019,OCEANS 2019 MTS/IEEE SEATTLE,10.23919/oceans40490.2019.8962724,https://doi.org/10.23919/oceans40490.2019.8962724,conference paper
A-C0175-03,C0175,5660a77c4116ce80fa4972bd7552a863a266a17c6214d0f6c5ce2127bc9a0157,a57cb89fd689d156d04c0b7ec8c95a90edeb0d360589ea01cb39ce04c82e4d4e,screening-03,calibration,CARLA Autonomous Driving Leaderboard 2.0,CARLA Leaderboard Team,NR,CARLA Leaderboard documentation and repositories,NR,https://leaderboard.carla.org/get_started_v2_0/,benchmark; official documentation; official repository
